placement,group,comp,grp_count,grp_placement,mode
4,-1,"AurelionSol, Jayce, Pantheon, Rakan, Seraphine, Yasuo, Zyra",,4.8,"AoShin, DragonGold, DragonGreen, Rakan, Shyvana"
4,-1,"DragonEarth, DragonPurple, Pantheon, Seraphine, Soraka, Sylas, Zyra",,4.8,"AoShin, DragonGold, DragonGreen, Rakan, Shyvana"
8,-1,"AurelionSol, Graves, Rakan, Seraphine, Zac, Zeri, Zyra",,4.8,"AoShin, DragonGold, DragonGreen, Rakan, Shyvana"
5,-1,"Hecarim, Jayce, Lillia, Rakan, Twitch, Varus, Xayah",,4.8,"AoShin, DragonGold, DragonGreen, Rakan, Shyvana"
5,-1,"AurelionSol, Bard, DragonPurple, Lux, Sylas, Zoe",,4.8,"AoShin, DragonGold, DragonGreen, Rakan, Shyvana"
5,-1,"Aphelios, Bard, Diana, DragonSwain, Rell, Rengar, Yasuo, Yone",,4.8,"AoShin, DragonGold, DragonGreen, Rakan, Shyvana"
5,-1,"Jayce, Kaisa, LeeSin, Nunu, TFT7b_Volibear",,4.8,"AoShin, DragonGold, DragonGreen, Rakan, Shyvana"
5,-1,"Bard, DragonBlue, Hecarim, Jayce, Nunu, Shyvana, Yasuo",,4.8,"AoShin, DragonGold, DragonGreen, Rakan, Shyvana"
5,-1,"AoShin, DragonPurple, Pantheon, Soraka, Sylas, Zyra",,4.8,"AoShin, DragonGold, DragonGreen, Rakan, Shyvana"
5,-1,"Aphelios, Graves, Hecarim, Jayce, Rell, Zeri",,4.8,"AoShin, DragonGold, DragonGreen, Rakan, Shyvana"
5,-1,"Bard, Graves, Hecarim, Nilah, Nunu, Qiyana, Rakan, Seraphine",,4.8,"AoShin, DragonGold, DragonGreen, Rakan, Shyvana"
5,-1,"Braum, Jax, Olaf, Rakan, Yasuo, Yone",,4.8,"AoShin, DragonGold, DragonGreen, Rakan, Shyvana"
5,-1,"AurelionSol, Bard, Lux, Soraka, Sylas",,4.8,"AoShin, DragonGold, DragonGreen, Rakan, Shyvana"
5,-1,"AoShin, Bard, DragonBlue, DragonGold, LeeSin",,4.8,"AoShin, DragonGold, DragonGreen, Rakan, Shyvana"
5,-1,"Diana, Lillia, Qiyana, Rell, Rengar",,4.8,"AoShin, DragonGold, DragonGreen, Rakan, Shyvana"
5,-1,"AquaticDragon, DragonGold, NomsyMage, Sylas, Zoe, TFT7b_Heimerdinger",,4.8,"AoShin, DragonGold, DragonGreen, Rakan, Shyvana"
4,-1,"Diana, Lillia, Olaf, Pantheon, Rell, Sylas, Yasuo, Yone",,4.8,"AoShin, DragonGold, DragonGreen, Rakan, Shyvana"
5,-1,"AoShin, Diana, Graves, LeeSin, Nilah, Qiyana, Rakan",,4.8,"AoShin, DragonGold, DragonGreen, Rakan, Shyvana"
4,-1,"AoShin, Bard, DragonGold, DragonGreen, Gnar, Rakan",,4.8,"AoShin, DragonGold, DragonGreen, Rakan, Shyvana"
4,-1,"AquaticDragon, AurelionSol, Rakan, Sylas, Zac, Zoe",,4.8,"AoShin, DragonGold, DragonGreen, Rakan, Shyvana"
4,-1,"AoShin, Bard, DragonEarth, DragonPurple, Pantheon",,4.8,"AoShin, DragonGold, DragonGreen, Rakan, Shyvana"
4,-1,"AquaticDragon, DragonEarth, DragonGold, NomsyMage, Zoe, TFT7b_Heimerdinger",,4.8,"AoShin, DragonGold, DragonGreen, Rakan, Shyvana"
4,-1,"AurelionSol, Bard, Hecarim, Nunu, Rell, Seraphine, Yasuo, Zyra",,4.8,"AoShin, DragonGold, DragonGreen, Rakan, Shyvana"
4,-1,"AoShin, DragonGold, DragonGreen, Rakan, Shyvana, Zoe",,4.8,"AoShin, DragonGold, DragonGreen, Rakan, Shyvana"
4,-1,"DragonGreen, Jax, Pantheon, Seraphine, Yasuo, Zyra",,4.8,"AoShin, DragonGold, DragonGreen, Rakan, Shyvana"
4,-1,"Lux, Shyvana, Sylas, Varus",,4.8,"AoShin, DragonGold, DragonGreen, Rakan, Shyvana"
4,-1,"Graves, Hecarim, Jax, Nilah, Seraphine, Varus",,4.8,"AoShin, DragonGold, DragonGreen, Rakan, Shyvana"
4,-1,"DragonGold, NomsyCannoneer, Rakan, Soraka, Zeri, TFT7b_Tristana",,4.8,"AoShin, DragonGold, DragonGreen, Rakan, Shyvana"
4,-1,"Hecarim, LeeSin, Qiyana, Twitch, Yasuo, TFT7b_Volibear",,4.8,"AoShin, DragonGold, DragonGreen, Rakan, Shyvana"
4,-1,"AquaticDragon, NomsyMage, Soraka, Sylas, Zoe, TFT7b_Heimerdinger",,4.8,"AoShin, DragonGold, DragonGreen, Rakan, Shyvana"
4,-1,"Bard, NomsyEvoker, Pantheon, Seraphine, Soraka, Sylas, Zyra, TFT7b_Lulu",,4.8,"AoShin, DragonGold, DragonGreen, Rakan, Shyvana"
4,-1,"Bard, DragonGold, Rakan, Seraphine, Soraka, Twitch, Xayah",,4.8,"AoShin, DragonGold, DragonGreen, Rakan, Shyvana"
4,-1,"Braum, DragonGreen, Jax, Olaf, TFT7b_Volibear",,4.8,"AoShin, DragonGold, DragonGreen, Rakan, Shyvana"
4,-1,"AurelionSol, Bard, DragonEarth, DragonGreen, Rakan, Shyvana",,4.8,"AoShin, DragonGold, DragonGreen, Rakan, Shyvana"
4,-1,"Braum, Graves, Olaf, Pantheon, Sylas, Yasuo, Yone",,4.8,"AoShin, DragonGold, DragonGreen, Rakan, Shyvana"
4,-1,"Bard, Kaisa, LeeSin, Qiyana, Yasuo, TFT7b_Volibear",,4.8,"AoShin, DragonGold, DragonGreen, Rakan, Shyvana"
4,-1,"AurelionSol, DragonEarth, DragonGold, Rakan, Shyvana, Soraka",,4.8,"AoShin, DragonGold, DragonGreen, Rakan, Shyvana"
5,-1,"DragonBlue, DragonEarth, Hecarim, Nilah, Nunu",,4.8,"AoShin, DragonGold, DragonGreen, Rakan, Shyvana"
5,-1,"DragonGuild, Gnar, Jayce, Twitch, Varus",,4.8,"AoShin, DragonGold, DragonGreen, Rakan, Shyvana"
5,-1,"Bard, Graves, Jayce, Rakan, Seraphine, Shyvana, Zeri",,4.8,"AoShin, DragonGold, DragonGreen, Rakan, Shyvana"
5,-1,"DragonEarth, Lux, Sylas, Varus",,4.8,"AoShin, DragonGold, DragonGreen, Rakan, Shyvana"
5,-1,"Braum, Graves, Hecarim, Jax, Seraphine, Varus, Yasuo",,4.8,"AoShin, DragonGold, DragonGreen, Rakan, Shyvana"
5,-1,"Hecarim, Lillia, Lux, Nunu, Sylas, Zoe, Zyra",,4.8,"AoShin, DragonGold, DragonGreen, Rakan, Shyvana"
5,-1,"AoShin, DragonBlue, DragonEarth, DragonGold",,4.8,"AoShin, DragonGold, DragonGreen, Rakan, Shyvana"
5,-1,"AquaticDragon, Hecarim, Lillia, Lux, Sylas, Zoe",,4.8,"AoShin, DragonGold, DragonGreen, Rakan, Shyvana"
5,-1,"Bard, Lux, Soraka, Sylas, Varus, Zoe",,4.8,"AoShin, DragonGold, DragonGreen, Rakan, Shyvana"
5,-1,"Graves, Hecarim, Jax, Jayce, Nilah, Soraka, Zyra",,4.8,"AoShin, DragonGold, DragonGreen, Rakan, Shyvana"
5,-1,"Bard, DragonGreen, Jax, Kaisa, Rakan, Seraphine",,4.8,"AoShin, DragonGold, DragonGreen, Rakan, Shyvana"
5,-1,"AoShin, DragonEarth, Pantheon, Rakan, Seraphine, Zyra",,4.8,"AoShin, DragonGold, DragonGreen, Rakan, Shyvana"
5,-1,"DragonBlue, DragonGold, Jax, Yasuo, Zoe, TFT7b_Volibear",,4.8,"AoShin, DragonGold, DragonGreen, Rakan, Shyvana"
5,-1,"AoShin, Jax, Rakan, Seraphine, Shyvana, Sylas, Zyra",,4.8,"AoShin, DragonGold, DragonGreen, Rakan, Shyvana"
5,-1,"DragonGreen, Jax, Jayce, LeeSin, Shyvana, TFT7b_Volibear",,4.8,"AoShin, DragonGold, DragonGreen, Rakan, Shyvana"
5,-1,"AquaticDragon, DragonEarth, Seraphine, Zac, Zyra",,4.8,"AoShin, DragonGold, DragonGreen, Rakan, Shyvana"
5,-1,"Hecarim, LeeSin, Xayah",,4.8,"AoShin, DragonGold, DragonGreen, Rakan, Shyvana"
5,-1,"Bard, DragonPurple, NomsyEvoker, Pantheon, Seraphine, Soraka, Sylas, Zyra, TFT7b_Lulu",,4.8,"AoShin, DragonGold, DragonGreen, Rakan, Shyvana"
5,-1,"AoShin, Bard, Graves, Lillia, Lux, Sylas, Yasuo",,4.8,"AoShin, DragonGold, DragonGreen, Rakan, Shyvana"
5,-1,"Hecarim, Lillia, Olaf, Pantheon, Sylas, Yasuo, Yone, Zoe",,4.8,"AoShin, DragonGold, DragonGreen, Rakan, Shyvana"
5,-1,"Kaisa, LeeSin, Rakan, Seraphine, Zac, TFT7b_Volibear",,4.8,"AoShin, DragonGold, DragonGreen, Rakan, Shyvana"
5,-1,"AoShin, Bard, Hecarim, Jayce, Nunu, Rakan",,4.8,"AoShin, DragonGold, DragonGreen, Rakan, Shyvana"
5,-1,"Aphelios, DragonSwain, Rell, Rengar, Twitch, Xayah",,4.8,"AoShin, DragonGold, DragonGreen, Rakan, Shyvana"
5,-1,"DragonEarth, Graves, Hecarim, Jax, Pantheon, Soraka",,4.8,"AoShin, DragonGold, DragonGreen, Rakan, Shyvana"
5,-1,"DragonGreen, DragonPurple, Olaf, Pantheon, Yasuo",,4.8,"AoShin, DragonGold, DragonGreen, Rakan, Shyvana"
5,-1,"DragonGreen, Gnar, Jax, Jayce, Seraphine",,4.8,"AoShin, DragonGold, DragonGreen, Rakan, Shyvana"
5,-1,"AoShin, Aphelios, Bard, Graves, Hecarim, Rell, Soraka, Zeri",,4.8,"AoShin, DragonGold, DragonGreen, Rakan, Shyvana"
5,-1,"DragonGreen, Gnar, Jax, Rakan, Seraphine, Soraka",,4.8,"AoShin, DragonGold, DragonGreen, Rakan, Shyvana"
5,-1,"Bard, DragonGold, Rakan, Seraphine, Yasuo, Zyra, TFT7b_Volibear",,4.8,"AoShin, DragonGold, DragonGreen, Rakan, Shyvana"
5,-1,"DragonBlue, Hecarim, Nunu, Rakan, Sylas, Zoe",,4.8,"AoShin, DragonGold, DragonGreen, Rakan, Shyvana"
5,-1,"Lux, Seraphine, Soraka, Sylas, Zyra",,4.8,"AoShin, DragonGold, DragonGreen, Rakan, Shyvana"
5,-1,"Braum, Graves, Hecarim, Lillia, Olaf, Pantheon, Sylas, Yasuo",,4.8,"AoShin, DragonGold, DragonGreen, Rakan, Shyvana"
5,-1,"Bard, DragonGreen, Gnar, Jax, Rakan, Shyvana, Yasuo",,4.8,"AoShin, DragonGold, DragonGreen, Rakan, Shyvana"
5,-1,"Aphelios, Hecarim, Rell, Rengar",,4.8,"AoShin, DragonGold, DragonGreen, Rakan, Shyvana"
5,-1,"DragonGreen, Gnar, Jax, Jayce, Yasuo",,4.8,"AoShin, DragonGold, DragonGreen, Rakan, Shyvana"
5,-1,"Bard, Lillia, Lux, Seraphine, Sylas, Zyra",,4.8,"AoShin, DragonGold, DragonGreen, Rakan, Shyvana"
5,-1,"DragonPurple, NomsyCannoneer, Pantheon, Soraka, Sylas, Zyra, TFT7b_Tristana",,4.8,"AoShin, DragonGold, DragonGreen, Rakan, Shyvana"
5,-1,"DragonGold, DragonGreen, Jayce, Rakan, Seraphine, Shyvana",,4.8,"AoShin, DragonGold, DragonGreen, Rakan, Shyvana"
4,-1,"AurelionSol, Bard, Pantheon, Rakan, Seraphine, Sylas, Zoe",,4.8,"AoShin, DragonGold, DragonGreen, Rakan, Shyvana"
4,-1,"Aphelios, Diana, Rell, Rengar",,4.8,"AoShin, DragonGold, DragonGreen, Rakan, Shyvana"
4,-1,"AoShin, AurelionSol, Bard, DragonEarth, Soraka, Yasuo",,4.8,"AoShin, DragonGold, DragonGreen, Rakan, Shyvana"
4,-1,"Jax, Kaisa, LeeSin, Soraka, Yasuo, Zoe, TFT7b_Volibear",,4.8,"AoShin, DragonGold, DragonGreen, Rakan, Shyvana"
4,-1,"Aphelios, Bard, DragonSwain, Qiyana, Rell, Rengar, Seraphine",,4.8,"AoShin, DragonGold, DragonGreen, Rakan, Shyvana"
4,-1,"Aphelios, Bard, DragonGuild, Graves, Jayce, Rell, Twitch",,4.8,"AoShin, DragonGold, DragonGreen, Rakan, Shyvana"
4,-1,"AoShin, DragonGreen, Gnar, Shyvana, Soraka, Yasuo",,4.8,"AoShin, DragonGold, DragonGreen, Rakan, Shyvana"
4,-1,"Graves, Nilah, Seraphine, Sylas, Xayah, Yone",,4.8,"AoShin, DragonGold, DragonGreen, Rakan, Shyvana"
4,-1,"AoShin, DragonBlue, DragonEarth, DragonGold, Graves, Soraka, Yasuo",,4.8,"AoShin, DragonGold, DragonGreen, Rakan, Shyvana"
4,-1,"Bard, Braum, Rakan, Twitch, Xayah, Zac",,4.8,"AoShin, DragonGold, DragonGreen, Rakan, Shyvana"
4,-1,"Bard, DragonGreen, DragonPurple, Jayce, Pantheon, Soraka, Yasuo",,4.8,"AoShin, DragonGold, DragonGreen, Rakan, Shyvana"
4,-1,"DragonGold, Hecarim, Jayce, Rakan, Shyvana, Xayah, Yasuo",,4.8,"AoShin, DragonGold, DragonGreen, Rakan, Shyvana"
4,-1,"AoShin, AurelionSol, DragonEarth, DragonGold, Yasuo",,4.8,"AoShin, DragonGold, DragonGreen, Rakan, Shyvana"
4,-1,"DragonBlue, Nunu, Olaf, Pantheon, Yasuo, Yone, Zyra",,4.8,"AoShin, DragonGold, DragonGreen, Rakan, Shyvana"
4,-1,"DragonBlue, DragonEarth, Jayce, LeeSin, Yasuo",,4.8,"AoShin, DragonGold, DragonGreen, Rakan, Shyvana"
4,-1,"Bard, Kaisa, LeeSin, Soraka, TFT7b_Volibear",,4.8,"AoShin, DragonGold, DragonGreen, Rakan, Shyvana"
4,-1,"Aphelios, Graves, Hecarim, Rengar",,4.8,"AoShin, DragonGold, DragonGreen, Rakan, Shyvana"
4,-1,"AoShin, DragonEarth, Lux, Nilah, Soraka, Zoe",,4.8,"AoShin, DragonGold, DragonGreen, Rakan, Shyvana"
4,-1,"DragonBlue, DragonGuild, Hecarim, Jayce, Yasuo",,4.8,"AoShin, DragonGold, DragonGreen, Rakan, Shyvana"
4,-1,"Graves, Hecarim, Lux, Nilah, Varus, Zyra",,4.8,"AoShin, DragonGold, DragonGreen, Rakan, Shyvana"
4,-1,"AoShin, Bard, Hecarim, LeeSin, Nunu, Shyvana, Yasuo",,4.8,"AoShin, DragonGold, DragonGreen, Rakan, Shyvana"
4,-1,"Bard, Gnar, Jayce, NomsyEvoker, Pantheon, Seraphine, Zyra, TFT7b_Lulu",,4.8,"AoShin, DragonGold, DragonGreen, Rakan, Shyvana"
4,-1,"DragonGold, Jax, Soraka, Twitch, Yasuo, TFT7b_Volibear",,4.8,"AoShin, DragonGold, DragonGreen, Rakan, Shyvana"
4,-1,"AurelionSol, Bard, DragonGreen, Pantheon, Seraphine, Zyra",,4.8,"AoShin, DragonGold, DragonGreen, Rakan, Shyvana"
4,-1,"AurelionSol, DragonGold, Graves, LeeSin, Rakan, Seraphine",,4.8,"AoShin, DragonGold, DragonGreen, Rakan, Shyvana"
4,-1,"AoShin, DragonBlue, DragonGold, Rakan, Shyvana",,4.8,"AoShin, DragonGold, DragonGreen, Rakan, Shyvana"
4,-1,"Aphelios, Bard, Graves, Nunu, Qiyana, Rell, Rengar",,4.8,"AoShin, DragonGold, DragonGreen, Rakan, Shyvana"
4,-1,"Bard, Gnar, Jayce, Soraka, Twitch, Varus, Xayah",,4.8,"AoShin, DragonGold, DragonGreen, Rakan, Shyvana"
4,-1,"Hecarim, Nunu, Pantheon, Rakan, Sylas, Yasuo, Yone",,4.8,"AoShin, DragonGold, DragonGreen, Rakan, Shyvana"
4,-1,"Bard, Diana, Graves, Nilah, Qiyana, Rakan, Rengar, Seraphine, Zac",,4.8,"AoShin, DragonGold, DragonGreen, Rakan, Shyvana"
4,-1,"AurelionSol, DragonEarth, Lux, Seraphine, Sylas",,4.8,"AoShin, DragonGold, DragonGreen, Rakan, Shyvana"
4,-1,"AurelionSol, DragonGold, Pantheon, Rakan, Seraphine, Yasuo, Zyra",,4.8,"AoShin, DragonGold, DragonGreen, Rakan, Shyvana"
4,-1,"DragonGreen, Hecarim, Jayce, Rakan, Twitch, Varus, Xayah",,4.8,"AoShin, DragonGold, DragonGreen, Rakan, Shyvana"
4,-1,"Bard, DragonGreen, Pantheon, Seraphine, Soraka, Yasuo, Zyra",,4.8,"AoShin, DragonGold, DragonGreen, Rakan, Shyvana"
4,-1,"AoShin, Kaisa, LeeSin, Qiyana, Yasuo, TFT7b_Volibear",,4.8,"AoShin, DragonGold, DragonGreen, Rakan, Shyvana"
4,-1,"DragonGreen, Gnar, Jax, Jayce, Shyvana, Yasuo",,4.8,"AoShin, DragonGold, DragonGreen, Rakan, Shyvana"
4,-1,"AurelionSol, NomsyEvoker, Pantheon, Sylas, Zoe, Zyra, TFT7b_Lulu",,4.8,"AoShin, DragonGold, DragonGreen, Rakan, Shyvana"
4,-1,"DragonEarth, DragonGreen, DragonPurple, Jax, Soraka, Zyra",,4.8,"AoShin, DragonGold, DragonGreen, Rakan, Shyvana"
4,-1,"DragonBlue, Hecarim, Lillia, Nunu, Rell, Zoe",,4.8,"AoShin, DragonGold, DragonGreen, Rakan, Shyvana"
4,-1,"DragonGreen, Jax, Pantheon, Soraka, Sylas, Twitch, Xayah",,4.8,"AoShin, DragonGold, DragonGreen, Rakan, Shyvana"
4,-1,"Bard, Hecarim, Jayce, Rakan, Shyvana, Twitch, Xayah, Zoe",,4.8,"AoShin, DragonGold, DragonGreen, Rakan, Shyvana"
4,-1,"AoShin, Bard, Jax, Jayce, Seraphine, Soraka, Sylas, Zyra",,4.8,"AoShin, DragonGold, DragonGreen, Rakan, Shyvana"
4,-1,"Bard, Jax, Kaisa, Soraka, Zac, TFT7b_Volibear",,4.8,"AoShin, DragonGold, DragonGreen, Rakan, Shyvana"
4,-1,"AoShin, DragonGold, LeeSin, Rakan, Yasuo, Yone",,4.8,"AoShin, DragonGold, DragonGreen, Rakan, Shyvana"
4,-1,"Diana, Hecarim, LeeSin, Nilah, Qiyana, Rell, Rengar",,4.8,"AoShin, DragonGold, DragonGreen, Rakan, Shyvana"
4,-1,"Graves, Nilah, Rakan, Seraphine, Zac, Zeri, Zyra",,4.8,"AoShin, DragonGold, DragonGreen, Rakan, Shyvana"
4,-1,"Jax, Kaisa, Soraka, Zac, TFT7b_Volibear",,4.8,"AoShin, DragonGold, DragonGreen, Rakan, Shyvana"
4,-1,"Hecarim, Jayce, Rakan, Shyvana, Twitch, Xayah, Zoe",,4.8,"AoShin, DragonGold, DragonGreen, Rakan, Shyvana"
4,-1,"Hecarim, Rakan, Seraphine, Soraka, Twitch, Varus, Xayah",,4.8,"AoShin, DragonGold, DragonGreen, Rakan, Shyvana"
4,-1,"DragonGreen, Gnar, Pantheon, Rakan, Seraphine, Shyvana, Zyra",,4.8,"AoShin, DragonGold, DragonGreen, Rakan, Shyvana"
4,-1,"AurelionSol, Bard, DragonPurple, Olaf, Pantheon, Sylas, Zyra",,4.8,"AoShin, DragonGold, DragonGreen, Rakan, Shyvana"
4,-1,"AurelionSol, Lux, Soraka, Sylas, Varus",,4.8,"AoShin, DragonGold, DragonGreen, Rakan, Shyvana"
4,-1,"AoShin, Bard, Graves, Jayce, Sylas, Twitch, Xayah, Yasuo, Zoe",,4.8,"AoShin, DragonGold, DragonGreen, Rakan, Shyvana"
4,-1,"Bard, DragonBlue, DragonEarth, DragonGold",,4.8,"AoShin, DragonGold, DragonGreen, Rakan, Shyvana"
4,-1,"AoShin, DragonGold, Jax, Soraka, Zoe, TFT7b_Volibear",,4.8,"AoShin, DragonGold, DragonGreen, Rakan, Shyvana"
4,-1,"Hecarim, LeeSin, Nunu, Rell, Twitch, Varus, Xayah",,4.8,"AoShin, DragonGold, DragonGreen, Rakan, Shyvana"
4,-1,"Bard, DragonGold, Jayce, Rakan, Soraka, Twitch, Xayah",,4.8,"AoShin, DragonGold, DragonGreen, Rakan, Shyvana"
4,-1,"DragonBlue, DragonGold, Jayce, Rakan, Twitch",,4.8,"AoShin, DragonGold, DragonGreen, Rakan, Shyvana"
4,-1,"AoShin, DragonEarth, DragonGreen, LeeSin, Yasuo",,4.8,"AoShin, DragonGold, DragonGreen, Rakan, Shyvana"
4,-1,"DragonGreen, DragonGuild, Jax, Jayce, Soraka",,4.8,"AoShin, DragonGold, DragonGreen, Rakan, Shyvana"
4,-1,"DragonEarth, NomsyEvoker, Pantheon, Rakan, Seraphine, Zyra, TFT7b_Lulu",,4.8,"AoShin, DragonGold, DragonGreen, Rakan, Shyvana"
4,-1,"AurelionSol, DragonEarth, Jayce, Shyvana, Twitch, Xayah",,4.8,"AoShin, DragonGold, DragonGreen, Rakan, Shyvana"
4,-1,"AoShin, DragonGold, LeeSin, Shyvana, Soraka, Yasuo",,4.8,"AoShin, DragonGold, DragonGreen, Rakan, Shyvana"
4,-1,"Graves, Jax, Kaisa, LeeSin, Zac, TFT7b_Volibear",,4.8,"AoShin, DragonGold, DragonGreen, Rakan, Shyvana"
4,-1,"DragonBlue, DragonGreen, Gnar, Jayce, Rakan, Soraka, Yasuo",,4.8,"AoShin, DragonGold, DragonGreen, Rakan, Shyvana"
4,-1,"Bard, DragonGold, Hecarim, Jayce, Rakan, Shyvana, Varus",,4.8,"AoShin, DragonGold, DragonGreen, Rakan, Shyvana"
4,-1,"Braum, Diana, Lillia, Olaf, Rakan, Sylas, Yasuo",,4.8,"AoShin, DragonGold, DragonGreen, Rakan, Shyvana"
4,-1,"DragonGold, Hecarim, Jayce, Rakan, Twitch, Varus",,4.8,"AoShin, DragonGold, DragonGreen, Rakan, Shyvana"
4,-1,"Bard, Braum, Jax, Olaf, Pantheon, Rakan, Seraphine, Twitch",,4.8,"AoShin, DragonGold, DragonGreen, Rakan, Shyvana"
4,-1,"AoShin, Bard, DragonGold, DragonGreen, Gnar, Rakan, Soraka",,4.8,"AoShin, DragonGold, DragonGreen, Rakan, Shyvana"
4,-1,"Braum, Diana, Lillia, Nilah, Olaf, Qiyana, Rengar",,4.8,"AoShin, DragonGold, DragonGreen, Rakan, Shyvana"
4,-1,"Jayce, Lillia, Lux, NomsyMage, Olaf, Pantheon, Sylas, TFT7b_Heimerdinger",,4.8,"AoShin, DragonGold, DragonGreen, Rakan, Shyvana"
4,-1,"AurelionSol, DragonEarth, DragonGold, Jayce, Shyvana, Xayah",,4.8,"AoShin, DragonGold, DragonGreen, Rakan, Shyvana"
4,-1,"AurelionSol, DragonEarth, DragonGold, Jayce, Rakan, Seraphine, Shyvana",,4.8,"AoShin, DragonGold, DragonGreen, Rakan, Shyvana"
4,-1,"AoShin, DragonEarth, DragonGold, Rakan, Seraphine, Soraka",,4.8,"AoShin, DragonGold, DragonGreen, Rakan, Shyvana"
4,-1,"AoShin, Bard, DragonEarth, LeeSin, Seraphine, Twitch, Yasuo",,4.8,"AoShin, DragonGold, DragonGreen, Rakan, Shyvana"
5,-1,"DragonBlue, DragonGuild, Hecarim, Jayce, Nunu",,4.8,"AoShin, DragonGold, DragonGreen, Rakan, Shyvana"
5,-1,"AurelionSol, DragonEarth, DragonGold, DragonGreen, Rakan, Seraphine",,4.8,"AoShin, DragonGold, DragonGreen, Rakan, Shyvana"
5,-1,"Jayce, Lux, Seraphine, Varus, Zyra",,4.8,"AoShin, DragonGold, DragonGreen, Rakan, Shyvana"
5,-1,"DragonBlue, DragonGold, Lux, Sylas, Zyra",,4.8,"AoShin, DragonGold, DragonGreen, Rakan, Shyvana"
5,-1,"Bard, DragonGreen, Gnar, Jax, Jayce, Rakan, Seraphine",,4.8,"AoShin, DragonGold, DragonGreen, Rakan, Shyvana"
5,-1,"AurelionSol, DragonBlue, DragonGold, Rakan, Seraphine",,4.8,"AoShin, DragonGold, DragonGreen, Rakan, Shyvana"
5,-1,"Bard, Kaisa, LeeSin, Sylas, Yasuo, Zac, Zoe, TFT7b_Volibear",,4.8,"AoShin, DragonGold, DragonGreen, Rakan, Shyvana"
5,-1,"DragonGreen, Gnar, Jayce, Rakan, Yasuo",,4.8,"AoShin, DragonGold, DragonGreen, Rakan, Shyvana"
5,-1,"AoShin, Graves, LeeSin, Nilah, Qiyana, Sylas",,4.8,"AoShin, DragonGold, DragonGreen, Rakan, Shyvana"
5,-1,"Braum, Graves, Hecarim, Jax, Nilah, Seraphine, Soraka, Yasuo",,4.8,"AoShin, DragonGold, DragonGreen, Rakan, Shyvana"
5,-1,"Bard, DragonSwain, NomsyEvoker, Rakan, Rengar, Seraphine, TFT7b_Lulu",,4.8,"AoShin, DragonGold, DragonGreen, Rakan, Shyvana"
5,-1,"DragonGreen, Gnar, Jax, Shyvana",,4.8,"AoShin, DragonGold, DragonGreen, Rakan, Shyvana"
5,-1,"DragonPurple, Soraka, Sylas, Twitch, Varus, Yasuo, Zoe",,4.8,"AoShin, DragonGold, DragonGreen, Rakan, Shyvana"
5,-1,"Bard, Hecarim, Jayce, Rakan, Seraphine, Twitch, Xayah, Yasuo",,4.8,"AoShin, DragonGold, DragonGreen, Rakan, Shyvana"
5,-1,"DragonBlue, DragonSwain, Hecarim, Nunu, Rell",,4.8,"AoShin, DragonGold, DragonGreen, Rakan, Shyvana"
5,-1,"Bard, Jayce, Lux, Sylas, Twitch, Varus",,4.8,"AoShin, DragonGold, DragonGreen, Rakan, Shyvana"
5,-1,"Bard, DragonGreen, Jayce, Seraphine, Soraka, Sylas, Zyra",,4.8,"AoShin, DragonGold, DragonGreen, Rakan, Shyvana"
5,-1,"AurelionSol, DragonEarth, Jayce, LeeSin, Rakan, Shyvana, Soraka",,4.8,"AoShin, DragonGold, DragonGreen, Rakan, Shyvana"
5,-1,"DragonBlue, DragonGold, Hecarim, Nunu, Shyvana, Yone",,4.8,"AoShin, DragonGold, DragonGreen, Rakan, Shyvana"
5,-1,"Bard, Gnar, Jayce, Rakan, Shyvana, Yasuo",,4.8,"AoShin, DragonGold, DragonGreen, Rakan, Shyvana"
5,-1,"AquaticDragon, Jayce, Lillia, Nilah, Sylas",,4.8,"AoShin, DragonGold, DragonGreen, Rakan, Shyvana"
5,-1,"Bard, Lux, Seraphine, Soraka, Sylas, Zoe, Zyra",,4.8,"AoShin, DragonGold, DragonGreen, Rakan, Shyvana"
5,-1,"AoShin, AurelionSol, DragonEarth, Jayce, Shyvana",,4.8,"AoShin, DragonGold, DragonGreen, Rakan, Shyvana"
5,-1,"DragonEarth, DragonGold, Hecarim, Rakan, Twitch, Xayah",,4.8,"AoShin, DragonGold, DragonGreen, Rakan, Shyvana"
5,-1,"AurelionSol, Bard, DragonEarth, DragonGreen, Jayce, Shyvana",,4.8,"AoShin, DragonGold, DragonGreen, Rakan, Shyvana"
5,-1,"Lux, Shyvana, Sylas, Varus",,4.8,"AoShin, DragonGold, DragonGreen, Rakan, Shyvana"
5,-1,"Aphelios, DragonSwain, Nilah, Pantheon, Rell, Rengar",,4.8,"AoShin, DragonGold, DragonGreen, Rakan, Shyvana"
5,-1,"DragonBlue, Hecarim, Nunu, Rakan, Soraka, Yone",,4.8,"AoShin, DragonGold, DragonGreen, Rakan, Shyvana"
5,-1,"AoShin, Bard, DragonEarth, Jayce, Shyvana, Zoe",,4.8,"AoShin, DragonGold, DragonGreen, Rakan, Shyvana"
5,-1,"Hecarim, Kaisa, LeeSin, Shyvana, TFT7b_Volibear",,4.8,"AoShin, DragonGold, DragonGreen, Rakan, Shyvana"
5,-1,"AurelionSol, Jayce, Lux, Sylas, Zyra",,4.8,"AoShin, DragonGold, DragonGreen, Rakan, Shyvana"
5,-1,"AurelionSol, Lux, Pantheon, Seraphine, Sylas, Zoe, Zyra",,4.8,"AoShin, DragonGold, DragonGreen, Rakan, Shyvana"
5,-1,"AurelionSol, DragonGold, Rakan, Seraphine, Soraka, Zyra",,4.8,"AoShin, DragonGold, DragonGreen, Rakan, Shyvana"
5,-1,"AoShin, DragonPurple, Pantheon, Seraphine, Sylas, Zyra",,4.8,"AoShin, DragonGold, DragonGreen, Rakan, Shyvana"
5,-1,"Graves, Pantheon, Rakan, Seraphine, Zac, Zeri, Zoe, Zyra",,4.8,"AoShin, DragonGold, DragonGreen, Rakan, Shyvana"
5,-1,"LeeSin, Qiyana, TFT7b_Volibear",,4.8,"AoShin, DragonGold, DragonGreen, Rakan, Shyvana"
5,-1,"Bard, DragonEarth, Rakan, Twitch, Xayah",,4.8,"AoShin, DragonGold, DragonGreen, Rakan, Shyvana"
5,-1,"Jayce, Shyvana, Soraka, Twitch, Varus, Xayah",,4.8,"AoShin, DragonGold, DragonGreen, Rakan, Shyvana"
5,-1,"Braum, Graves, Pantheon, Rakan, Seraphine, Zyra",,4.8,"AoShin, DragonGold, DragonGreen, Rakan, Shyvana"
5,-1,"Bard, DragonPurple, Jax, Sylas, Twitch, Varus",,4.8,"AoShin, DragonGold, DragonGreen, Rakan, Shyvana"
6,-1,"DragonEarth, Graves, LeeSin, Nilah, Qiyana, Soraka",,4.8,"AoShin, DragonGold, DragonGreen, Rakan, Shyvana"
6,-1,"Bard, DragonBlue, Hecarim, Jayce, Nunu, Shyvana",,4.8,"AoShin, DragonGold, DragonGreen, Rakan, Shyvana"
6,-1,"AoShin, DragonEarth, Graves, Shyvana, Soraka",,4.8,"AoShin, DragonGold, DragonGreen, Rakan, Shyvana"
6,-1,"Aphelios, DragonGold, Graves, Nilah, Rakan, Zeri",,4.8,"AoShin, DragonGold, DragonGreen, Rakan, Shyvana"
6,-1,"AoShin, Bard, DragonEarth, DragonGold, LeeSin, Yasuo",,4.8,"AoShin, DragonGold, DragonGreen, Rakan, Shyvana"
6,-1,"Aphelios, DragonSwain, Graves, Nilah, Rell, Rengar",,4.8,"AoShin, DragonGold, DragonGreen, Rakan, Shyvana"
6,-1,"AoShin, Bard, DragonGold, LeeSin, Rakan, Yasuo, Yone",,4.8,"AoShin, DragonGold, DragonGreen, Rakan, Shyvana"
6,-1,"AoShin, AurelionSol, DragonGold, DragonGreen, Zoe",,4.8,"AoShin, DragonGold, DragonGreen, Rakan, Shyvana"
6,-1,"DragonGreen, Jayce, Rakan, Seraphine, Shyvana, Zyra",,4.8,"AoShin, DragonGold, DragonGreen, Rakan, Shyvana"
6,-1,"DragonGreen, DragonPurple, Pantheon, Seraphine, Sylas, Zyra",,4.8,"AoShin, DragonGold, DragonGreen, Rakan, Shyvana"
6,-1,"DragonBlue, DragonGuild, Hecarim, Jayce, Nunu, Yasuo",,4.8,"AoShin, DragonGold, DragonGreen, Rakan, Shyvana"
6,-1,"DragonGreen, DragonPurple, Jax, Pantheon",,4.8,"AoShin, DragonGold, DragonGreen, Rakan, Shyvana"
6,-1,"DragonPurple, Graves, Nilah, Pantheon, Qiyana, Soraka, Sylas, Zyra",,4.8,"AoShin, DragonGold, DragonGreen, Rakan, Shyvana"
6,-1,"Kaisa, LeeSin, Nunu, Rakan, Yasuo, TFT7b_Volibear",,4.8,"AoShin, DragonGold, DragonGreen, Rakan, Shyvana"
6,-1,"DragonGold, Jayce, Rakan, Twitch, Xayah",,4.8,"AoShin, DragonGold, DragonGreen, Rakan, Shyvana"
6,-1,"AurelionSol, Nilah, Rakan, Seraphine, Sylas, Zac, Zyra",,4.8,"AoShin, DragonGold, DragonGreen, Rakan, Shyvana"
5,-1,"AurelionSol, Bard, Seraphine, Soraka, Sylas, Zyra",,4.8,"AoShin, DragonGold, DragonGreen, Rakan, Shyvana"
5,-1,"Jax, Jayce, Olaf, Pantheon, Seraphine, Sylas, Twitch, Zyra",,4.8,"AoShin, DragonGold, DragonGreen, Rakan, Shyvana"
5,-1,"DragonBlue, DragonGold, DragonGuild, NomsyMage, TFT7b_Heimerdinger",,4.8,"AoShin, DragonGold, DragonGreen, Rakan, Shyvana"
5,-1,"Braum, Diana, Lillia, Nilah, Qiyana, Rell, Rengar",,4.8,"AoShin, DragonGold, DragonGreen, Rakan, Shyvana"
5,-1,"AquaticDragon, Nilah, NomsyMage, Sylas, TFT7b_Heimerdinger",,4.8,"AoShin, DragonGold, DragonGreen, Rakan, Shyvana"
5,-1,"AoShin, Bard, DragonGold, LeeSin, TFT7b_Volibear",,4.8,"AoShin, DragonGold, DragonGreen, Rakan, Shyvana"
5,-1,"DragonBlue, DragonGuild, Nunu, Twitch, Yasuo, Yone",,4.8,"AoShin, DragonGold, DragonGreen, Rakan, Shyvana"
5,-1,"Gnar, Jax, Lillia, Olaf, Pantheon, Sylas, Yone",,4.8,"AoShin, DragonGold, DragonGreen, Rakan, Shyvana"
5,-1,"Braum, Diana, Jax, Lillia, Olaf, Qiyana, Soraka, Yone",,4.8,"AoShin, DragonGold, DragonGreen, Rakan, Shyvana"
5,-1,"AquaticDragon, DragonBlue, DragonGold, Nilah, Zac",,4.8,"AoShin, DragonGold, DragonGreen, Rakan, Shyvana"
5,-1,"Graves, Nilah, Qiyana, Rakan, Seraphine, Zeri, Zyra",,4.8,"AoShin, DragonGold, DragonGreen, Rakan, Shyvana"
5,-1,"DragonGreen, Gnar, Jax, Jayce, Nilah, Rengar, Sylas",,4.8,"AoShin, DragonGold, DragonGreen, Rakan, Shyvana"
5,-1,"AurelionSol, Bard, DragonEarth, Soraka, Sylas, Zoe, Zyra",,4.8,"AoShin, DragonGold, DragonGreen, Rakan, Shyvana"
5,-1,"Bard, Graves, Rakan, Seraphine, Yasuo, Zac, Zeri, Zyra",,4.8,"AoShin, DragonGold, DragonGreen, Rakan, Shyvana"
5,-1,"AoShin, Hecarim, Kaisa, LeeSin, Yasuo, TFT7b_Volibear",,4.8,"AoShin, DragonGold, DragonGreen, Rakan, Shyvana"
5,-1,"AurelionSol, Lux, Rakan, Seraphine, Sylas",,4.8,"AoShin, DragonGold, DragonGreen, Rakan, Shyvana"
5,-1,"Aphelios, DragonGold, Graves, Jayce, NomsyCannoneer, Zeri, TFT7b_Tristana",,4.8,"AoShin, DragonGold, DragonGreen, Rakan, Shyvana"
5,-1,"AurelionSol, DragonBlue, DragonGold, Jayce, Nunu, Shyvana",,4.8,"AoShin, DragonGold, DragonGreen, Rakan, Shyvana"
5,-1,"Braum, Diana, Jax, Lillia, Olaf, Pantheon, Qiyana",,4.8,"AoShin, DragonGold, DragonGreen, Rakan, Shyvana"
5,-1,"Diana, DragonEarth, Nilah, Olaf, Qiyana, Rengar",,4.8,"AoShin, DragonGold, DragonGreen, Rakan, Shyvana"
