placement,group,comp,grp_count,grp_placement,mode
2,-1,"AquaticDragon, Bard, Nilah, Seraphine, Soraka, Sylas, Zac, Zeri, Zyra",,4.96,
6,-1,"Bard, Hecarim, LeeSin, Rakan, Shyvana, Xayah",,4.96,
6,-1,"AoShin, DragonBlue, DragonEarth, Graves, Shyvana",,4.96,
5,-1,"AurelionSol, DragonEarth, DragonGreen, DragonSwain, Seraphine, Soraka",,4.96,
5,-1,"Aphelios, Bard, DragonSwain, Hecarim, Rell, Rengar",,4.96,
5,-1,"DragonGuild, DragonPurple, Jayce, Pantheon, Twitch, Zyra",,4.96,
5,-1,"DragonGreen, Kaisa, Yasuo, TFT7b_Volibear",,4.96,
5,-1,"Aphelios, Graves, Hecarim, Jayce, Rell, Soraka, Zeri",,4.96,
5,-1,"Bard, DragonBlue, DragonEarth, Hecarim, Nunu, Yasuo",,4.96,
2,-1,"Bard, DragonPurple, Jayce, Rakan, Shyvana, Sylas, Zyra",,4.96,
5,-1,"Bard, Hecarim, Jayce, NomsyEvoker, Seraphine, Shyvana, TFT7b_Lulu",,4.96,
5,-1,"AoShin, Bard, Lillia, Lux, Sylas, Zoe",,4.96,
5,-1,"Bard, Braum, Diana, Lillia, Olaf, Pantheon, Rakan, Sylas",,4.96,
6,-1,"DragonGuild, Hecarim, Jayce, Soraka, Twitch, Xayah",,4.96,
2,-1,"Bard, DragonGold, Graves, Nilah, Qiyana, Soraka, Yasuo, Zac",,4.96,
2,-1,"AoShin, Bard, DragonEarth, DragonGreen, Graves, Soraka, Yasuo",,4.96,
5,-1,"Aphelios, Rell, Rengar, Zeri",,4.96,
2,-1,"Bard, Graves, Kaisa, LeeSin, Nunu",,4.96,
5,-1,"DragonBlue, DragonGold, Jayce, Twitch",,4.96,
2,-1,"Aphelios, DragonSwain, Graves, Jayce, Rell, Rengar, Zeri",,4.96,
5,-1,"Aphelios, DragonGold, Graves, Rakan, Shyvana, Zeri",,4.96,
5,-1,"DragonEarth, DragonPurple, Pantheon, Seraphine, Soraka, Zyra",,4.96,
2,-1,"DragonBlue, DragonGold, DragonPurple, Pantheon, Rakan, Shyvana, Yasuo",,4.96,
5,-1,"AoShin, Bard, DragonGreen, DragonGuild, Hecarim, Shyvana",,4.96,
5,-1,"AoShin, Aphelios, Graves, Hecarim, Rell, Zeri",,4.96,
5,-1,"Braum, Diana, Jax, Nilah, Olaf, Pantheon, Yasuo, Yone",,4.96,
5,-1,"AoShin, DragonGuild, Hecarim, Jayce, Rakan, Soraka",,4.96,
2,-1,"DragonGuild, Hecarim, Jayce, Lillia, Nunu, Rell",,4.96,
5,-1,"Diana, DragonPurple, Nilah, Pantheon, Qiyana, Sylas, Zyra",,4.96,
6,-1,"DragonBlue, DragonGuild, Jayce, Nunu, Pantheon, Twitch",,4.96,
6,-1,"AoShin, DragonGold, Graves, Hecarim, Rakan, Soraka",,4.96,
6,-1,"DragonGold, Jax, NomsyEvoker, Pantheon, Sylas, TFT7b_Lulu",,4.96,
2,-1,"AoShin, Bard, Graves, Seraphine, Sylas, Zac, Zoe",,4.96,
2,-1,"Aphelios, Bard, Graves, Hecarim, LeeSin, Rell, Yasuo, Zeri",,4.96,
2,-1,"DragonEarth, DragonPurple, Jayce, Pantheon, Sylas, Zyra",,4.96,
2,-1,"AoShin, Bard, Kaisa, LeeSin, TFT7b_Volibear",,4.96,
6,-1,"Gnar, Jax, Jayce, Twitch, Xayah",,4.96,
2,-1,"DragonGreen, Gnar, Jax, Shyvana, Soraka, Sylas, Yasuo",,4.96,
6,-1,"Bard, DragonGreen, Gnar, Jax, Shyvana, Soraka",,4.96,
6,-1,"DragonBlue, Hecarim, Nunu, Pantheon, Rell, Yasuo, Yone",,4.96,
6,-1,"AoShin, DragonEarth, DragonGold, Jayce, Yasuo",,4.96,
6,-1,"DragonEarth, Hecarim, Nilah, Rell, Rengar",,4.96,
6,-1,"Braum, Diana, Hecarim, Lillia, Olaf, Rell, Yasuo",,4.96,
6,-1,"AoShin, DragonBlue, DragonGold, DragonGreen, LeeSin",,4.96,
6,-1,"Jayce, Rakan, Shyvana, Twitch",,4.96,
6,-1,"Hecarim, Jayce, Lillia, Nunu, Rell, Twitch, Xayah",,4.96,
2,-1,"Bard, DragonGold, Jax, Soraka, Xayah, Zoe, TFT7b_Volibear",,4.96,
6,-1,"AoShin, Bard, DragonEarth, DragonGold, Jayce",,4.96,
6,-1,"AoShin, DragonEarth, Rakan, Seraphine, Soraka, Yasuo",,4.96,
6,-1,"Lux, Soraka, Sylas, Varus",,4.96,
2,-1,"Hecarim, Jayce, Rakan, Twitch, Varus, Xayah",,4.96,
6,-1,"AurelionSol, DragonEarth, Shyvana, Sylas, Zyra",,4.96,
6,-1,"Bard, DragonEarth, Graves, Jayce, Nilah, Xayah, Yasuo",,4.96,
6,-1,"AurelionSol, DragonEarth, Jayce, NomsyEvoker, Shyvana, TFT7b_Lulu",,4.96,
6,-1,"AoShin, Bard, Graves, Lux, Sylas, Zoe",,4.96,
6,-1,"DragonGreen, Gnar, Rakan, Seraphine, Shyvana, Soraka",,4.96,
2,-1,"DragonBlue, DragonGold, Jax, Soraka, Zoe, TFT7b_Volibear",,4.96,
2,-1,"Hecarim, Jayce, Rakan, Shyvana, Twitch, Xayah, Zoe",,4.96,
5,-1,"DragonGreen, Jax, Kaisa, Seraphine",,4.96,
5,-1,"DragonBlue, DragonEarth, DragonGold, DragonPurple, Jayce",,4.96,
2,-1,"Bard, Braum, Diana, Lillia, Olaf, Pantheon, Sylas, Yasuo, Zoe",,4.96,
2,-1,"Bard, DragonEarth, DragonGuild, Jayce, Twitch, Yasuo",,4.96,
5,-1,"DragonEarth, DragonPurple, Jax, Olaf, Pantheon, Sylas, Zyra",,4.96,
5,-1,"AurelionSol, Bard, Rakan, Seraphine, Sylas, Zoe",,4.96,
5,-1,"Bard, Rakan, Shyvana, Twitch, Xayah, Yasuo",,4.96,
2,-1,"Bard, DragonBlue, DragonEarth, DragonGold, Shyvana, Soraka, Yasuo",,4.96,
2,-1,"AoShin, Bard, DragonEarth, DragonGuild, Jayce, Shyvana",,4.96,
2,-1,"AurelionSol, DragonEarth, DragonGold, Rakan, Shyvana, Soraka",,4.96,
2,-1,"AurelionSol, DragonGold, DragonGuild, NomsyEvoker, Rakan, Seraphine, TFT7b_Lulu",,4.96,
2,-1,"Aphelios, Graves, Jayce, Rell",,4.96,
5,-1,"Bard, Jayce, Lux, Sylas, Varus",,4.96,
5,-1,"AoShin, Bard, Braum, DragonGuild, Rakan, Twitch",,4.96,
5,-1,"DragonBlue, Gnar, Hecarim, Jayce, Nunu, Twitch",,4.96,
2,-1,"DragonGold, Olaf, Pantheon, Soraka, Sylas, Yasuo, Yone",,4.96,
5,-1,"AquaticDragon, AurelionSol, Seraphine, Sylas",,4.96,
5,-1,"Kaisa, LeeSin, Pantheon, Qiyana, Sylas, TFT7b_Volibear",,4.96,
5,-1,"AoShin, Jax, LeeSin, Lux, Nilah, Qiyana, Sylas",,4.96,
5,-1,"DragonBlue, DragonGold, Jayce, Nunu, Soraka, Yasuo",,4.96,
5,-1,"Hecarim, NomsyEvoker, Nunu, Rakan, Seraphine, Zyra, TFT7b_Lulu",,4.96,
5,-1,"Braum, DragonBlue, DragonGold, Rakan, Seraphine",,4.96,
5,-1,"AoShin, Kaisa, LeeSin, Nunu, TFT7b_Volibear",,4.96,
2,-1,"AoShin, DragonEarth, DragonGreen, Jayce, Shyvana",,4.96,
5,-1,"DragonBlue, DragonEarth, Hecarim, Nunu, Yasuo",,4.96,
5,-1,"AoShin, Bard, Braum, DragonGold, Rakan, Yasuo",,4.96,
5,-1,"Aphelios, Graves, Hecarim, Lillia, Rakan",,4.96,
5,-1,"Bard, DragonBlue, Hecarim, Kaisa, LeeSin, Nunu, Yasuo, TFT7b_Volibear",,4.96,
5,-1,"AoShin, DragonBlue, DragonGold, Nunu, Yasuo, Yone",,4.96,
2,-1,"Bard, DragonBlue, DragonGuild, Jayce, Soraka, Twitch, Yasuo",,4.96,
5,-1,"DragonPurple, Nilah, Pantheon, Rakan, Seraphine, Sylas, Yasuo, Zyra",,4.96,
2,-1,"Diana, Hecarim, Lillia, Nunu, Olaf, Pantheon, Sylas, Zoe",,4.96,
2,-1,"AoShin, AurelionSol, Bard, DragonEarth, Rakan, Shyvana",,4.96,
5,-1,"DragonGold, Hecarim, Jayce, Rakan, Shyvana, Xayah",,4.96,
5,-1,"DragonGreen, Gnar, Jax, NomsyEvoker, Seraphine, Sylas, Zyra, TFT7b_Lulu",,4.96,
5,-1,"DragonGuild, Hecarim, Jayce, Lillia, Nunu, Rell",,4.96,
2,-1,"Bard, Diana, Hecarim, Lillia, Olaf, Pantheon, Sylas",,4.96,
2,-1,"Bard, DragonPurple, Pantheon, Seraphine, Soraka, Sylas, Zoe, Zyra",,4.96,
5,-1,"AoShin, LeeSin, Lillia, Sylas, Zac, Zoe",,4.96,
5,-1,"DragonGold, DragonGuild, Hecarim, Jayce, Rakan, Twitch, Xayah",,4.96,
2,-1,"Bard, DragonEarth, Gnar, Jayce, Shyvana, Twitch, Xayah",,4.96,
5,-1,"Bard, Graves, Hecarim, Jax, Nilah, Yasuo, Zyra",,4.96,
5,-1,"Bard, Diana, DragonSwain, Hecarim, Nilah, Qiyana, Rell, Rengar",,4.96,
2,-1,"Graves, Hecarim, Nilah, Pantheon, Seraphine, Soraka, Twitch",,4.96,
5,-1,"AoShin, Bard, DragonEarth, DragonGold, Soraka, Yasuo",,4.96,
5,-1,"AquaticDragon, DragonPurple, NomsyMage, Sylas, Zoe, TFT7b_Heimerdinger",,4.96,
2,-1,"AoShin, DragonBlue, DragonEarth, LeeSin, Yasuo",,4.96,
5,-1,"AoShin, DragonGold, DragonGreen, Jayce, Rakan, Shyvana",,4.96,
5,-1,"Gnar, Jax, Olaf, Sylas",,4.96,
5,-1,"DragonGreen, Gnar, Jax, Jayce, LeeSin, Soraka, Yasuo",,4.96,
5,-1,"DragonBlue, DragonGold, DragonPurple, Shyvana, Soraka",,4.96,
5,-1,"AoShin, Bard, DragonEarth, DragonPurple, Shyvana",,4.96,
5,-1,"AoShin, DragonGold, DragonGreen, Shyvana",,4.96,
2,-1,"DragonBlue, Hecarim, Lillia, Nunu, Olaf, Pantheon, Yasuo, Yone",,4.96,
5,-1,"Bard, Braum, DragonBlue, Rakan, Soraka, Zac",,4.96,
5,-1,"Braum, Diana, Lillia, Nunu, Olaf, Pantheon, Yone",,4.96,
2,-1,"DragonBlue, DragonGold, Hecarim, Jayce, Rakan, Twitch, Yasuo",,4.96,
5,-1,"AoShin, DragonGold, DragonPurple, Jayce, Shyvana",,4.96,
5,-1,"DragonBlue, DragonEarth, DragonGold, Yasuo",,4.96,
2,-1,"Aphelios, DragonEarth, Graves, Hecarim, Rell, Rengar, Zeri",,4.96,
6,-1,"DragonBlue, DragonGold, Jayce, Nunu, Rakan, Twitch",,4.96,
5,-1,"Graves, Kaisa, LeeSin, Soraka, Yasuo, TFT7b_Volibear",,4.96,
6,-1,"DragonGold, Jax, Shyvana, Twitch, Xayah, TFT7b_Volibear",,4.96,
6,-1,"Bard, DragonGreen, Graves, Nilah, Qiyana, Seraphine, Zeri",,4.96,
6,-1,"AurelionSol, Braum, DragonGold, Rakan, Soraka, Zyra",,4.96,
6,-1,"DragonBlue, Gnar, Jayce, Nunu, Yasuo, Yone",,4.96,
6,-1,"Bard, Lux, Soraka, Sylas, Varus",,4.96,
6,-1,"AurelionSol, Seraphine, Soraka, Sylas, Zoe, Zyra",,4.96,
6,-1,"Diana, DragonSwain, Hecarim, Nilah, Qiyana, Rengar",,4.96,
6,-1,"AurelionSol, Braum, DragonGold, Jayce, Rakan, Xayah",,4.96,
2,-1,"Aphelios, Bard, DragonSwain, Graves, Nilah, Rell, Rengar",,4.96,
6,-1,"Bard, DragonBlue, DragonGold, Rakan, Zac",,4.96,
2,-1,"Aphelios, Rell, Rengar",,4.96,
6,-1,"Bard, DragonBlue, DragonGold, Hecarim, Rakan, Yasuo",,4.96,
6,-1,"Braum, Diana, Lillia, Nilah, Olaf, Rakan, Sylas",,4.96,
6,-1,"Hecarim, LeeSin, Rakan, Xayah",,4.96,
2,-1,"AoShin, Bard, DragonGold, LeeSin, Rakan, Soraka, Yasuo",,4.96,
6,-1,"Kaisa, LeeSin, Nilah, Qiyana, TFT7b_Volibear",,4.96,
6,-1,"DragonGold, DragonGreen, Gnar, Jayce, Rakan",,4.96,
6,-1,"DragonGreen, Jax, Jayce, Rakan, Seraphine, Soraka",,4.96,
6,-1,"AoShin, Bard, DragonBlue, DragonGold, Shyvana",,4.96,
2,-1,"Bard, DragonEarth, Shyvana",,4.96,
2,-1,"Bard, Hecarim, Kaisa, LeeSin, Nunu, Soraka, Yasuo, TFT7b_Volibear",,4.96,
6,-1,"DragonBlue, DragonGold, DragonGreen, Shyvana, Sylas",,4.96,
6,-1,"DragonGreen, Gnar, Graves, Jax, Soraka",,4.96,
6,-1,"Kaisa, LeeSin, Shyvana, Yasuo",,4.96,
6,-1,"Braum, LeeSin, Rakan",,4.96,
6,-1,"DragonEarth, DragonGreen, DragonPurple, Jayce, Shyvana",,4.96,
6,-1,"AoShin, Bard, Hecarim, Nunu, Shyvana, Yasuo",,4.96,
6,-1,"DragonGold, NomsyEvoker, Rakan, Seraphine, Soraka, Zyra, TFT7b_Lulu",,4.96,
6,-1,"DragonGuild, Hecarim, Jayce, Shyvana, Twitch",,4.96,
2,-1,"Bard, Soraka",,4.96,
2,-1,"Graves, LeeSin, Nunu, Yasuo, Yone, TFT7b_Volibear",,4.96,
2,-1,"Aphelios, Bard, Graves, LeeSin, Pantheon, Rell, Yasuo, Zeri",,4.96,
6,-1,"DragonGold, Graves, Nilah, NomsyMage, Zac, Zeri, TFT7b_Heimerdinger",,4.96,
2,-1,"Jayce, Shyvana, Xayah, Yasuo",,4.96,
6,-1,"Diana, Lillia, Nilah, Olaf, Qiyana, Rengar, Sylas",,4.96,
6,-1,"Hecarim, Lillia, Nunu, Olaf, Pantheon, Sylas, Yone",,4.96,
6,-1,"Diana, Jayce, Lillia, Nilah, Nunu, Olaf, Yasuo",,4.96,
6,-1,"Bard, DragonGold, Jax, Xayah, Zoe, TFT7b_Volibear",,4.96,
6,-1,"Aphelios, Bard, Graves, Rell, Rengar, Zeri",,4.96,
6,-1,"DragonPurple, Gnar, Jayce, Seraphine, Sylas, Zyra",,4.96,
6,-1,"DragonBlue, DragonEarth, DragonGold, DragonPurple, Sylas",,4.96,
2,-1,"Gnar, Jayce, Shyvana, Yasuo",,4.96,
6,-1,"DragonGuild, Hecarim, Jayce, Rakan, Soraka, Twitch, Xayah",,4.96,
6,-1,"DragonEarth, Hecarim, Rakan, Xayah, Zoe",,4.96,
6,-1,"Hecarim, Lillia, Nilah, Olaf, Pantheon, Sylas, Yasuo, Yone",,4.96,
2,-1,"Aphelios, Bard, Graves, NomsyCannoneer, Rell, Rengar, Zeri, TFT7b_Tristana",,4.96,
6,-1,"DragonBlue, DragonEarth, DragonGold, Twitch",,4.96,
6,-1,"DragonGold, Jax, Xayah, Zoe, TFT7b_Volibear",,4.96,
6,-1,"Bard, DragonBlue, DragonEarth, Hecarim, Nunu, Soraka",,4.96,
6,-1,"AurelionSol, DragonEarth, DragonGold, Jayce, NomsyEvoker, TFT7b_Lulu",,4.96,
6,-1,"Diana, Jax, Lillia, Nilah, Olaf, Rengar, Sylas",,4.96,
2,-1,"Bard, DragonBlue, DragonEarth, Nunu, Soraka, Yasuo",,4.96,
6,-1,"DragonBlue, Jayce, Nunu, Twitch, Yone",,4.96,
2,-1,"Braum, Diana, Lillia, Nilah, Olaf, Rengar, Sylas, Yasuo",,4.96,
6,-1,"DragonBlue, DragonGuild, Hecarim, Jayce, Nunu, Twitch",,4.96,
2,-1,"Bard, Jayce, Shyvana, Twitch, Varus, Xayah, Yasuo, Zoe",,4.96,
6,-1,"AoShin, Pantheon, Seraphine, Soraka, Sylas, Zoe",,4.96,
6,-1,"AurelionSol, DragonEarth, DragonGuild, Shyvana, Soraka",,4.96,
6,-1,"AurelionSol, Bard, DragonEarth, LeeSin, TFT7b_Volibear",,4.96,
6,-1,"Lux, Soraka, Sylas, Twitch, Varus, Zoe",,4.96,
6,-1,"DragonPurple, Lux, NomsyMage, Soraka, Sylas, Zoe, TFT7b_Heimerdinger",,4.96,
6,-1,"AoShin, DragonBlue, DragonEarth, DragonGreen, Yasuo",,4.96,
2,-1,"Bard, DragonGreen, Gnar, Jax, Soraka, Yasuo",,4.96,
6,-1,"Hecarim, Shyvana, Soraka, Xayah, Yasuo, Zoe",,4.96,
6,-1,"DragonGold, Hecarim, Jayce, Rakan, Shyvana, Soraka, Twitch, Xayah",,4.96,
6,-1,"DragonPurple, Jayce, Nilah, Rakan, Sylas, Twitch",,4.96,
6,-1,"Aphelios, Bard, Graves, Hecarim, Rell, Rengar, Soraka, Yasuo",,4.96,
6,-1,"DragonGold, Rakan, Seraphine, Twitch, Xayah, TFT7b_Volibear",,4.96,
6,-1,"Aphelios, Bard, DragonSwain, Graves, Rell, Rengar",,4.96,
6,-1,"AoShin, Bard, DragonGold, LeeSin, Rakan, Shyvana",,4.96,
2,-1,"AoShin, Bard, DragonEarth, DragonGreen, Soraka",,4.96,
6,-1,"Bard, DragonGold, Graves, Nilah, Qiyana, Zac, Zeri",,4.96,
2,-1,"DragonGreen, Gnar, Jax, Jayce, Soraka, Yasuo",,4.96,
6,-1,"DragonGold, Hecarim, Jayce, Rakan, Shyvana, Xayah",,4.96,
6,-1,"AurelionSol, DragonGold, Jax, Seraphine, TFT7b_Volibear",,4.96,
6,-1,"Braum, Diana, Hecarim, Lillia, Olaf, Pantheon, Rakan, Sylas",,4.96,
6,-1,"DragonGold, Jayce, Rakan, Shyvana, Twitch, Xayah",,4.96,
2,-1,"DragonGreen, Gnar, Jax, Jayce, Rakan, Shyvana",,4.96,
6,-1,"AoShin, DragonEarth, DragonGold, DragonGreen, Soraka",,4.96,
6,-1,"DragonBlue, Hecarim, Nunu, Pantheon, Yone",,4.96,
6,-1,"AurelionSol, DragonEarth, DragonGold, DragonGuild, Yasuo",,4.96,
6,-1,"AquaticDragon, Graves, Kaisa, Nilah, Sylas, Zac, Zeri, Zoe",,4.96,
6,-1,"Jayce, Lux, Pantheon, Sylas, Twitch, Varus, Yasuo, Zoe",,4.96,
6,-1,"AoShin, Hecarim, Qiyana, Rakan, Zac",,4.96,
2,-1,"Graves, Hecarim, Nilah, Soraka, Varus, Yasuo",,4.96,
2,-1,"DragonBlue, DragonEarth, DragonGreen, Jayce, Shyvana, Yasuo",,4.96,
6,-1,"AurelionSol, Bard, DragonEarth, Seraphine, Zoe, Zyra",,4.96,
2,-1,"DragonGreen, Jax, Kaisa, Rakan, Seraphine, Zac",,4.96,
6,-1,"Bard, DragonBlue, DragonGuild, Jayce, Nunu, Soraka",,4.96,
6,-1,"Braum, Diana, Lillia, Nilah, Olaf, Rell",,4.96,
6,-1,"DragonGreen, Gnar, Jax, Rakan, Seraphine, Yasuo",,4.96,
2,-1,Yasuo,,4.96,
6,-1,"Kaisa, LeeSin, Nunu, Yasuo",,4.96,
2,-1,"Braum, Diana, Lillia, Nilah, Olaf",,4.96,
6,-1,"Braum, DragonGold, Graves, NomsyCannoneer, Rakan, Seraphine, Zeri, TFT7b_Tristana",,4.96,
2,-1,"DragonBlue, DragonEarth, DragonGold, Jayce, Nunu, Shyvana, Yasuo",,4.96,
6,-1,"Bard, DragonBlue, DragonGold, Nunu, Rakan, Zoe",,4.96,
6,-1,"DragonGuild, Hecarim, Jayce, Rakan, Soraka, Twitch, Xayah",,4.96,
6,-1,"DragonGold, Jax, Kaisa, Soraka, Yasuo, TFT7b_Volibear",,4.96,
6,-1,"DragonEarth, Hecarim, Jayce, Rakan, Twitch, Xayah",,4.96,
2,-1,"AoShin, Bard, DragonGreen, Hecarim, Nunu, Seraphine",,4.96,
6,-1,"DragonPurple, Lux, Pantheon, Sylas, Varus, Zyra",,4.96,
6,-1,"Graves, LeeSin, Qiyana, Yasuo, TFT7b_Volibear",,4.96,
2,-1,"AoShin, Aphelios, Graves, Hecarim, NomsyCannoneer, Rell, TFT7b_Tristana",,4.96,
6,-1,"AurelionSol, Bard, DragonEarth, Graves, Soraka, Sylas, Zoe",,4.96,
2,-1,"Aphelios, Bard, DragonSwain, Graves, NomsyCannoneer, Rell, Yasuo, TFT7b_Tristana",,4.96,
6,-1,"DragonBlue, Jayce, Nunu, Soraka, Twitch",,4.96,
6,-1,"DragonGreen, Hecarim, Jayce, Lillia, Nunu, Shyvana",,4.96,
6,-1,"Aphelios, Graves, Qiyana, Rell, Rengar",,4.96,
6,-1,"AoShin, DragonBlue, DragonGold, DragonGreen, Rakan",,4.96,
6,-1,"AoShin, DragonEarth, Jayce, NomsyEvoker, Shyvana, Soraka, TFT7b_Lulu",,4.96,
2,-1,"DragonBlue, Hecarim, Nunu, Shyvana, Soraka, Yasuo, Yone",,4.96,
2,-1,"DragonPurple, Hecarim, Lillia, Lux, NomsyMage, Sylas, TFT7b_Heimerdinger",,4.96,
6,-1,"DragonBlue, LeeSin, Nunu, Qiyana, Yasuo, Yone",,4.96,
6,-1,"Bard, Braum, Diana, Jax, Lillia, Nilah, Olaf, Yasuo",,4.96,
6,-1,"AoShin, Bard, Jayce, Nilah, Qiyana, Sylas, Zoe",,4.96,
6,-1,"Soraka, Sylas, Twitch, Varus, Zoe, Zyra",,4.96,
6,-1,"Bard, Graves, Jayce, Nilah, Pantheon, Rakan, Shyvana, Xayah, Yasuo",,4.96,
6,-1,"DragonGold, NomsyEvoker, Rakan, Rell, Seraphine, TFT7b_Lulu",,4.96,
6,-1,"Bard, DragonBlue, DragonEarth, Shyvana, Yasuo",,4.96,
2,-1,"Jayce, Kaisa, LeeSin, Shyvana, Yasuo, TFT7b_Volibear",,4.96,
2,-1,"Bard, DragonBlue, Jayce, Nunu, Rakan, Shyvana, Yasuo",,4.96,
5,-1,"DragonBlue, DragonGold, Jayce, Rakan, Shyvana",,4.96,
4,-1,"DragonGold, Jax, Rakan, Twitch, Varus, Xayah",,4.96,
3,-1,"Hecarim, Jayce, Nunu, Twitch, Varus, Xayah, Yasuo",,4.96,
3,-1,"Braum, Graves, Hecarim, Jax, Nilah, Soraka, Varus, Zyra",,4.96,
3,-1,"DragonBlue, DragonEarth, DragonGold, Jayce, Shyvana",,4.96,
4,-1,"Braum, Jayce, Olaf, Pantheon, Sylas, Yone, Zyra",,4.96,
3,-1,"Braum, Olaf, Rakan, Yone, Zac",,4.96,
3,-1,"AoShin, DragonBlue, DragonEarth, Jayce, Rakan, Shyvana",,4.96,
4,-1,"AoShin, Bard, Hecarim, Jayce, Rakan, Shyvana",,4.96,
3,-1,"Bard, DragonBlue, DragonGold, DragonGreen, DragonPurple",,4.96,
4,-1,"DragonBlue, Hecarim, Nunu, Shyvana, Yasuo, Yone",,4.96,
4,-1,"AurelionSol, Bard, DragonEarth, Hecarim, Nunu",,4.96,
4,-1,"AoShin, Bard, DragonEarth, Rakan, Seraphine, Zyra",,4.96,
4,-1,"DragonGold, Jayce, Rakan, Twitch, Xayah",,4.96,
4,-1,"Hecarim, Olaf, Rakan, Twitch",,4.96,
4,-1,"Aphelios, Graves, Hecarim, Jayce, Rell, Shyvana, Zeri",,4.96,
4,-1,"AurelionSol, DragonEarth, DragonGreen, Jayce, Rakan, Shyvana",,4.96,
4,-1,"Bard, DragonSwain, Graves, Rell, Rengar, Zoe",,4.96,
4,-1,"AoShin, DragonEarth, DragonGreen, Rakan, Shyvana, Zeri",,4.96,
4,-1,"DragonGold, Jax, Soraka, Xayah, Yasuo, Zoe, TFT7b_Volibear",,4.96,
3,-1,"AurelionSol, DragonEarth, DragonGold, NomsyEvoker, Rakan, Seraphine, TFT7b_Lulu",,4.96,
3,-1,"Braum, Diana, Lillia, Olaf, Pantheon, Soraka, Sylas, Yasuo, Zoe",,4.96,
3,-1,"Aphelios, Graves, Jayce, Rell, Twitch, Xayah",,4.96,
3,-1,"AurelionSol, Lux, NomsyMage, Sylas, Zoe, TFT7b_Heimerdinger",,4.96,
3,-1,"Aphelios, DragonSwain, Jayce, Lillia, Nunu, Rell, Rengar",,4.96,
4,-1,"AoShin, DragonEarth, DragonGold, Shyvana, Yasuo",,4.96,
4,-1,"AoShin, Bard, DragonGuild, Jayce, Twitch",,4.96,
4,-1,"Braum, Diana, Hecarim, Lillia, Nilah, Olaf, Yone",,4.96,
4,-1,"AoShin, Bard, DragonGold, Graves, Rakan, Soraka, Zoe",,4.96,
4,-1,"Bard, Lux, Soraka, Sylas, Twitch, Varus, Zoe, Zyra",,4.96,
4,-1,"AquaticDragon, Hecarim, Lillia, NomsyMage, Sylas, Zoe, TFT7b_Heimerdinger",,4.96,
4,-1,"Aphelios, DragonSwain, Graves, Jayce, LeeSin, Rell, Rengar",,4.96,
3,-1,"AoShin, AquaticDragon, AurelionSol, Sylas, Zoe",,4.96,
4,-1,"Bard, DragonBlue, DragonGold, Rakan, Shyvana, Yasuo",,4.96,
4,-1,"Aphelios, Bard, Graves, Qiyana, Rell, Soraka",,4.96,
4,-1,"Bard, Graves, Kaisa, LeeSin, Twitch, Yasuo, TFT7b_Volibear",,4.96,
3,-1,"Braum, Diana, Lillia, Olaf, Pantheon, Sylas",,4.96,
3,-1,"DragonGreen, Gnar, Jax, Seraphine",,4.96,
4,-1,"DragonGold, Jax, Zoe, TFT7b_Volibear",,4.96,
3,-1,"DragonEarth, Graves, Kaisa, LeeSin, Yasuo, TFT7b_Volibear",,4.96,
4,-1,"Bard, DragonGreen, Gnar, Jayce, Soraka",,4.96,
3,-1,"DragonBlue, Yasuo, Yone",,4.96,
3,-1,"AoShin, DragonEarth, DragonGuild, Jayce, Shyvana, Soraka",,4.96,
4,-1,"Aphelios, DragonSwain, Hecarim, Rell, Rengar",,4.96,
4,-1,"AurelionSol, DragonEarth, DragonGold, Jayce, Shyvana",,4.96,
3,-1,"DragonGold, Graves, Kaisa, Nilah, NomsyEvoker, Zac, Zeri, TFT7b_Lulu",,4.96,
4,-1,"AoShin, Bard, DragonEarth, Jayce, LeeSin, Rakan, Yasuo",,4.96,
3,-1,"AquaticDragon, DragonEarth, Seraphine, Zoe",,4.96,
4,-1,"Graves, Jax, Nilah, Nunu, Pantheon, Seraphine, Xayah, TFT7b_Volibear",,4.96,
4,-1,"AurelionSol, DragonEarth, DragonGold, NomsyEvoker, Rakan, Soraka, TFT7b_Lulu",,4.96,
4,-1,"Aphelios, Graves, Nilah, Qiyana, Rell, Rengar",,4.96,
4,-1,"AoShin, DragonEarth, Graves, Jayce, Shyvana, Soraka",,4.96,
4,-1,"AurelionSol, Jayce, Lux, Olaf, Varus",,4.96,
4,-1,"Bard, Lillia, Lux, NomsyMage, Sylas, TFT7b_Heimerdinger",,4.96,
4,-1,"Braum, DragonGold, Rakan, Twitch, Zac",,4.96,
3,-1,"Bard, DragonGreen, Gnar, Jax, Jayce, Soraka, Yasuo",,4.96,
4,-1,"DragonBlue, DragonGold, Rakan, Twitch, Xayah",,4.96,
3,-1,"Braum, Diana, Lillia, Nilah, Olaf, Qiyana, Rengar, Yasuo",,4.96,
3,-1,"DragonEarth, Hecarim, Jayce, Rakan, Shyvana, Twitch, Xayah",,4.96,
4,-1,"Bard, DragonGuild, Jayce, Rakan, Soraka, Twitch, Xayah",,4.96,
3,-1,"DragonEarth, Hecarim, Rakan, Shyvana, Twitch, Xayah",,4.96,
3,-1,"Braum, Diana, Hecarim, Lillia, Nilah, Olaf",,4.96,
3,-1,"Aphelios, DragonSwain, Hecarim, Rell, Twitch, Xayah",,4.96,
3,-1,"DragonBlue, DragonEarth, LeeSin, Nunu, Pantheon, Yasuo",,4.96,
3,-1,"DragonBlue, DragonEarth, Hecarim, Shyvana, Yasuo",,4.96,
3,-1,"Bard, Lux, Sylas, Twitch, Varus",,4.96,
3,-1,"Aphelios, Bard, Graves, Hecarim, NomsyCannoneer, Rell, Soraka, TFT7b_Tristana",,4.96,
3,-1,"Braum, Diana, LeeSin, Lillia, Nilah, Olaf, Pantheon",,4.96,
3,-1,"Braum, Diana, Nilah, Olaf, Pantheon, Soraka, Sylas, Yasuo",,4.96,
3,-1,"DragonEarth, Graves, Nilah, Nunu, Pantheon, Seraphine, Varus",,4.96,
3,-1,"Nilah, Pantheon",,4.96,
3,-1,"DragonGold, Graves, Nilah, Qiyana, Rakan, Seraphine, Yasuo, Zeri",,4.96,
3,-1,"Bard, Graves, Hecarim, Nilah, Zyra",,4.96,
3,-1,"AurelionSol, DragonEarth, Hecarim, Qiyana, Shyvana, Soraka, Zoe",,4.96,
3,-1,"Bard, Diana, Lillia, Nilah, Nunu, Olaf, Pantheon, Sylas",,4.96,
3,-1,"AoShin, Bard, DragonGold, Rakan, Shyvana, Soraka, Yasuo",,4.96,
3,-1,"DragonBlue, Olaf, Pantheon, Rakan, Sylas, Yasuo, Yone",,4.96,
3,-1,"DragonGold, DragonPurple, Jax, Sylas, Yasuo, Zyra",,4.96,
3,-1,"AoShin, Bard, DragonBlue, Hecarim, LeeSin, Nunu, Yasuo",,4.96,
3,-1,"Bard, DragonEarth, Olaf, Rakan, Seraphine, Yasuo, Yone",,4.96,
3,-1,"AquaticDragon, DragonGold, Seraphine, Sylas, Zyra",,4.96,
3,-1,"AoShin, AurelionSol, Bard, DragonEarth, DragonGold, Soraka",,4.96,
3,-1,"AoShin, Bard, Graves, Pantheon, Shyvana, Soraka, Zoe",,4.96,
3,-1,"DragonGuild, Jayce, Shyvana, Soraka, Twitch, Xayah",,4.96,
3,-1,"Hecarim, Kaisa, LeeSin, Shyvana, Yasuo, TFT7b_Volibear",,4.96,
3,-1,"DragonEarth, Kaisa, LeeSin, Yasuo, Yone, TFT7b_Volibear",,4.96,
3,-1,"AoShin, DragonEarth, Lux, Sylas, Zoe, Zyra",,4.96,
3,-1,"AurelionSol, Jayce, Seraphine, Shyvana, Soraka, Sylas, Zyra",,4.96,
3,-1,"DragonGuild, Jayce, Rakan, Twitch, Xayah, Zac",,4.96,
3,-1,"AoShin, Bard, Hecarim, LeeSin, Nunu, Rakan, Seraphine, Yasuo",,4.96,
3,-1,"Aphelios, Graves, Hecarim, Qiyana, Rell",,4.96,
3,-1,"DragonGreen, Gnar, Jayce, Shyvana, Soraka, Zyra",,4.96,
4,-1,"Kaisa, LeeSin, Nunu, TFT7b_Volibear",,4.96,
4,-1,"AurelionSol, Jayce, Lux, Sylas, Varus",,4.96,
4,-1,"Graves, Nilah, Soraka, Sylas, Xayah, Yasuo",,4.96,
4,-1,"AurelionSol, Bard, DragonGold, Rakan, Seraphine, Soraka",,4.96,
3,-1,"Aphelios, Graves, Hecarim, Jayce, Nilah, Qiyana, Rengar",,4.96,
4,-1,"Braum, Diana, Lillia, Olaf, Pantheon, Rakan, Seraphine, Sylas",,4.96,
3,-1,"DragonEarth, Hecarim, Jayce, Rakan, Shyvana, Xayah",,4.96,
4,-1,"Aphelios, Graves, Jax, LeeSin, NomsyCannoneer, Sylas, TFT7b_Tristana",,4.96,
4,-1,"DragonGreen, Gnar, Jax, Jayce, Pantheon, Soraka, Yasuo",,4.96,
3,-1,"Bard, DragonEarth, DragonGuild, Gnar, Jayce, Twitch",,4.96,
4,-1,"Braum, Diana, Lillia, Nilah, Olaf, Pantheon, Qiyana",,4.96,
3,-1,"DragonBlue, Hecarim, Nunu, Pantheon, Soraka, Yasuo, Yone, Zoe",,4.96,
4,-1,"Braum, Diana, Hecarim, Lillia, Nilah, Olaf",,4.96,
3,-1,"Gnar, LeeSin, Shyvana, Soraka, Yasuo, TFT7b_Volibear",,4.96,
4,-1,"AoShin, DragonEarth, DragonGold, Jax, Zoe, TFT7b_Volibear",,4.96,
4,-1,"Gnar, Jayce, Shyvana, Twitch, Varus, Xayah",,4.96,
4,-1,"DragonBlue, Hecarim, Nunu, Rell, Twitch, Xayah",,4.96,
4,-1,"DragonBlue, DragonGold, Hecarim, Nunu, Yasuo",,4.96,
3,-1,"Bard, DragonGreen, Gnar, Jayce, Shyvana, Soraka",,4.96,
4,-1,"DragonGuild, Jayce, Nilah, Twitch",,4.96,
4,-1,"AoShin, Bard, DragonBlue, DragonEarth, DragonGold, Soraka, Yasuo",,4.96,
4,-1,"Bard, DragonGuild, Jayce, Soraka, Twitch, Varus",,4.96,
3,-1,"Braum, Graves, Jayce, Nilah, Soraka, Xayah, Yasuo, Zyra",,4.96,
3,-1,"AurelionSol, Bard, DragonGold, DragonGreen, Rakan, Seraphine, Shyvana",,4.96,
3,-1,"Bard, DragonEarth, DragonGreen, Jayce, Rakan, Seraphine, Shyvana",,4.96,
3,-1,"Bard, DragonGreen, DragonPurple, Jax, Jayce, Soraka",,4.96,
4,-1,"Braum, Olaf, Pantheon, Rakan, Yone, Zac",,4.96,
5,-1,"Diana, Hecarim, Lillia, Nilah, Nunu, Olaf, Sylas",,4.96,
3,-1,"DragonBlue, DragonGuild, Jayce, Nunu, Shyvana, Twitch",,4.96,
4,-1,"Aphelios, Graves, Hecarim, Nunu, Rell, Zeri, Zoe",,4.96,
5,-1,"Hecarim, Jayce, Lillia, Nilah, Nunu, Rell, Yasuo",,4.96,
3,-1,"Aphelios, Rell, Rengar",,4.96,
3,-1,"DragonBlue, Graves, Hecarim, Lillia, Nunu, Rell",,4.96,
5,-1,"Bard, DragonGold, Hecarim, Jayce, Rakan, Soraka, Twitch, Xayah",,4.96,
3,-1,"Aphelios, DragonSwain, Nilah, Qiyana, Rengar, Yasuo, Yone",,4.96,
5,-1,"DragonEarth, DragonGreen, Gnar, Jax, Jayce, Nilah",,4.96,
5,-1,"AurelionSol, Bard, DragonEarth, Sylas, Yasuo, Zoe, Zyra",,4.96,
5,-1,"AquaticDragon, Pantheon, Seraphine, Sylas, Zoe",,4.96,
5,-1,"DragonBlue, DragonGuild, Hecarim, Jayce, Nunu",,4.96,
3,-1,"Braum, DragonBlue, Pantheon, Sylas, Yasuo, Yone",,4.96,
5,-1,"Bard, DragonGold, Jayce, Shyvana, Twitch, Xayah",,4.96,
5,-1,"Bard, Hecarim, Kaisa, LeeSin, Nunu, Soraka, TFT7b_Volibear",,4.96,
3,-1,"Bard, DragonBlue, Hecarim, Jayce, Nunu, Rakan, Yone",,4.96,
5,-1,"AoShin, DragonGold, LeeSin, Rakan, Seraphine, Yasuo",,4.96,
5,-1,"DragonEarth, Hecarim, Jayce, Rakan, Shyvana, Xayah, Yasuo",,4.96,
5,-1,"DragonGold, Rakan, Twitch, Varus, Xayah",,4.96,
3,-1,"DragonGold, DragonPurple, Olaf, Pantheon, Seraphine, Sylas, Zyra",,4.96,
5,-1,"AoShin, Bard, DragonGold, LeeSin, Rakan, Yasuo",,4.96,
5,-1,"AoShin, DragonEarth, Kaisa, LeeSin, Yasuo, Yone",,4.96,
5,-1,"Bard, DragonGuild, Hecarim, Shyvana, Twitch, Xayah",,4.96,
5,-1,"Bard, DragonPurple, Hecarim, Sylas, Twitch, Xayah",,4.96,
3,-1,"DragonPurple, Graves, Hecarim, NomsyCannoneer, Rell, Sylas, Zeri, TFT7b_Tristana",,4.96,
5,-1,"Aphelios, Bard, Graves, Hecarim, Rell, Rengar, Soraka, Zeri",,4.96,
5,-1,"Bard, DragonBlue, DragonGuild, Jayce, Nunu, Soraka, Yasuo",,4.96,
3,-1,"Bard, DragonGold, Jax, LeeSin, Rakan, Zoe, TFT7b_Volibear",,4.96,
3,-1,"Aphelios, Graves, Hecarim, Jayce, Nilah, Qiyana, Rell, Rengar",,4.96,
5,-1,"AoShin, Bard, DragonGold, Seraphine, Shyvana, Yasuo",,4.96,
5,-1,"DragonEarth, DragonPurple, Pantheon, Soraka, Sylas, Yasuo, Zyra",,4.96,
3,-1,"AurelionSol, Bard, Sylas, Yasuo, Zoe, Zyra",,4.96,
5,-1,"Bard, Lux, Soraka, Sylas, Varus, Yasuo, Zoe",,4.96,
5,-1,"Aphelios, Graves, Rell, Rengar, Yasuo",,4.96,
2,-1,DragonEarth,,4.96,
2,-1,"Bard, DragonPurple, NomsyEvoker, Pantheon, Sylas, Zyra, TFT7b_Lulu",,4.96,
5,-1,"AoShin, Kaisa, LeeSin, Shyvana, TFT7b_Volibear",,4.96,
5,-1,"AoShin, Diana, DragonGold, Nilah, Qiyana, Rengar",,4.96,
