comp,value_count,average_placement,group,grp_count,grp_placement
"Ashe, DragonPurple, Elise, Gnar, Neeko, Pyke, Sylas, Zoe",1,3.0,559,2,5.0
"Ashe, DragonPurple, Elise, Neeko, Pyke, Soraka, Sylas",2,3.0,129,83,4.935790273556231
"Bard, Hecarim, Kayn, Nami, Pyke, Sejuani, Shen, Sylas, Zoe",1,3.0,560,1,3.0
"Bard, Braum, Jinx, Lulu, Senna, Thresh, TrainerDragon, Tristana",1,3.0,9,795,3.863117852253815
"Anivia, Ashe, Bard, DragonGreen, Gnar, Nami, Neeko, Soraka",1,3.0,113,264,4.447631535131535
"DragonPurple, Ornn, Pyke, Qiyana, Skarner, Sylas, Thresh",1,3.0,561,8,5.888888888888888
"Braum, Diana, Olaf, Ornn, Pyke, Qiyana, Shen, Talon, Thresh",1,3.0,11,510,4.404484592464881
"AoShin, DragonGreen, Neeko, Shyvana, Soraka",1,3.0,562,1,3.0
"DragonPurple, Elise, Leona, Neeko, Soraka, Sylas, Thresh",1,3.0,22,1225,4.750811401844438
"DragonPurple, Ornn, Pyke, Shen, Sylas, Talon, Thresh, Yasuo",1,3.0,164,86,4.395288753799392
"DragonBlue, Hecarim, Nunu, Ryze, Sejuani, Talon, Twitch",1,3.0,563,6,6.0
"DragonPurple, Ornn, Pyke, Shen, Sylas, Talon, Yasuo",1,3.0,164,86,4.395288753799392
"Anivia, Corki, DragonGreen, Gnar, Neeko, Sona, Soraka",2,3.0,113,264,4.447631535131535
"Bard, Braum, Corki, DragonGold, Lulu, Sona, TrainerDragon, Tristana, Yasuo",7,3.0,9,795,3.863117852253815
"DragonGreen, Heimerdinger, Illaoi, Lulu, Nami, Sylas, TrainerDragon, Tristana",1,3.0,564,1,3.0
"Aatrox, Bard, Corki, DragonGold, Kayn, Tristana, Volibear, Zoe",1,3.0,565,2,5.5
"DragonBlue, Hecarim, Nunu, Sejuani, Soraka, Thresh, Yasuo, Yone",1,3.0,120,309,4.651911585419412
"Aatrox, Diana, Olaf, Sejuani, Shen, Talon, Yasuo, Yone",1,3.0,124,59,4.585648148148148
"Anivia, Corki, DragonPurple, Lulu, Sona, Sylas, TrainerDragon, Tristana",1,3.0,566,2,3.5
"DragonPurple, Hecarim, Ornn, Shen, Sylas, Thresh, Yasuo",1,3.0,164,86,4.395288753799392
"DragonBlue, Hecarim, Nunu, Sejuani, Soraka, Twitch, Yasuo",1,3.0,567,1,3.0
"DragonPurple, Ornn, Pyke, Ryze, Shen, Sylas, Zoe",1,3.0,173,7,3.7142857142857144
"Anivia, Braum, DragonGreen, Gnar, Leona, Neeko, Sejuani, Taric, Thresh",1,3.0,568,1,3.0
"AoShin, Bard, Lillia, Lulu, Nami, Ornn, Pyke, Ryze, Sylas, Zoe",1,3.0,6,510,3.4673890669769794
"AoShin, Bard, Lulu, Ornn, Sylas, Yasuo, Zoe",8,3.0,6,510,3.4673890669769794
"Corki, DragonPurple, Lillia, Lulu, Nami, Sona, Sylas, TrainerDragon, Tristana",1,3.0,67,107,5.578474903474904
"DragonPurple, Ornn, Pyke, Qiyana, Talon, Thresh, Yasuo",1,3.0,164,86,4.395288753799392
"DragonBlue, Hecarim, Nunu, Olaf, Sejuani, Shen, Talon, Yone",1,3.0,141,35,3.7890625
"AoShin, Heimerdinger, Illaoi, Lulu, Nami, Ornn, Sylas, TrainerDragon",1,3.0,222,131,5.347627468317124
"AoShin, Ashe, Bard, Gnar, Neeko, Ornn, Soraka, Yasuo",1,3.0,569,2,3.0
"DragonBlue, Hecarim, Nunu, Ornn, Pyke, Sejuani, Talon",1,3.0,570,3,3.3333333333333335
"Anivia, DragonGreen, Gnar, Lulu, Neeko, Ornn, Ryze",1,3.0,571,3,5.666666666666667
"DragonBlue, Hecarim, Nunu, Ornn, Qiyana, Shen, Talon",1,3.0,570,3,3.3333333333333335
"DragonPurple, Ornn, Pyke, Qiyana, Shen, Soraka, Sylas, Thresh",1,3.0,164,86,4.395288753799392
"AoShin, Heimerdinger, Illaoi, Lulu, Nami, Ryze, Sylas, TrainerDragon, Zoe",1,3.0,63,897,5.294043124972479
"Bard, DragonBlue, DragonGold, DragonGreen, Lulu, Nami",1,3.0,572,1,3.0
"AoShin, Ashe, Bard, Gnar, LeeSin, Neeko, Yasuo",1,3.0,569,2,3.0
"AoShin, Ornn, Shyvana, Soraka, Sylas, Yasuo, Zoe",1,3.0,573,1,3.0
"Aatrox, Illaoi, LeeSin, Nidalee, Pyke, Senna, Sett, Sona",1,3.0,574,1,3.0
"Anivia, DragonGreen, Lulu, Nami, Neeko, Sylas, Zoe",1,3.0,112,18,3.625
"Anivia, AoShin, Leona, Lulu, Neeko, Ornn, Taric",1,3.0,575,1,3.0
"AoShin, Bard, Heimerdinger, Lulu, Nami, Ornn, Sylas, TrainerDragon, Yasuo",10,3.0,0,590,3.0724413297820004
"Aatrox, DragonBlue, Leona, Nunu, Shen, Yasuo, Yone",1,3.0,576,1,3.0
"DragonPurple, Ornn, Pyke, Qiyana, Soraka, Thresh, Yasuo",1,3.0,164,86,4.395288753799392
"Anivia, DragonGreen, Lulu, Neeko, Sona, Soraka, Yasuo",1,3.0,113,264,4.447631535131535
"Illaoi, Nami, Nidalee, Ryze, Skarner, Twitch, Varus, Vladimir, Xayah",1,3.0,242,353,4.35011250186688
"DragonPurple, Ornn, Pyke, Qiyana, Soraka, Yasuo, Zoe",1,3.0,386,2,2.5
"Anivia, DragonGreen, Elise, Gnar, Neeko, Nidalee, Yasuo",1,3.0,577,1,3.0
"Anivia, DragonGreen, Elise, Gnar, Neeko, Swain, Sylas, Talon",1,3.0,337,8,4.5
"Corki, DragonPurple, Jinx, Lulu, Ornn, Senna, Sylas, TahmKench, TrainerDragon, Tristana",1,3.0,578,1,3.0
"Anivia, DragonGreen, Elise, Gnar, Lulu, Neeko, Nidalee, Thresh",1,3.0,337,8,4.5
"Bard, Braum, Diana, Lillia, Olaf, Sylas, Thresh, Zoe",1,3.0,579,1,3.0
"DragonPurple, Illaoi, Ornn, Shen, Skarner, Sylas, Thresh",1,3.0,164,86,4.395288753799392
"Anivia, AoShin, Hecarim, Lillia, Nunu, Ornn, Sejuani, Volibear",1,3.0,145,41,5.246376811594203
"Bard, DragonBlue, Hecarim, Lillia, Nunu, Sejuani, Soraka, Yasuo, Yone",1,3.0,60,173,3.6427693833943837
"Illaoi, Nami, Nidalee, Skarner, Soraka, Sylas, Twitch, Varus, Vladimir",1,3.0,242,353,4.35011250186688
"DragonPurple, Olaf, Ornn, Pyke, Sylas, Talon, Thresh",1,3.0,580,1,3.0
"DragonPurple, Olaf, Ornn, Pyke, Qiyana, Sylas, Yasuo",1,3.0,581,2,5.0
"Anivia, DragonPurple, Elise, Neeko, Soraka, Sylas, Thresh",2,3.0,390,56,4.858679593721145
"Bard, DragonBlue, Hecarim, Leona, Nunu, Ryze, Soraka, Yasuo",1,3.0,60,173,3.6427693833943837
"Bard, DragonBlue, Hecarim, Leona, Nunu, Ryze, Sejuani, Yone",1,3.0,60,173,3.6427693833943837
"Anivia, DragonPurple, Elise, Neeko, Pyke, Soraka, Sylas, Talon",1,3.0,390,56,4.858679593721145
"Anivia, DragonPurple, Elise, Neeko, Pyke, Sylas, Talon, Yasuo",1,3.0,390,56,4.858679593721145
"Bard, DragonBlue, Hecarim, Leona, Nunu, Ryze, Sejuani, Yasuo, Yone",1,3.0,60,173,3.6427693833943837
"AoShin, Bard, DragonPurple, Lulu, Ornn, Yasuo",1,3.0,582,1,3.0
"Bard, DragonBlue, Leona, Nunu, Soraka, Yasuo, Yone, Zoe",1,3.0,86,5,3.25
"DragonBlue, Nunu, Yasuo, Yone",1,3.0,583,1,3.0
"AoShin, Bard, DragonPurple, Lulu, Ornn, Sylas",1,3.0,55,81,4.365671641791045
"Illaoi, Nami, Nidalee, Skarner, Talon, Twitch, Varus, Vladimir",5,3.0,242,353,4.35011250186688
"DragonGreen, Gnar, Neeko, Nidalee, Soraka, Swain",1,3.0,584,2,3.0
"DragonPurple, Olaf, Ornn, Qiyana, Shen, Sylas, Talon",1,3.0,585,5,6.0
"Bard, Braum, DragonGold, Ezreal, Qiyana, Talon, Twitch, Xayah",1,3.0,586,1,3.0
"DragonGreen, Gnar, Neeko, Nidalee, Soraka, Swain, Xayah",1,3.0,584,2,3.0
"DragonGreen, Hecarim, Lulu, Nami, Nunu, Sejuani, Sona, Yasuo",1,3.0,587,1,3.0
"Bard, DragonBlue, Hecarim, Nunu, Pyke, Sejuani, Sylas",1,3.0,588,2,5.0
"Aatrox, DragonBlue, Hecarim, Lillia, Nunu, Shen, Yasuo, Yone",1,3.0,589,3,3.6666666666666665
"AoShin, Bard, Heimerdinger, Lulu, Nami, Ornn, Sylas, TrainerDragon, Vladimir",2,3.0,0,590,3.0724413297820004
"DragonGreen, Gnar, Lulu, Neeko, Pyke, Soraka, Talon",1,3.0,590,3,6.0
"DragonGreen, Gnar, Nami, Neeko, Soraka, Yasuo, Zoe",1,3.0,591,1,3.0
"Illaoi, Nami, Nidalee, Ornn, Skarner, Twitch, Varus, Vladimir",1,3.0,242,353,4.35011250186688
"DragonBlue, Leona, Nunu, Ornn, Sylas, Thresh, Yone",1,3.0,592,1,3.0
"Anivia, DragonPurple, Elise, Gnar, Neeko, Pyke, Soraka, Sylas",1,3.0,390,56,4.858679593721145
"Anivia, AoShin, Heimerdinger, Lulu, Nami, Ornn, Sylas, TrainerDragon, Vladimir, Zoe",1,3.0,379,15,3.9615384615384617
"Corki, DragonPurple, Ornn, Qiyana, Skarner, Soraka, Sylas, TahmKench",1,3.0,593,1,3.0
"Bard, DragonBlue, Hecarim, Lillia, Nunu, Sejuani, Talon, Yasuo",1,3.0,60,173,3.6427693833943837
"Anivia, AoShin, Heimerdinger, Lulu, Ornn, Sona, Sylas, TrainerDragon",1,3.0,138,16,4.920634920634921
"Corki, DragonPurple, Heimerdinger, Nami, Sona, Sylas, TrainerDragon, Tristana",2,3.0,67,107,5.578474903474904
"AoShin, Bard, DragonPurple, Nami, Ornn, Pyke, Zoe",1,3.0,6,510,3.4673890669769794
"Anivia, Heimerdinger, Illaoi, Lulu, Nami, Ryze, Sona, Sylas, TrainerDragon, Zoe",1,3.0,379,15,3.9615384615384617
"Bard, DragonGold, DragonGreen, DragonPurple, Thresh, Yasuo",1,3.0,594,4,3.1666666666666665
"DragonBlue, Leona, Lillia, Nunu, Ryze, Sejuani, Zoe",1,3.0,595,1,3.0
"Braum, Diana, Illaoi, Lillia, Olaf, Ornn, Qiyana, Shen, Talon",1,3.0,11,510,4.404484592464881
"Anivia, DragonPurple, Elise, Gnar, Neeko, Pyke, Swain, Sylas",1,3.0,390,56,4.858679593721145
"AoShin, Bard, DragonPurple, Ornn, Soraka, Sylas, Zoe",1,3.0,6,510,3.4673890669769794
"AoShin, Heimerdinger, Lulu, Nami, Ornn, Sona, Sylas, TrainerDragon, Yasuo",1,3.0,222,131,5.347627468317124
"Bard, DragonGold, DragonGreen, DragonPurple, Soraka, Yasuo",1,3.0,594,4,3.1666666666666665
"Illaoi, Nami, Nidalee, Skarner, Soraka, Varus, Vladimir, Yasuo",1,3.0,596,1,3.0
"DragonBlue, Leona, Olaf, Shen, Thresh, Yasuo, Yone",1,3.0,141,35,3.7890625
"Bard, DragonBlue, Hecarim, Leona, Lillia, Nunu, Sejuani, Yasuo",1,3.0,60,173,3.6427693833943837
"DragonPurple, Elise, Heimerdinger, Lulu, Neeko, Sylas, Thresh, TrainerDragon, Zoe",1,3.0,597,2,4.5
"Braum, Corki, Heimerdinger, Jinx, Lulu, Senna, Sona, Thresh, TrainerDragon, Tristana",1,3.0,229,233,4.803836273821029
"Aatrox, Hecarim, Lillia, Nunu, Olaf, Sejuani, Shen, Yasuo, Yone",2,3.0,124,59,4.585648148148148
"Braum, Leona, Pyke, Senna, Taric, Thresh, Yasuo, Yone",1,3.0,237,19,5.055555555555556
"Illaoi, Nami, Nidalee, Skarner, Twitch, Varus, Vladimir, Xayah",1,3.0,242,353,4.35011250186688
"Illaoi, Nami, Nidalee, Skarner, Soraka, Varus, Vladimir, Zoe",4,3.0,245,78,4.228298611111112
"DragonGreen, DragonPurple, Neeko, Soraka, Sylas, Zoe",1,3.0,598,1,3.0
"DragonPurple, Illaoi, Ornn, Ryze, Soraka, Sylas, Varus, Zoe",1,3.0,599,1,3.0
"Bard, Braum, Diana, Lillia, Olaf, Qiyana, Shen, Talon",1,3.0,297,4,2.5
"Aatrox, Anivia, Hecarim, LeeSin, Nunu, Ornn, Volibear, Yasuo",1,3.0,600,1,3.0
"Bard, Hecarim, Neeko, Shen, Shyvana, Twitch, Xayah, Yasuo",1,3.0,53,434,4.10255703113372
"Anivia, Ashe, DragonGreen, Gnar, Karma, Leona, Neeko, Taric",1,3.0,113,264,4.447631535131535
"DragonPurple, Elise, Neeko, Olaf, Shen, Sylas, Talon",1,3.0,601,3,5.666666666666667
"DragonBlue, Hecarim, Leona, Lillia, Nunu, Sejuani, Twitch, Yone",1,3.0,602,30,5.8933333333333335
"Bard, Hecarim, Ryze, Sejuani, Shyvana, Talon, Twitch, Xayah",1,3.0,53,434,4.10255703113372
"DragonBlue, Hecarim, Leona, Nunu, Thresh, Yone",1,3.0,120,309,4.651911585419412
"DragonBlue, Hecarim, Leona, Nunu, Thresh, Yasuo, Yone",1,3.0,120,309,4.651911585419412
"Braum, Corki, Jinx, Senna, Sona, Thresh, Tristana",1,3.0,603,2,5.5
"Anivia, Ashe, DragonGreen, Gnar, Neeko, Soraka, Zoe",2,3.0,604,2,3.0
"DragonGold, Heimerdinger, Lulu, Nami, Sona, Soraka, TrainerDragon, Zoe",1,3.0,605,1,3.0
"DragonBlue, Hecarim, Leona, Nunu, Pyke, Thresh, Yasuo, Yone",1,3.0,120,309,4.651911585419412
"Braum, Corki, Jinx, Leona, Lulu, Sona, Thresh, TrainerDragon, Tristana",2,3.0,229,233,4.803836273821029
"Aatrox, Braum, Diana, Lillia, Olaf, Shen, Yasuo, Yone",1,3.0,124,59,4.585648148148148
"DragonPurple, Neeko, Ornn, Pyke, Qiyana, Shen, Sylas, Yasuo",1,3.0,164,86,4.395288753799392
"AoShin, Bard, Corki, Lulu, Ornn, Sylas, Zoe",1,3.0,6,510,3.4673890669769794
"Diana, Lillia, Olaf, Pyke, Qiyana, Ryze, Sylas, Twitch",1,3.0,606,1,3.0
"DragonPurple, Ezreal, LeeSin, Ornn, Qiyana, Xayah, Yasuo",1,3.0,607,1,3.0
"DragonGold, DragonPurple, Hecarim, Neeko, Xayah, Yasuo",1,3.0,608,1,3.0
"DragonPurple, Elise, Ornn, Shen, Sylas, Thresh, Yasuo, Zoe",1,3.0,609,2,4.0
"Diana, Nami, Olaf, Ornn, Ryze, Soraka, Sylas, Talon",1,3.0,610,1,3.0
"Bard, Illaoi, Nami, Qiyana, Soraka, Talon, Twitch, Varus",1,3.0,25,237,2.922690935803459
"Anivia, Ashe, DragonGreen, Gnar, Neeko, Sona, Soraka, Taric",1,3.0,113,264,4.447631535131535
"Bard, Hecarim, Sejuani, Shen, Shyvana, Twitch, Xayah, Yasuo",1,3.0,53,434,4.10255703113372
"Bard, DragonBlue, Nunu, Sejuani, Soraka, Yasuo, Yone, Zoe",2,3.0,86,5,3.25
"Anivia, Ashe, DragonGreen, Karma, LeeSin, Ornn, Swain, Volibear",1,3.0,122,29,4.860526315789474
"Illaoi, Nami, Ornn, Twitch, Varus",2,3.0,254,71,5.241414835164835
"Anivia, Ashe, Bard, DragonGreen, Gnar, Karma, Lulu, Neeko, Yasuo",1,3.0,113,264,4.447631535131535
"Anivia, Ashe, Bard, DragonGreen, Gnar, Neeko, Soraka, Xayah",1,3.0,113,264,4.447631535131535
"Braum, Diana, Hecarim, Lillia, Ryze, Sylas, Thresh",1,3.0,611,1,3.0
"Diana, Lillia, Olaf, Ornn, Shen, Sylas, Talon, Zoe",1,3.0,612,1,3.0
"AoShin, Bard, Heimerdinger, LeeSin, Lulu, Sylas, TrainerDragon, Zoe",1,3.0,0,590,3.0724413297820004
"AoShin, Bard, Neeko, Ornn, Sylas, Yasuo, Zoe",1,3.0,6,510,3.4673890669769794
"AoShin, Gnar, Lulu, Neeko, Pyke, Sona, Soraka, Yasuo",1,3.0,613,1,3.0
"Bard, Hecarim, Nunu, Pyke, Sejuani, Soraka, Yasuo, Yone, Zoe",1,3.0,614,1,3.0
"Braum, DragonBlue, Hecarim, Leona, Nunu, Olaf, Yone",1,3.0,198,28,3.9174603174603173
"AoShin, Bard, Lulu, Ornn, Sona, Soraka, Yasuo",1,3.0,55,81,4.365671641791045
"DragonPurple, Heimerdinger, Lillia, Lulu, Nami, Ryze, Sona, Sylas, TrainerDragon, Zoe",1,3.0,134,38,4.337301587301587
"Heimerdinger, Lulu, Ornn, Ryze, Sona, Soraka, Sylas, TrainerDragon, Zoe",1,3.0,63,897,5.294043124972479
"AoShin, Bard, Heimerdinger, Lulu, Nami, Ryze, Sylas, TrainerDragon, Vladimir",1,3.0,0,590,3.0724413297820004
"AoShin, Gnar, Neeko, Ornn, Sylas, Yasuo, Zoe",2,3.0,615,3,3.5
"Bard, DragonGold, Kayn, Pyke, Thresh, Volibear, Yasuo, Zoe",1,3.0,45,17,3.21875
"Anivia, Ashe, Karma, LeeSin, Ornn, Sona, Swain, Volibear",1,3.0,122,29,4.860526315789474
"Anivia, Ashe, Karma, LeeSin, Ornn, Volibear, Yasuo",1,3.0,122,29,4.860526315789474
"DragonBlue, Hecarim, Leona, Lillia, Nunu, Soraka, Yasuo",1,3.0,120,309,4.651911585419412
"Braum, Corki, DragonBlue, Jinx, Leona, Sona, TahmKench",1,3.0,616,1,3.0
"AoShin, Gnar, Neeko, Ornn, Ryze, Soraka, Sylas, Zoe",1,3.0,617,1,3.0
"AoShin, Bard, Neeko, Ornn, Ryze, Sylas, Yasuo, Zoe",2,3.0,6,510,3.4673890669769794
"Corki, Jinx, Lulu, Ornn, Sona, Soraka, TahmKench, Yasuo",1,3.0,618,1,3.0
"Anivia, Ashe, Bard, DragonGreen, Karma, Ornn, Volibear",1,3.0,619,1,3.0
"DragonBlue, Hecarim, Leona, Nunu, Ornn, Sejuani, Yone",1,3.0,120,309,4.651911585419412
"AoShin, Bard, Heimerdinger, Lulu, Ornn, Ryze, TrainerDragon, Twitch, Yasuo, Zoe",1,3.0,620,1,3.0
"Aatrox, Braum, Leona, Nunu, Olaf, Shen, Thresh, Yone",1,3.0,124,59,4.585648148148148
"DragonBlue, Hecarim, Leona, Nunu, Sejuani, Talon, Yasuo, Yone",1,3.0,120,309,4.651911585419412
"DragonPurple, Elise, Neeko, Sona, Soraka, Sylas, Talon",1,3.0,22,1225,4.750811401844438
"Corki, DragonPurple, Jinx, Lulu, Ryze, Sona, Sylas, TrainerDragon, Tristana",1,3.0,67,107,5.578474903474904
"Bard, DragonBlue, Nunu, Ornn, Shen, Soraka, Yasuo, Yone",1,3.0,60,173,3.6427693833943837
"DragonPurple, Illaoi, Olaf, Ornn, Shen, Soraka, Sylas, Yasuo, Yone",1,3.0,621,1,3.0
"Bard, DragonBlue, LeeSin, Lillia, Nunu, Soraka, Yasuo, Yone",1,3.0,60,173,3.6427693833943837
"Diana, Illaoi, Olaf, Ornn, Pyke, Shen, Sylas, Talon",1,3.0,11,510,4.404484592464881
"DragonBlue, Hecarim, Nunu, Pyke, Shen, Sylas, Thresh",1,3.0,622,1,3.0
"AoShin, Bard, DragonGold, DragonPurple, Ornn, Thresh",6,3.0,476,9,4.166666666666667
"Bard, Illaoi, Nami, Ornn, Sejuani, Talon, Twitch, Varus",1,3.0,25,237,2.922690935803459
"Bard, DragonBlue, DragonGold, DragonPurple, Leona, Sylas",1,3.0,292,5,5.0
"Aatrox, Braum, DragonBlue, Leona, Nunu, Olaf, Shen, Yone",1,3.0,124,59,4.585648148148148
"Anivia, DragonGreen, Gnar, Lulu, Nami, Neeko, Pyke",1,3.0,113,264,4.447631535131535
"Diana, Kayn, Olaf, Ornn, Pyke, Qiyana, Soraka, Talon",1,3.0,11,510,4.404484592464881
"DragonBlue, Hecarim, Nunu, Pyke, Sejuani, Soraka, Yasuo, Yone",1,3.0,120,309,4.651911585419412
"Anivia, DragonGreen, Gnar, Lulu, Neeko, Talon, Xayah",1,3.0,113,264,4.447631535131535
"Aatrox, Lillia, Nunu, Olaf, Shen, Yasuo, Yone",2,3.0,124,59,4.585648148148148
"Illaoi, Nami, Nidalee, Ornn, Skarner, Sylas, Twitch, Varus, Vladimir",1,3.0,242,353,4.35011250186688
"DragonBlue, Hecarim, Nunu, Ornn, Sylas, Yasuo, Yone",2,3.0,120,309,4.651911585419412
"DragonBlue, DragonGreen, DragonPurple, Sylas, Talon",1,3.0,623,1,3.0
"Anivia, DragonGreen, Gnar, Lulu, Neeko, Swain, Taric, Yasuo",1,3.0,624,1,3.0
"Corki, DragonPurple, Heimerdinger, Lulu, Nami, Sylas, TrainerDragon, Tristana",2,3.0,67,107,5.578474903474904
"Bard, Braum, Jinx, Lulu, Senna, Sona, Thresh, TrainerDragon, Tristana",1,3.0,9,795,3.863117852253815
"Anivia, DragonGreen, Gnar, Nami, Neeko, Ryze, Zoe",1,3.0,112,18,3.625
"Anivia, Ashe, Elise, Gnar, Neeko, Swain, Taric, Thresh",1,3.0,625,1,3.0
"Corki, DragonPurple, Jinx, Ornn, Sylas, TahmKench, Zoe",1,3.0,626,1,3.0
"Bard, Hecarim, Nami, Ornn, Qiyana, Shen, Talon, Twitch, Xayah",1,3.0,53,434,4.10255703113372
"Bard, Hecarim, Nami, Ornn, Shen, Talon, Twitch, Xayah, Yasuo",1,3.0,53,434,4.10255703113372
"Bard, DragonBlue, Hecarim, Nunu, Soraka, Talon, Yone",1,3.0,60,173,3.6427693833943837
"Braum, Diana, Leona, Lillia, Olaf, Shen, Thresh, Yone",1,3.0,627,1,3.0
"DragonBlue, Hecarim, Leona, Nunu, Olaf, Shen, Yone, Zoe",1,3.0,628,1,3.0
"DragonBlue, Hecarim, Leona, Nunu, Olaf, Shen, Yasuo, Yone",2,3.0,141,35,3.7890625
"DragonPurple, Ezreal, Illaoi, Ornn, Sylas, Varus, Zoe",2,3.0,629,2,3.0
"Braum, Diana, Leona, Nunu, Olaf, Shen, Talon, Yasuo, Yone",1,3.0,630,1,3.0
"Bard, Shen, Shyvana, Swain, Talon, Twitch, Xayah, Yasuo",1,3.0,53,434,4.10255703113372
"Braum, Corki, DragonGreen, Heimerdinger, Jinx, Lulu, Thresh, TrainerDragon, Tristana",1,3.0,631,1,3.0
"DragonPurple, Elise, LeeSin, Neeko, Pyke, Swain",1,3.0,632,1,3.0
"Aatrox, Braum, Leona, Olaf, Pyke, Shen, Thresh, Yasuo, Yone",1,3.0,124,59,4.585648148148148
"AoShin, Heimerdinger, Illaoi, Lulu, Nami, Ryze, Sylas, TrainerDragon",1,3.0,222,131,5.347627468317124
"DragonPurple, LeeSin, Ornn, Pyke, Soraka, Swain, Yasuo",1,3.0,633,1,3.0
"AoShin, Heimerdinger, Illaoi, Lulu, Nami, Sylas, TrainerDragon, Yasuo",1,3.0,222,131,5.347627468317124
"Anivia, Ashe, Corki, DragonGreen, Gnar, Neeko, Sona",1,3.0,113,264,4.447631535131535
"DragonBlue, DragonGreen, DragonPurple, Neeko, Thresh",1,3.0,634,1,3.0
"Aatrox, DragonBlue, Nunu, Sejuani, Shen, Yasuo, Yone",1,3.0,589,3,3.6666666666666665
"AoShin, Heimerdinger, Illaoi, Lulu, Nami, Sylas, TrainerDragon, Vladimir, Zoe",1,3.0,63,897,5.294043124972479
"Bard, Illaoi, Nami, Ornn, Talon, Twitch, Varus, Xayah",1,3.0,25,237,2.922690935803459
"Bard, Illaoi, Lulu, Nami, Neeko, Nidalee, Skarner, Varus, Vladimir",1,3.0,39,227,3.208501741314241
"DragonBlue, Hecarim, Leona, Nunu, Soraka, Yasuo, Yone",1,3.0,120,309,4.651911585419412
"DragonPurple, Elise, Neeko, Pyke, Taric, Thresh",1,3.0,22,1225,4.750811401844438
"Hecarim, Nunu, Ornn, Sejuani, Shen, Talon, Twitch, Xayah, Yasuo",1,3.0,184,915,5.2788790945217325
"AoShin, Bard, Lulu, Nami, Ornn, Sona, Sylas, Vladimir",1,3.0,55,81,4.365671641791045
"Ashe, Bard, DragonGreen, Ezreal, Karma, Leona, Lulu, Soraka, Taric",1,3.0,159,289,4.630590364800891
"Bard, Corki, DragonPurple, Heimerdinger, Lulu, Sona, Sylas, TrainerDragon, Tristana, Zoe",1,3.0,9,795,3.863117852253815
"Bard, Heimerdinger, Illaoi, Lulu, Nami, Sylas, TrainerDragon, Twitch, Varus",1,3.0,31,2,2.0
"Ashe, Bard, Gnar, Neeko, Sett, Shyvana, Swain, Xayah",4,3.0,197,14,2.3333333333333335
"Bard, Heimerdinger, Illaoi, Lulu, Nami, Ornn, Ryze, Sylas, TrainerDragon, Zoe",1,3.0,9,795,3.863117852253815
"Corki, DragonBlue, Hecarim, Jinx, Nunu, Sejuani, Sona, Yasuo",1,3.0,635,1,3.0
"AoShin, Heimerdinger, Ornn, Pyke, Soraka, Sylas, Yasuo, Zoe",1,3.0,84,54,4.620689655172414
"Bard, DragonPurple, Ornn, Pyke, Shen, Sylas, Talon, Yasuo",1,3.0,1,316,3.547021497021497
"Heimerdinger, Illaoi, Lulu, Nami, Ryze, Sylas, TrainerDragon, Tristana, Zoe",2,3.0,63,897,5.294043124972479
"AoShin, Bard, Heimerdinger, Illaoi, Lulu, Ornn, Sylas, TrainerDragon",1,3.0,0,590,3.0724413297820004
"Corki, DragonGold, Heimerdinger, Lulu, Nami, Sona, TrainerDragon, Tristana, Zoe",1,3.0,446,20,5.177777777777777
"AoShin, DragonGold, Neeko, Ornn, Shyvana",1,3.0,636,1,3.0
"Bard, Heimerdinger, Illaoi, Lulu, Nami, Sona, Sylas, TrainerDragon, Zoe",1,3.0,9,795,3.863117852253815
"Diana, Illaoi, Olaf, Ornn, Qiyana, Shen, Skarner, Sylas",1,3.0,11,510,4.404484592464881
"Bard, Corki, DragonPurple, Lulu, Neeko, Sona, Sylas, TrainerDragon, Tristana",1,3.0,9,795,3.863117852253815
"Bard, Corki, DragonGold, Hecarim, Jinx, Lulu, Sona, Thresh, TrainerDragon, Tristana",1,3.0,9,795,3.863117852253815
"Corki, DragonBlue, Jinx, LeeSin, Shen, Sona, TahmKench",1,3.0,637,1,3.0
"DragonPurple, Elise, Gnar, Neeko, Swain, Sylas, Taric, Thresh, Yasuo",1,3.0,22,1225,4.750811401844438
"DragonPurple, Elise, Gnar, Neeko, Swain, Sylas, Taric, Thresh",11,3.0,22,1225,4.750811401844438
"AoShin, DragonPurple, LeeSin, Nami, Sylas, Yasuo, Zoe",1,3.0,638,1,3.0
"Ashe, Bard, DragonGold, Hecarim, Sett, Talon, Xayah, Yasuo",1,3.0,639,3,5.666666666666667
"Bard, Heimerdinger, Illaoi, Lulu, Nami, Sylas, TrainerDragon, Yasuo, Zoe",1,3.0,9,795,3.863117852253815
"DragonPurple, Elise, Neeko, Ornn, Pyke, Qiyana, Sylas, Thresh",2,3.0,22,1225,4.750811401844438
"AoShin, Bard, Gnar, Neeko, Ornn, Pyke, Sylas",1,3.0,55,81,4.365671641791045
"Bard, DragonPurple, Ornn, Pyke, Qiyana, Shen, Sylas, Talon",2,3.0,1,316,3.547021497021497
"Corki, DragonBlue, Hecarim, Nunu, Sejuani, Sona, TahmKench",1,3.0,640,1,3.0
"Hecarim, Ornn, Qiyana, Ryze, Sejuani, Shen, Talon, Twitch, Xayah",4,3.0,184,915,5.2788790945217325
"Ashe, Bard, Karma, LeeSin, Neeko, Qiyana, Swain, Talon, Yasuo",1,3.0,187,3,2.0
"Bard, Diana, DragonPurple, Ornn, Qiyana, Sylas, Talon",2,3.0,1,316,3.547021497021497
"AoShin, Ornn, Ryze, Shen, Soraka, Sylas, Thresh",1,3.0,641,1,3.0
"Bard, Gnar, Neeko, Ornn, Pyke, Shyvana, Soraka, Sylas, Yasuo",1,3.0,642,1,3.0
"Illaoi, Lulu, Nami, Sylas, Varus, Zoe",1,3.0,245,78,4.228298611111112
"Hecarim, Ornn, Qiyana, Sejuani, Shen, Sylas, Talon, Twitch, Xayah",1,3.0,184,915,5.2788790945217325
"Diana, DragonPurple, Pyke, Soraka, Sylas, Talon, Thresh",1,3.0,643,3,5.666666666666667
"Hecarim, Ornn, Qiyana, Sejuani, Shen, Shyvana, Twitch, Xayah",1,3.0,184,915,5.2788790945217325
"Bard, Corki, DragonGold, Jinx, Lulu, Senna, Sona, TrainerDragon, Tristana",1,3.0,9,795,3.863117852253815
"Bard, Corki, LeeSin, Lulu, Ornn, Sona, TahmKench, TrainerDragon, Tristana, Yasuo",1,3.0,9,795,3.863117852253815
"AoShin, DragonGold, Lulu, Pyke, Talon, Thresh, Yasuo",1,3.0,644,1,3.0
"Corki, DragonBlue, Hecarim, Nunu, Sylas, TahmKench, Yasuo",1,3.0,645,1,3.0
"Illaoi, Lulu, Nami, Pyke, Sylas, Talon, Twitch, Varus",1,3.0,242,353,4.35011250186688
"Ashe, Bard, DragonGreen, Gnar, Lulu, Neeko, Sona, Xayah",1,3.0,646,24,5.361111111111111
"Bard, DragonPurple, Ornn, Pyke, Qiyana, Talon, Yasuo, Yone",1,3.0,1,316,3.547021497021497
"Hecarim, Ornn, Qiyana, Sejuani, Shen, Talon, Twitch, Xayah, Zoe",3,3.0,647,3,3.0
"Ashe, Bard, Karma, Neeko, Sett, Shen, Swain, Yasuo, Zoe",1,3.0,648,1,3.0
"Bard, DragonGreen, Gnar, Lulu, Neeko, Soraka, Yasuo, Zoe",1,3.0,39,227,3.208501741314241
"Hecarim, Ornn, Shen, Shyvana, Talon, Twitch, Xayah, Yasuo",2,3.0,184,915,5.2788790945217325
"Diana, Olaf, Pyke, Shen, Yone",1,3.0,649,1,3.0
"Bard, Diana, Lillia, Lulu, Olaf, Ornn, Pyke, Shen, Talon",1,3.0,1,316,3.547021497021497
"AoShin, Bard, Hecarim, Ornn, Sejuani, Shen, Twitch, Yasuo",1,3.0,650,2,3.0
"DragonPurple, Elise, Gnar, Neeko, Shen, Swain, Thresh",1,3.0,22,1225,4.750811401844438
"AoShin, Bard, Lulu, Nami, Neeko, Ornn, Yasuo, Zoe",1,3.0,6,510,3.4673890669769794
"Ashe, Karma, LeeSin, Neeko, Qiyana, Swain, Volibear, Yasuo",2,3.0,159,289,4.630590364800891
"Braum, Corki, Jinx, Lulu, Sona, Thresh, TrainerDragon, Tristana, Yasuo",1,3.0,229,233,4.803836273821029
"AoShin, Illaoi, Lulu, Nami, Sylas, TrainerDragon, Tristana, Vladimir, Zoe",1,3.0,63,897,5.294043124972479
"AoShin, Heimerdinger, Ornn, Sona, Soraka, Sylas, Zoe",1,3.0,270,15,4.4
"Ashe, Karma, LeeSin, Neeko, Ornn, Sett, Swain, Yasuo",1,3.0,159,289,4.630590364800891
"AoShin, Bard, Nami, Ornn, Ryze, Soraka, Sylas",1,3.0,55,81,4.365671641791045
"AoShin, Bard, DragonGold, Lulu, Ornn, Yasuo, Zoe",1,3.0,6,510,3.4673890669769794
"AurelionSol, Bard, Heimerdinger, Lulu, Nami, Ryze, Sylas, TrainerDragon, Zoe",1,3.0,223,33,4.297101449275362
"Bard, Corki, Jinx, Lulu, Ornn, TahmKench, TrainerDragon, Tristana, Zoe",1,3.0,9,795,3.863117852253815
"AoShin, Bard, DragonGold, Ornn, Soraka, Thresh, Yasuo",1,3.0,71,8,2.875
"Bard, DragonPurple, Kayn, Ornn, Qiyana, Talon, Thresh, Yasuo",1,3.0,1,316,3.547021497021497
"Bard, Heimerdinger, Lulu, Nami, Ornn, Ryze, Sylas, TrainerDragon, Vladimir, Zoe",3,3.0,9,795,3.863117852253815
"Bard, Corki, Jinx, Lulu, Ornn, Senna, Sona, TahmKench, TrainerDragon, Tristana",1,3.0,9,795,3.863117852253815
"Bard, Heimerdinger, Illaoi, Lulu, Nami, Soraka, Sylas, TrainerDragon, Vladimir, Zoe",1,3.0,9,795,3.863117852253815
"AoShin, Heimerdinger, Lulu, Nami, Soraka, Sylas, TrainerDragon, Yasuo",1,3.0,222,131,5.347627468317124
"Corki, DragonGold, Heimerdinger, Lulu, Sona, TrainerDragon, Yasuo, Zoe",1,3.0,446,20,5.177777777777777
"AoShin, Bard, Heimerdinger, Illaoi, Lulu, Nami, Ornn, Sylas, TrainerDragon",2,3.0,0,590,3.0724413297820004
"Bard, Illaoi, Nami, Skarner, Thresh, Varus, Vladimir, Zoe",1,3.0,39,227,3.208501741314241
"AurelionSol, Illaoi, Lulu, Nami, Twitch, Varus, Zoe",1,3.0,651,1,3.0
"Ashe, Bard, Ezreal, Karma, LeeSin, Leona, Soraka, Taric",1,3.0,159,289,4.630590364800891
"Corki, DragonBlue, Hecarim, Jinx, Nunu, Yasuo, Yone",1,3.0,652,1,3.0
"Corki, DragonGold, Hecarim, Neeko, Ornn, Thresh, Xayah",1,3.0,653,1,3.0
"Braum, Corki, Heimerdinger, Lillia, Lulu, Sona, Sylas, TrainerDragon, Tristana",1,3.0,654,1,3.0
"Braum, Diana, Lillia, Olaf, Ornn, Qiyana, Shen, Sylas, Yasuo",1,3.0,11,510,4.404484592464881
"Heimerdinger, Illaoi, Lulu, Nami, Ryze, Sylas, Thresh, TrainerDragon, Vladimir",2,3.0,63,897,5.294043124972479
"Elise, Gnar, Neeko, Nidalee, Skarner, Soraka, Sylas",1,3.0,655,4,5.5
"Bard, Heimerdinger, Lulu, Nami, Ornn, Ryze, Sona, Sylas, TrainerDragon, Zoe",3,3.0,9,795,3.863117852253815
"Heimerdinger, Illaoi, Lulu, Nami, Ryze, Sylas, Thresh, TrainerDragon, Zoe",1,3.0,63,897,5.294043124972479
"AoShin, Bard, Heimerdinger, Lulu, Sylas, TrainerDragon, Zoe",1,3.0,0,590,3.0724413297820004
"Ashe, Karma, Neeko, Sett, Shen, Soraka, Swain, Volibear",1,3.0,159,289,4.630590364800891
"Bard, Corki, DragonGold, Nami, Sona, Sylas, Zoe",1,3.0,656,1,3.0
"DragonPurple, Elise, Gnar, Neeko, Swain, Taric, Thresh",3,3.0,22,1225,4.750811401844438
"Ashe, Karma, Neeko, Sett, Shen, Shyvana, Xayah",1,3.0,159,289,4.630590364800891
