comp,value_count,average_placement,group,grp_count,grp_placement
"AoShin, Corki, Jinx, Ornn, TahmKench, Tristana, Yasuo",1,6.0,1384,1,6.0
"DragonBlue, Hecarim, Lillia, Nunu, Sejuani, Twitch, Yasuo",2,6.0,602,30,5.8933333333333335
"Shen, Yone",1,6.0,1385,1,6.0
"DragonPurple, Illaoi, Nami, Ornn, Sylas, Twitch, Varus",1,6.0,343,16,5.83
"Braum, DragonPurple, Elise, Gnar, Neeko, Taric, Thresh",1,6.0,1386,2,6.5
"Braum, Elise, Leona, Taric, Thresh, Yasuo, Yone",1,6.0,1387,1,6.0
"Leona, Lillia, Nunu, Olaf, Sejuani, Yone",1,6.0,1388,1,6.0
"AoShin, Hecarim, Nami, Ornn, Sylas, Yasuo, Zoe",1,6.0,140,3,4.333333333333333
"DragonPurple, Illaoi, Nami, Twitch, Varus",1,6.0,343,16,5.83
"DragonBlue, Ezreal, Hecarim, Nunu, Ornn, Shen, Xayah",1,6.0,1389,1,6.0
"Lulu, Nami, Ornn, Sona, Sylas, Thresh, Yasuo",1,6.0,1390,1,6.0
"AoShin, Hecarim, Ornn, Shyvana, Soraka, Sylas",1,6.0,1391,1,6.0
"DragonBlue, LeeSin, Lulu, Nunu, Ornn, Sejuani, Sylas, TrainerDragon, Tristana",1,6.0,1392,1,6.0
"DragonBlue, Ornn, Pyke, Qiyana, Sylas, Thresh, Yasuo",1,6.0,1393,1,6.0
"DragonBlue, DragonGold, DragonGreen, Leona, Talon",1,6.0,1394,1,6.0
"DragonGold, DragonPurple, Sona, Soraka, Xayah, Yasuo",1,6.0,1395,1,6.0
"AoShin, Hecarim, Heimerdinger, Lillia, Lulu, Neeko, Ornn, Ryze, Sejuani, TrainerDragon",1,6.0,1396,1,6.0
"DragonBlue, Hecarim, Lillia, Nunu, Ryze, Yasuo, Zoe",2,6.0,339,14,4.3125
"AoShin, DragonGreen, DragonPurple, Pyke, Yasuo",1,6.0,1397,1,6.0
"DragonBlue, Lillia, Lulu, Nunu, Yasuo, Zoe",1,6.0,1398,1,6.0
"DragonGold, DragonPurple, Pyke, Talon, Thresh",1,6.0,1399,1,6.0
"Lulu, Nami, Ornn, Ryze, Sona, Sylas, Vladimir, Zoe",1,6.0,804,2,5.0
"DragonBlue, DragonGold, DragonGreen, Lulu, Thresh",1,6.0,1400,1,6.0
"DragonGold, DragonGreen, DragonPurple, Soraka, Thresh",1,6.0,555,5,5.555555555555556
"AoShin, Hecarim, Lulu, Neeko, Ornn, Sylas, Yasuo",1,6.0,1401,1,6.0
"AoShin, Hecarim, Nunu, Ornn, Sejuani, Yasuo, Zoe",1,6.0,1402,1,6.0
"DragonBlue, DragonGold, DragonGreen, Neeko, Yasuo",1,6.0,1403,1,6.0
"DragonGold, DragonPurple, Elise, Gnar, Thresh, Yasuo",1,6.0,1404,1,6.0
"DragonGold, Hecarim, Kayn, Senna, Sett, Swain, Xayah",1,6.0,1405,1,6.0
"DragonGold, Karma, Kayn, LeeSin, Qiyana, Volibear, Zoe",1,6.0,1406,1,6.0
"DragonPurple, Illaoi, Nami, Ryze, Sylas, Vladimir, Zoe",1,6.0,1407,1,6.0
"DragonGold, DragonPurple, Pyke, Shyvana, Yasuo",2,6.0,1408,2,6.0
"DragonBlue, Hecarim, Leona, Lillia, Nunu, Taric, Yone",1,6.0,120,309,4.651911585419412
"AoShin, Hecarim, Nami, Nunu, Ornn, Yasuo, Zoe",1,6.0,140,3,4.333333333333333
"AoShin, Leona, Nunu, Ornn, Sylas, Thresh, Yasuo",1,6.0,1409,1,6.0
"Heimerdinger, Lulu, Nami, Ornn, Pyke, Ryze, Sylas, TrainerDragon",1,6.0,63,897,5.294043124972479
"DragonBlue, DragonGold, DragonPurple, Leona, Pyke",1,6.0,1410,1,6.0
"Heimerdinger, Lulu, Nami, Ryze, Skarner, Sona, Sylas, TrainerDragon, Zoe",1,6.0,63,897,5.294043124972479
"DragonBlue, Hecarim, Lillia, Nunu, Pyke, Talon, Yasuo, Yone",1,6.0,120,309,4.651911585419412
"Heimerdinger, Lillia, Lulu, Nami, Ornn, Ryze, Sylas, TrainerDragon, Vladimir",1,6.0,63,897,5.294043124972479
"AoShin, Jinx, Lulu, Nami, Ornn, Soraka, Sylas, Zoe",1,6.0,1411,2,6.5
"DragonBlue, Hecarim, Leona, Sejuani, Shen, Twitch, Yasuo, Yone",1,6.0,602,30,5.8933333333333335
"Hecarim, Ryze, Sejuani, Shen, Talon, Twitch, Xayah, Yasuo",1,6.0,184,915,5.2788790945217325
"DragonBlue, Hecarim, Lillia, Nunu, Ryze, Twitch, Yasuo",1,6.0,602,30,5.8933333333333335
"DragonBlue, Hecarim, Nunu, Ornn, Pyke, Yasuo, Yone",1,6.0,120,309,4.651911585419412
"DragonBlue, Hecarim, Lillia, Nunu, Sejuani, Talon, Twitch",1,6.0,563,6,6.0
"DragonBlue, Hecarim, Lillia, Nunu, Olaf, Shen, Yone",2,6.0,141,35,3.7890625
"DragonGold, Ornn, Pyke, Qiyana, Shen, Thresh, Yasuo",1,6.0,1412,1,6.0
"Heimerdinger, Lillia, Lulu, Nami, Ryze, Sona, Sylas, TrainerDragon",1,6.0,63,897,5.294043124972479
"DragonBlue, Hecarim, Nunu, Ornn, Sona, Yasuo, Yone",1,6.0,120,309,4.651911585419412
"AoShin, Jinx, Lulu, Ornn, TahmKench, Thresh, TrainerDragon, Tristana",1,6.0,1413,1,6.0
"DragonGold, Hecarim, Kayn, Twitch, Volibear, Xayah, Zoe",1,6.0,1414,1,6.0
"DragonBlue, Hecarim, Nunu, Ryze, Sejuani, Twitch, Yasuo",1,6.0,602,30,5.8933333333333335
"DragonGold, Hecarim, Kayn, Sejuani, Talon, Twitch, Xayah",1,6.0,432,5,6.2
"Heimerdinger, Lulu, Nami, Ornn, Sona, Sylas, TrainerDragon, Tristana, Zoe",2,6.0,63,897,5.294043124972479
"DragonGold, Elise, Leona, Pyke, Shyvana, Yasuo",1,6.0,783,2,5.0
"Heimerdinger, Lulu, Nami, Ornn, Ryze, Shyvana, Sylas, TrainerDragon",1,6.0,63,897,5.294043124972479
"Heimerdinger, Lulu, Ornn, Ryze, Sona, Sylas, TrainerDragon, Tristana, Zoe",1,6.0,63,897,5.294043124972479
"DragonGold, Kayn, Pyke, Volibear, Yone, Zoe",1,6.0,1415,1,6.0
"DragonBlue, Hecarim, Lulu, Sona, Sylas, TrainerDragon, Tristana",1,6.0,1416,1,6.0
"DragonBlue, Hecarim, Leona, Neeko, Nunu, Pyke, Sejuani",1,6.0,1417,2,7.0
"DragonBlue, Hecarim, Leona, Lillia, Nunu, Thresh, Yone",1,6.0,120,309,4.651911585419412
"DragonBlue, Hecarim, Lulu, Nunu, Ornn, Sejuani, Shen",1,6.0,1418,1,6.0
"DragonBlue, DragonGold, DragonPurple, Leona, Sylas",4,6.0,434,20,4.489583333333334
"DragonGold, Hecarim, Leona, Nunu, Sejuani, Talon, Twitch, Xayah",1,6.0,1419,1,6.0
"DragonGold, Heimerdinger, Illaoi, Lulu, Ryze, Sylas, TrainerDragon, Zoe",1,6.0,1373,4,6.75
"Heimerdinger, Lulu, Nami, Ornn, Sona, Sylas, TrainerDragon, Vladimir, Yasuo, Zoe",1,6.0,63,897,5.294043124972479
"AoShin, Hecarim, Lillia, Ornn, Sylas, Thresh, Zoe",1,6.0,1420,1,6.0
"Braum, DragonPurple, Leona, Shen, Taric, Thresh, Yone",1,6.0,237,19,5.055555555555556
"Heimerdinger, Lulu, Ornn, Pyke, Sylas, TrainerDragon, Yasuo, Zoe",1,6.0,63,897,5.294043124972479
"Braum, DragonPurple, Olaf, Pyke, Sylas, Talon, Thresh",1,6.0,1421,1,6.0
"Corki, DragonGold, Jinx, Lulu, Sona, TahmKench, TrainerDragon, Tristana",9,6.111111111111111,21,230,5.370765582655826
"DragonPurple, Elise, Neeko, Soraka, Sylas, Thresh",17,6.117647058823529,22,1225,4.750811401844438
"Corki, DragonGold, Lulu, Sona, Soraka, Thresh, TrainerDragon, Tristana",7,6.142857142857143,21,230,5.370765582655826
"Hecarim, Sejuani, Shen, Shyvana, Talon, Twitch, Xayah",7,6.142857142857143,184,915,5.2788790945217325
"DragonPurple, Heimerdinger, Lulu, Nami, Ryze, Sylas, TrainerDragon, Vladimir",6,6.166666666666667,439,30,5.544117647058823
"DragonBlue, DragonGold, DragonPurple, Thresh, Yasuo",6,6.166666666666667,434,20,4.489583333333334
"AoShin, Bard, Heimerdinger, Lulu, Ornn, Ryze, Sylas, TrainerDragon",5,6.2,0,590,3.0724413297820004
"AoShin, Heimerdinger, Illaoi, Lulu, Nami, Sylas, TrainerDragon, Vladimir",4,6.25,222,131,5.347627468317124
"Corki, DragonPurple, Jinx, Lulu, Ornn, Sona, TrainerDragon, Tristana",4,6.25,67,107,5.578474903474904
"Corki, DragonGold, Lulu, Sona, Thresh, TrainerDragon, Tristana",8,6.25,21,230,5.370765582655826
"DragonBlue, Hecarim, Leona, Nunu, Sejuani, Soraka, Yone",4,6.25,120,309,4.651911585419412
"Anivia, Heimerdinger, Illaoi, Lulu, Nami, Ryze, Sylas, TrainerDragon, Vladimir",7,6.285714285714286,138,16,4.920634920634921
"DragonPurple, Elise, Neeko, Pyke, Sylas, Thresh",7,6.285714285714286,22,1225,4.750811401844438
"Ashe, DragonPurple, Elise, Neeko, Sylas, Taric, Thresh",7,6.285714285714286,129,83,4.935790273556231
"Anivia, Ashe, Karma, Nunu, Ornn, Sejuani, Volibear",3,6.333333333333333,145,41,5.246376811594203
"DragonBlue, Leona, Lillia, Nunu, Sejuani, Yone",3,6.333333333333333,507,10,5.388888888888888
"Bard, DragonBlue, Hecarim, Lillia, Nunu, Yasuo, Yone",3,6.333333333333333,60,173,3.6427693833943837
"Illaoi, Lulu, Nami, Nidalee, Skarner, Varus, Vladimir",12,6.333333333333333,410,21,4.2555555555555555
"AoShin, Heimerdinger, Lillia, Lulu, Nami, Ornn, Ryze, Sylas, TrainerDragon",3,6.333333333333333,222,131,5.347627468317124
"Hecarim, LeeSin, Ornn, Sejuani, Shen, Talon, Twitch, Xayah",5,6.4,184,915,5.2788790945217325
"Ashe, Illaoi, Nami, Nidalee, Skarner, Varus, Vladimir",10,6.4,1138,11,5.7
"Heimerdinger, Lulu, Nami, Ornn, Ryze, Sylas, TrainerDragon, Vladimir, Zoe",7,6.428571428571429,63,897,5.294043124972479
"Illaoi, Nami, Nidalee, Ryze, Skarner, Varus, Vladimir",15,6.466666666666667,877,60,6.326361655773421
"Illaoi, Nami, Nidalee, Skarner, Twitch, Varus, Vladimir",109,6.486238532110092,242,353,4.35011250186688
"Diana, DragonPurple, Elise, Gnar, Neeko, Sylas, Thresh",2,6.5,255,20,4.875
"Corki, DragonGold, Heimerdinger, Lulu, Sona, TrainerDragon, Tristana, Yasuo",2,6.5,21,230,5.370765582655826
"DragonPurple, Elise, Gnar, Lulu, Neeko, Soraka, Thresh",2,6.5,22,1225,4.750811401844438
"Braum, Corki, DragonGold, Lulu, Sona, TrainerDragon, Tristana",2,6.5,232,72,5.119444444444444
"Corki, DragonGold, Heimerdinger, Jinx, Lulu, Sona, Thresh, TrainerDragon, Tristana",2,6.5,21,230,5.370765582655826
"DragonGold, Kayn, Soraka, Swain, Volibear, Xayah, Zoe",2,6.5,115,107,4.65968253968254
"DragonPurple, Ornn, Pyke, Qiyana, Yasuo",2,6.5,1422,2,6.5
"Bard, Heimerdinger, Lulu, Nami, Ornn, Pyke, Ryze, Sylas, TrainerDragon",2,6.5,9,795,3.863117852253815
"Heimerdinger, Lulu, Nami, Ornn, Ryze, Sylas, TrainerDragon, Vladimir",4,6.5,63,897,5.294043124972479
"AurelionSol, Heimerdinger, Lulu, Nami, Sylas, TrainerDragon, Yasuo, Zoe",2,6.5,218,39,5.206597222222222
"DragonBlue, DragonGold, DragonGreen, Leona, Lulu",2,6.5,1423,2,6.5
"AurelionSol, Bard, Heimerdinger, Lulu, Ornn, Sylas, TrainerDragon, Zoe",2,6.5,223,33,4.297101449275362
"Anivia, Ashe, DragonGreen, Gnar, Soraka, Taric",2,6.5,113,264,4.447631535131535
"Bard, Hecarim, Ornn, Shen, Shyvana, Twitch, Xayah, Yasuo",2,6.5,53,434,4.10255703113372
"DragonPurple, Heimerdinger, Lulu, Nami, Ornn, Ryze, Sylas, TrainerDragon",2,6.5,439,30,5.544117647058823
"Heimerdinger, Illaoi, Lulu, Nami, Ornn, Ryze, Sona, Sylas, TrainerDragon",2,6.5,63,897,5.294043124972479
"Diana, Kayn, Olaf, Ornn, Pyke, Qiyana, Shen, Talon",2,6.5,11,510,4.404484592464881
"Ashe, Elise, Gnar, Hecarim, Neeko, Sett, Soraka, Swain",2,6.5,129,83,4.935790273556231
"Elise, Gnar, Neeko, Nidalee, Shyvana, Swain, Thresh",2,6.5,235,58,5.601871101871102
"Bard, DragonGreen, Gnar, Neeko, Soraka, Twitch, Xayah",2,6.5,1424,2,6.5
"DragonBlue, Lillia, Nunu, Sejuani, Sylas, Yasuo, Zoe",2,6.5,1425,2,6.5
"Hecarim, Sejuani, Shen, Talon, Twitch, Xayah, Yasuo",2,6.5,184,915,5.2788790945217325
"Hecarim, Sett, Shen, Shyvana, Swain, Xayah, Yasuo",2,6.5,215,45,4.992521367521367
"Aatrox, DragonGold, Kayn, Thresh, Volibear, Xayah, Zoe",2,6.5,115,107,4.65968253968254
"Anivia, DragonPurple, Elise, Gnar, Neeko, Swain",2,6.5,390,56,4.858679593721145
"Aatrox, Leona, Lillia, Nunu, Olaf, Shen, Yone",2,6.5,124,59,4.585648148148148
"DragonPurple, Elise, Illaoi, Neeko, Ornn, Sylas, Thresh",2,6.5,22,1225,4.750811401844438
"Illaoi, Nami, Nidalee, Skarner, Varus, Vladimir, Xayah",6,6.5,1426,6,6.5
"Illaoi, Nami, Skarner, Sylas, Twitch, Varus, Vladimir",2,6.5,242,353,4.35011250186688
"AoShin, Bard, DragonGold, DragonGreen, Ornn",2,6.5,1427,2,6.5
"DragonBlue, Hecarim, Lillia, Nunu, Yasuo, Yone, Zoe",2,6.5,339,14,4.3125
"DragonPurple, Heimerdinger, Nami, Ryze, Sylas, Vladimir",2,6.5,900,7,6.916666666666667
"Corki, Heimerdinger, Jinx, Lulu, Ornn, Ryze, Sona, Sylas, TrainerDragon",2,6.5,1428,3,7.25
"Diana, Kayn, Lillia, Olaf, Pyke, Qiyana, Talon",2,6.5,11,510,4.404484592464881
"Heimerdinger, Illaoi, Lulu, Nami, Ryze, Sona, Soraka, Sylas, TrainerDragon",4,6.5,63,897,5.294043124972479
"Bard, DragonPurple, Elise, Neeko, Sylas, Thresh",4,6.5,1,316,3.547021497021497
"Diana, DragonPurple, Elise, Neeko, Ornn, Qiyana, Talon",2,6.5,255,20,4.875
"Ashe, Illaoi, Nami, Nidalee, Skarner, Varus, Vladimir, Zoe",2,6.5,183,4,4.5
"DragonBlue, Hecarim, Leona, Nunu, Yasuo, Yone",4,6.5,120,309,4.651911585419412
"Ashe, Karma, LeeSin, Neeko, Sett, Swain, Volibear",6,6.5,159,289,4.630590364800891
"DragonPurple, Ornn, Pyke, Shen, Sylas, Talon",2,6.5,164,86,4.395288753799392
"AoShin, Heimerdinger, Lulu, Nami, Ornn, Sylas, TrainerDragon",6,6.5,222,131,5.347627468317124
"Kayn, LeeSin, Ornn, Senna, Sett, Shen, Swain, Xayah",2,6.5,215,45,4.992521367521367
"AoShin, Bard, Illaoi, Nami, Ornn, Sylas, Zoe",2,6.5,6,510,3.4673890669769794
"Heimerdinger, Illaoi, Lulu, Nami, Ryze, Shen, Sylas, TrainerDragon, Vladimir",2,6.5,63,897,5.294043124972479
"Heimerdinger, Lulu, Nami, Ryze, Sona, Sylas, TrainerDragon, Vladimir, Yasuo",2,6.5,63,897,5.294043124972479
"Braum, Corki, DragonGold, Lulu, Sona, Soraka, TrainerDragon, Tristana",2,6.5,232,72,5.119444444444444
"Heimerdinger, Illaoi, Lulu, Nami, Ryze, Sylas, TrainerDragon, Vladimir",76,6.5394736842105265,63,897,5.294043124972479
"Corki, DragonPurple, Heimerdinger, Jinx, Lulu, Sona, Sylas, TrainerDragon",5,6.6,67,107,5.578474903474904
"DragonBlue, Leona, Nunu, Olaf, Shen, Yone",5,6.6,141,35,3.7890625
"Hecarim, Qiyana, Sejuani, Shen, Talon, Twitch, Xayah",5,6.6,184,915,5.2788790945217325
"DragonBlue, Hecarim, Leona, Nunu, Sejuani, Twitch, Yone",5,6.6,602,30,5.8933333333333335
"Ashe, Karma, LeeSin, Neeko, Sett, Swain, Xayah",5,6.6,159,289,4.630590364800891
"Anivia, Ashe, Karma, LeeSin, Ornn, Swain, Volibear",5,6.6,122,29,4.860526315789474
"Illaoi, Nami, Ornn, Qiyana, Talon, Twitch, Varus",13,6.615384615384615,254,71,5.241414835164835
"DragonPurple, Elise, Gnar, Neeko, Taric, Thresh",11,6.636363636363637,22,1225,4.750811401844438
"Bard, Heimerdinger, Lulu, Nami, Ryze, Soraka, Sylas, TrainerDragon, Zoe",3,6.666666666666667,9,795,3.863117852253815
"Hecarim, Ornn, Shen, Shyvana, Talon, Twitch, Xayah",3,6.666666666666667,184,915,5.2788790945217325
"Anivia, Ashe, Hecarim, LeeSin, Nunu, Ornn, Sejuani, Volibear",3,6.666666666666667,145,41,5.246376811594203
"Braum, Corki, Jinx, Lulu, Senna, Sona, TrainerDragon, Tristana",3,6.666666666666667,229,233,4.803836273821029
"Bard, Heimerdinger, Lulu, Nami, Ornn, Ryze, Sylas, TrainerDragon, Yasuo",3,6.666666666666667,9,795,3.863117852253815
"DragonPurple, Elise, Olaf, Ornn, Shen, Sylas, Thresh",3,6.666666666666667,22,1225,4.750811401844438
"AoShin, Bard, Nami, Ornn, Ryze, Sylas, Vladimir",3,6.666666666666667,55,81,4.365671641791045
"Aatrox, DragonGold, Kayn, Swain, Volibear, Xayah, Yasuo",9,6.777777777777778,816,13,6.355555555555556
"DragonBlue, Hecarim, Lillia, Nunu, Sejuani, Twitch, Yone",5,6.8,602,30,5.8933333333333335
"Heimerdinger, Illaoi, Lulu, Nami, Ornn, Ryze, Sylas, TrainerDragon, Zoe",5,6.8,63,897,5.294043124972479
"DragonPurple, Elise, Ornn, Shen, Sylas, Thresh",5,6.8,22,1225,4.750811401844438
"Heimerdinger, Illaoi, Lillia, Nami, Ryze, Sylas, Vladimir",10,6.8,1429,11,7.4
"Corki, DragonGold, Jinx, Lulu, Thresh, TrainerDragon, Tristana",7,6.857142857142857,21,230,5.370765582655826
"DragonPurple, Elise, Neeko, Sylas, Taric, Thresh",44,6.863636363636363,22,1225,4.750811401844438
"Hecarim, Ornn, Qiyana, Shen, Talon, Twitch, Xayah",44,6.863636363636363,184,915,5.2788790945217325
"Braum, DragonPurple, Elise, Neeko, Sylas, Thresh",10,6.9,402,15,4.6499999999999995
"Hecarim, Ornn, Sejuani, Shen, Talon, Twitch, Xayah",22,6.909090909090909,184,915,5.2788790945217325
"Elise, Gnar, Neeko, Nidalee, Ornn, Skarner, Swain, Sylas",1,7.0,235,58,5.601871101871102
"Elise, Gnar, Neeko, Nidalee, Ornn, Shyvana, Swain, Sylas",1,7.0,235,58,5.601871101871102
"AoShin, Ashe, LeeSin, Sett, Swain, Volibear, Yasuo",1,7.0,1430,1,7.0
"DragonPurple, Illaoi, Jinx, Ornn, TahmKench, Tristana",1,7.0,1431,1,7.0
"Heimerdinger, Lulu, Neeko, Ryze, Sona, Sylas, TrainerDragon, Tristana, Zoe",1,7.0,1432,1,7.0
"Elise, Gnar, Neeko, Senna, Skarner, Sylas, Tristana",1,7.0,1433,1,7.0
"DragonPurple, Kayn, Olaf, Pyke, Qiyana, Shen, Sylas, Talon",1,7.0,585,5,6.0
"DragonPurple, Hecarim, Ornn, Qiyana, Sylas, Talon",1,7.0,353,3,5.666666666666667
"DragonPurple, Nami, Ornn, Qiyana, Sylas, Thresh, Zoe",1,7.0,173,7,3.7142857142857144
"DragonPurple, Gnar, Illaoi, Nidalee, Skarner, Sylas",1,7.0,1434,1,7.0
"AoShin, Heimerdinger, Illaoi, LeeSin, Lulu, Nami, Sylas, TrainerDragon",1,7.0,222,131,5.347627468317124
"Elise, Gnar, Neeko, Swain, Sylas, Taric, Thresh",1,7.0,235,58,5.601871101871102
"DragonPurple, Illaoi, Nami, Sylas, Twitch, Varus",1,7.0,343,16,5.83
"AoShin, Heimerdinger, Illaoi, Lulu, Qiyana, Sylas, TrainerDragon, Zoe",1,7.0,63,897,5.294043124972479
"Heimerdinger, Lulu, Ornn, Ryze, Sona, Sylas, TrainerDragon, Zoe",2,7.0,63,897,5.294043124972479
"DragonPurple, Elise, Olaf, Shen, Sylas, Thresh",1,7.0,22,1225,4.750811401844438
"DragonPurple, Illaoi, Ornn, Pyke, Qiyana, Sylas, Thresh",1,7.0,561,8,5.888888888888888
"AoShin, LeeSin, Ornn",1,7.0,1435,1,7.0
"AoShin, Heimerdinger, Lulu, Shen, Sylas, TrainerDragon, Zoe",1,7.0,1436,1,7.0
"AoShin, DragonGreen, Neeko, Ornn, Shyvana",1,7.0,1437,1,7.0
"Elise, Lillia, Nunu, Pyke, Ryze, Sylas, Talon, Twitch, Zoe",1,7.0,1438,1,7.0
"DragonPurple, Illaoi, Pyke, Talon, Twitch, Varus",1,7.0,1439,1,7.0
"AoShin, Heimerdinger, Lulu, Neeko, Ornn, Pyke, Sylas, TrainerDragon, Yasuo",1,7.0,222,131,5.347627468317124
"AoShin, Heimerdinger, Illaoi, Lulu, Nami, Pyke, Sylas, TrainerDragon",1,7.0,222,131,5.347627468317124
"Elise, Neeko, Pyke, Soraka, Sylas, Taric, Thresh",1,7.0,1256,2,6.5
"Elise, Neeko, Olaf, Sona, Sylas, Taric, Thresh",1,7.0,1440,1,7.0
"AoShin, Nunu, Ornn, Ryze, Sylas, Yasuo, Zoe",1,7.0,492,5,4.5
"AoShin, Heimerdinger, Illaoi, Lulu, Nami, Sylas, TrainerDragon",4,7.0,222,131,5.347627468317124
"Elise, Gnar, Hecarim, Neeko, Nidalee, Shyvana, Swain, Xayah",1,7.0,346,7,4.75
"Elise, Gnar, Neeko, Pyke, Swain, Sylas, Thresh",1,7.0,235,58,5.601871101871102
"Elise, Gnar, Neeko, Pyke, Swain, Sylas, Taric, Thresh",1,7.0,235,58,5.601871101871102
"AoShin, Heimerdinger, Lulu, Nami, Sylas, TrainerDragon, Zoe",1,7.0,63,897,5.294043124972479
"DragonPurple, Illaoi, Pyke, Qiyana, Shen, Sylas, Talon",1,7.0,164,86,4.395288753799392
"DragonPurple, Kayn, Ornn, Pyke, Qiyana, Sylas, Talon",1,7.0,164,86,4.395288753799392
"Elise, Gnar, Neeko, Ornn, Shyvana, Sylas, Yasuo",1,7.0,235,58,5.601871101871102
"Elise, Gnar, Neeko, Shyvana, Swain, Thresh",2,7.0,235,58,5.601871101871102
"AoShin, Heimerdinger, Illaoi, Lulu, Sona, Soraka, Sylas, TrainerDragon",1,7.0,222,131,5.347627468317124
"DragonPurple, Elise, Ornn, Soraka, Sylas, Thresh",1,7.0,22,1225,4.750811401844438
"Heimerdinger, Lulu, Ornn, Ryze, Sona, Sylas, TrainerDragon, Tristana",1,7.0,63,897,5.294043124972479
"Lulu, Nami, Ornn, Ryze, Sona, Sylas, Vladimir",1,7.0,1441,1,7.0
"Lulu, Nami, Ornn, Ryze, Soraka, Sylas, Twitch, Zoe",1,7.0,1442,1,7.0
"DragonPurple, Elise, Ornn, Pyke, Shen, Sylas",1,7.0,22,1225,4.750811401844438
"DragonPurple, Hecarim, Lillia, Nunu, Sejuani, Sylas, Thresh",1,7.0,1443,1,7.0
"AoShin, Bard, Heimerdinger, Lulu, Ornn, Ryze, TrainerDragon, Zoe",1,7.0,0,590,3.0724413297820004
"DragonPurple, Elise, Lulu, Ornn, Shen, Sylas, Thresh",1,7.0,22,1225,4.750811401844438
"AoShin, Ashe, Gnar, Neeko, Ornn, Sylas, Zoe",1,7.0,1444,1,7.0
"AoShin, Gnar, Karma, Neeko, Ornn, Sylas",1,7.0,1445,1,7.0
"AoShin, Heimerdinger, Lulu, Nami, Skarner, Sona, Sylas, TrainerDragon, Vladimir",1,7.0,222,131,5.347627468317124
"AoShin, Heimerdinger, Illaoi, Nami, Ryze, Sylas, Zoe",1,7.0,1157,4,6.333333333333334
"DragonPurple, Elise, Ornn, Pyke, Qiyana, Sylas",1,7.0,22,1225,4.750811401844438
"DragonPurple, Elise, Ornn, Pyke, Qiyana, Sylas, Talon",1,7.0,22,1225,4.750811401844438
"DragonPurple, Elise, Ornn, Pyke, Sylas, Thresh",2,7.0,22,1225,4.750811401844438
"AoShin, Ashe, Bard, Lulu, Ornn, Soraka, Taric, Yasuo, Zoe",1,7.0,1446,1,7.0
"DragonPurple, Elise, Ornn, Pyke, Sylas, Taric, Thresh",1,7.0,22,1225,4.750811401844438
"DragonPurple, Elise, Ornn, Pyke, Qiyana, Sylas, Yasuo",2,7.0,22,1225,4.750811401844438
"DragonPurple, Hecarim, Lillia, Ornn, Pyke, Sejuani",1,7.0,1447,1,7.0
"DragonPurple, Elise, Pyke, Qiyana, Soraka, Sylas, Yasuo",1,7.0,22,1225,4.750811401844438
"DragonPurple, Elise, Pyke, Sylas, Talon",1,7.0,22,1225,4.750811401844438
"AoShin, Bard, Heimerdinger, Lulu, Ornn, TrainerDragon, Tristana, Yasuo",1,7.0,0,590,3.0724413297820004
"DragonPurple, Elise, Ornn, Shen, Sylas, Talon, Thresh",2,7.0,22,1225,4.750811401844438
"AoShin, Neeko, Ornn, Ryze, Sylas, Thresh, Zoe",1,7.0,1448,1,7.0
"Elise, Gnar, Neeko, Nidalee, Shyvana, Soraka",2,7.0,235,58,5.601871101871102
"Elise, Gnar, Neeko, Nidalee, Swain, Taric, Thresh",1,7.0,235,58,5.601871101871102
"DragonPurple, Elise, Ornn, Shen, Sylas, Thresh, Yasuo",1,7.0,22,1225,4.750811401844438
"Elise, Gnar, Karma, Sylas, TahmKench, Taric",1,7.0,1449,1,7.0
"AoShin, Heimerdinger, Neeko, Ornn, Shen, Skarner, Sylas",1,7.0,1450,1,7.0
"AoShin, Heimerdinger, Lillia, Nami, Ornn, Ryze, Sylas, Zoe",1,7.0,1451,1,7.0
"AoShin, Gnar, Lulu, Neeko, Ornn, Sona, Soraka",1,7.0,1452,1,7.0
"Elise, Illaoi, Lillia, Nami, Nidalee, Ornn, Skarner, Varus, Vladimir",1,7.0,1453,1,7.0
"Elise, Illaoi, Nidalee, Shen, Skarner, Soraka, Sylas",1,7.0,1454,1,7.0
"AoShin, Heimerdinger, Lulu, Nami, Ornn, Pyke, Sylas, TrainerDragon",1,7.0,222,131,5.347627468317124
"DragonPurple, Nunu, Pyke, Sejuani, Sylas, Talon, Thresh",1,7.0,550,3,6.0
"DragonPurple, Elise, Pyke, Sylas, Talon, Thresh",1,7.0,22,1225,4.750811401844438
"AoShin, Heimerdinger, Ornn, Ryze, Soraka, Sylas, Zoe",1,7.0,270,15,4.4
"DragonPurple, Leona, Sylas, Talon, Thresh, Yone",1,7.0,1455,1,7.0
"AoShin, Gnar, Lulu, Nami, Neeko, Sylas, Taric",1,7.0,1456,1,7.0
"DragonPurple, Illaoi, Nami, Shen, Skarner, Sylas",1,7.0,1457,1,7.0
"DragonPurple, Olaf, Qiyana, Shen, Skarner, Sylas, Thresh",1,7.0,776,2,5.5
"DragonPurple, Elise, Neeko, Ornn, Sylas, TahmKench, Thresh",1,7.0,22,1225,4.750811401844438
"DragonPurple, Elise, Hecarim, Lillia, Nunu, Sejuani",1,7.0,1458,1,7.0
"DragonPurple, Heimerdinger, Lulu, Ryze, Sona, Sylas, TrainerDragon, Zoe",1,7.0,134,38,4.337301587301587
"Heimerdinger, Illaoi, Lulu, Nami, Pyke, Ryze, Sylas, TrainerDragon",1,7.0,63,897,5.294043124972479
"Heimerdinger, Illaoi, Lulu, Nami, Pyke, Ryze, Sona, Sylas, TrainerDragon, Vladimir",1,7.0,63,897,5.294043124972479
"AoShin, DragonGold, DragonGreen, Ornn, Zoe",1,7.0,1459,2,7.5
"Heimerdinger, Illaoi, Lulu, Nami, Ornn, Ryze, Sylas, TrainerDragon, Vladimir, Zoe",1,7.0,63,897,5.294043124972479
"Heimerdinger, Illaoi, Lulu, Nami, Ornn, Ryze, Sona, Sylas, TrainerDragon, Zoe",1,7.0,63,897,5.294043124972479
"Heimerdinger, Illaoi, Lulu, Nami, Sona, Sylas, TrainerDragon, Twitch, Varus, Zoe",1,7.0,757,2,5.5
"AoShin, Bard, Lulu, Ornn, Ryze, Sylas",1,7.0,55,81,4.365671641791045
"AoShin, Bard, Lulu, Ornn, Ryze, Sylas, Yasuo",1,7.0,55,81,4.365671641791045
"DragonPurple, Heimerdinger, Lulu, Nami, Sona, Sylas, TrainerDragon",1,7.0,439,30,5.544117647058823
"DragonPurple, Elise, Gnar, Neeko, Soraka, Sylas, Taric",1,7.0,22,1225,4.750811401844438
"Heimerdinger, Illaoi, Lulu, Nami, Ryze, Sylas, Thresh, TrainerDragon",1,7.0,63,897,5.294043124972479
"Heimerdinger, Lulu, Nami, Ryze, Soraka, Sylas, TrainerDragon, Zoe",1,7.0,63,897,5.294043124972479
"AoShin, Kayn, Ornn, Qiyana, Sett, Sylas, Thresh, Yasuo",1,7.0,1460,1,7.0
"AoShin, Hecarim, Lulu, Ornn, Pyke, Shen, Soraka, Yasuo",1,7.0,1461,1,7.0
"AoShin, DragonGold, Hecarim, Ornn, Soraka, Thresh",1,7.0,1462,1,7.0
"AoShin, Hecarim, Lulu, Ornn, Sona, TahmKench, TrainerDragon, Tristana",1,7.0,1463,1,7.0
"DragonPurple, Elise, Gnar, Neeko, Pyke, Thresh",2,7.0,22,1225,4.750811401844438
"Heimerdinger, Illaoi, Lulu, Nami, TrainerDragon, Vladimir",1,7.0,63,897,5.294043124972479
"AoShin, Hecarim, LeeSin, Leona, Nunu, Sejuani, Taric",1,7.0,1464,1,7.0
"AoShin, DragonGold, Ezreal, Ornn, Qiyana, Sylas",1,7.0,1465,1,7.0
"DragonPurple, Heimerdinger, Jinx, Sylas, TrainerDragon, Tristana, Zoe",1,7.0,1466,1,7.0
"AoShin, DragonGold, LeeSin, Ryze, Sylas, Zoe",1,7.0,1467,1,7.0
"DragonPurple, Heimerdinger, Lulu, Ryze, Sylas, TrainerDragon, Vladimir, Zoe",1,7.0,134,38,4.337301587301587
"DragonPurple, Heimerdinger, Lillia, Nami, Ryze, Sylas, TrainerDragon, Tristana",1,7.0,439,30,5.544117647058823
"Heimerdinger, Lulu, Nami, Ryze, Shen, Sylas, TrainerDragon, Tristana",1,7.0,63,897,5.294043124972479
"DragonPurple, Elise, Gnar, Neeko, Pyke, Taric",1,7.0,22,1225,4.750811401844438
"AoShin, Ashe, Lulu, Neeko, Ornn, Soraka, Yasuo, Zoe",1,7.0,1468,1,7.0
"DragonPurple, Elise, Gnar, Neeko, Swain, Thresh",3,7.0,22,1225,4.750811401844438
"AoShin, DragonGold, Kayn, Talon, Volibear, Zoe",1,7.0,1469,1,7.0
"AoShin, Bard, Lulu, Nami, Ryze, Sylas, Yasuo",1,7.0,55,81,4.365671641791045
"Heimerdinger, Illaoi, Lulu, Nami, Ryze, Soraka, Sylas, TrainerDragon",1,7.0,63,897,5.294043124972479
"Heimerdinger, LeeSin, Lulu, Nami, Ornn, Ryze, Sylas, TrainerDragon, Zoe",1,7.0,63,897,5.294043124972479
"DragonPurple, Heimerdinger, Lulu, Sona, Sylas, Talon, TrainerDragon, Zoe",2,7.0,134,38,4.337301587301587
"AoShin, Braum, Ornn, Ryze, Sylas, Taric, Zoe",1,7.0,1470,1,7.0
"DragonPurple, Elise, Illaoi, LeeSin, Ornn, Sylas",1,7.0,22,1225,4.750811401844438
"DragonPurple, Elise, Illaoi, Ornn, Sylas, Thresh",1,7.0,22,1225,4.750811401844438
"Heimerdinger, Lillia, Nami, Ryze, Shen, Sylas, Vladimir",1,7.0,1471,1,7.0
"AoShin, Lillia, Ornn, Ryze, Shen, Sylas, Yasuo",1,7.0,1012,2,6.0
"DragonPurple, Elise, Illaoi, Olaf, Ornn, Pyke, Shen, Sylas",1,7.0,22,1225,4.750811401844438
"AoShin, Lillia, Nunu, Pyke, Soraka, Zoe",1,7.0,1472,1,7.0
"DragonPurple, Lulu, Nami, Ornn, Ryze, Sylas, Zoe",1,7.0,1473,3,7.333333333333333
"AoShin, Jinx, Lulu, Nami, Ornn, Sylas, Zoe",1,7.0,1411,2,6.5
"Heimerdinger, Lillia, Ryze, Sejuani, Senna, Soraka, Sylas, Zoe",1,7.0,1474,1,7.0
"Heimerdinger, Lillia, Lulu, Nami, Ryze, Soraka, Sylas, TrainerDragon, Vladimir",2,7.0,63,897,5.294043124972479
"DragonPurple, Pyke, Shen, Skarner, Sylas, Thresh, Yasuo",1,7.0,164,86,4.395288753799392
"AoShin, Diana, Illaoi, Olaf, Ornn, Shen, Yone",1,7.0,1475,1,7.0
"AoShin, Bard, Lulu, Ryze, Sona, Sylas, Zoe",1,7.0,6,510,3.4673890669769794
"Heimerdinger, Lillia, Lulu, Nami, Ryze, Sett, Sylas, TrainerDragon, Vladimir",1,7.0,63,897,5.294043124972479
"DragonPurple, Pyke, Qiyana, Ryze, Sylas, Thresh, Zoe",1,7.0,173,7,3.7142857142857144
"Heimerdinger, Illaoi, Lillia, Lulu, Ryze, Sylas, TrainerDragon, Vladimir, Zoe",1,7.0,63,897,5.294043124972479
"Heimerdinger, Jinx, Lulu, Ornn, Sona, TahmKench, TrainerDragon, Tristana, Zoe",1,7.0,1476,1,7.0
"Heimerdinger, Jinx, Lulu, Nami, Shen, Sylas, TrainerDragon, Tristana",1,7.0,1477,1,7.0
