comp,value_count,average_placement,group,grp_count,grp_placement
"Bard, Heimerdinger, Illaoi, Lulu, Nami, Ryze, Sylas, TrainerDragon, Vladimir",34,4.735294117647059,9,795,3.863117852253815
"DragonPurple, Elise, Gnar, Neeko, Sylas, Taric, Thresh",131,4.748091603053435,22,1225,4.750811401844438
"DragonPurple, Heimerdinger, Lulu, Nami, Ryze, Sylas, TrainerDragon, Zoe",12,4.75,134,38,4.337301587301587
"Corki, DragonGold, Jinx, Lulu, Sona, Thresh, TrainerDragon, Tristana, Yasuo",4,4.75,21,230,5.370765582655826
"Heimerdinger, Illaoi, Lulu, Nami, Ryze, Sylas, TrainerDragon, Yasuo, Zoe",8,4.75,63,897,5.294043124972479
"Heimerdinger, Illaoi, Lulu, Nami, Ryze, Sylas, TrainerDragon, Vladimir, Yasuo",4,4.75,63,897,5.294043124972479
"AoShin, Heimerdinger, Lulu, Nami, Ornn, Sylas, TrainerDragon, Vladimir",9,4.777777777777778,222,131,5.347627468317124
"Bard, Heimerdinger, Lulu, Nami, Ornn, Ryze, Sylas, TrainerDragon, Zoe",21,4.809523809523809,9,795,3.863117852253815
"Bard, Corki, Jinx, Lulu, Ornn, Sona, TahmKench, TrainerDragon, Tristana",16,4.8125,9,795,3.863117852253815
"Diana, DragonPurple, Ornn, Qiyana, Shen, Sylas, Talon",7,4.857142857142857,11,510,4.404484592464881
"Bard, Hecarim, Ornn, Qiyana, Shen, Talon, Twitch, Xayah",68,4.867647058823529,53,434,4.10255703113372
"AoShin, Bard, Heimerdinger, Lulu, Ornn, Sona, Sylas, TrainerDragon",8,4.875,0,590,3.0724413297820004
"Corki, DragonPurple, Heimerdinger, Lulu, Nami, Sona, Sylas, TrainerDragon",8,4.875,67,107,5.578474903474904
"Hecarim, Kayn, Sett, Shen, Shyvana, Swain, Xayah",9,4.888888888888889,215,45,4.992521367521367
"Bard, DragonGreen, Gnar, Lulu, Neeko, Soraka, Yasuo",10,4.9,1,316,3.547021497021497
"Illaoi, Nami, Nidalee, Skarner, Sylas, Twitch, Varus, Vladimir",10,4.9,242,353,4.35011250186688
"DragonPurple, Ornn, Pyke, Qiyana, Shen, Sylas, Thresh",14,4.928571428571429,164,86,4.395288753799392
"DragonPurple, Elise, Gnar, Neeko, Pyke, Taric, Thresh",16,4.9375,22,1225,4.750811401844438
"Diana, Olaf, Ornn, Qiyana, Shen, Sylas, Talon",26,4.961538461538462,11,510,4.404484592464881
"Bard, Corki, DragonGold, Lulu, Sona, Thresh, TrainerDragon, Tristana",45,4.977777777777778,9,795,3.863117852253815
"Hecarim, Ornn, Qiyana, Sejuani, Shen, Talon, Twitch, Xayah",453,4.9823399558498895,184,915,5.2788790945217325
"Bard, Corki, Heimerdinger, Jinx, Lulu, Shen, Sona, TahmKench, TrainerDragon, Tristana",1,5.0,9,795,3.863117852253815
"AoShin, Lulu, Neeko, Ornn, Ryze, Sona, Sylas",1,5.0,105,6,4.333333333333333
"DragonPurple, Elise, Neeko, Ornn, Sylas, Thresh",1,5.0,22,1225,4.750811401844438
"AoShin, DragonPurple, Ornn, Pyke, Ryze, Yasuo",1,5.0,937,1,5.0
"Braum, Diana, Hecarim, Lillia, Nunu, Olaf, Sejuani, Thresh",1,5.0,11,510,4.404484592464881
"DragonPurple, Elise, Neeko, Pyke, Sejuani, Sylas, Yasuo",1,5.0,22,1225,4.750811401844438
"AoShin, Lulu, Nami, Ornn, Sylas, TrainerDragon, Tristana, Yasuo, Zoe",1,5.0,938,1,5.0
"Corki, Heimerdinger, Jinx, Lulu, Ornn, Senna, Sona, TahmKench, TrainerDragon, Tristana",1,5.0,15,51,5.854166666666666
"AoShin, Lulu, Nami, Ornn, Soraka, Sylas, Yasuo, Zoe",5,5.0,84,54,4.620689655172414
"Bard, Hecarim, Lillia, Ornn, Sejuani, Shen, Xayah, Yasuo",1,5.0,939,1,5.0
"Bard, Hecarim, Ornn, Shen, Talon, Twitch, Xayah, Yasuo",7,5.0,53,434,4.10255703113372
"Corki, DragonGold, Heimerdinger, Lulu, Sona, Sylas, TahmKench, TrainerDragon",1,5.0,21,230,5.370765582655826
"AoShin, Bard, Hecarim, Ornn, Sejuani, Soraka, Sylas, Zoe",1,5.0,6,510,3.4673890669769794
"Corki, Heimerdinger, Jinx, Lulu, Ornn, Sona, TahmKench, TrainerDragon, Tristana",3,5.0,15,51,5.854166666666666
"Bard, Corki, Heimerdinger, Jinx, Ornn, Soraka, Sylas, TrainerDragon, Tristana",1,5.0,940,1,5.0
"Braum, Diana, Hecarim, Lillia, Olaf, Ornn, Qiyana, Talon",2,5.0,11,510,4.404484592464881
"AoShin, Lulu, Nami, Ornn, Pyke, Ryze, Sylas",1,5.0,941,1,5.0
"AoShin, Lulu, Ornn, Sona, Sylas, TrainerDragon, Tristana, Zoe",1,5.0,753,2,4.5
"Corki, DragonGold, Lulu, Nami, Sona, TrainerDragon, Tristana, Zoe",1,5.0,446,20,5.177777777777777
"AoShin, Lulu, Ornn, Pyke, Shen, Soraka, Yasuo, Zoe",1,5.0,84,54,4.620689655172414
"Bard, Corki, Jinx, Lulu, Ornn, Sona, Soraka, TahmKench, TrainerDragon, Tristana",1,5.0,9,795,3.863117852253815
"Corki, DragonGold, Lulu, Sona, TrainerDragon, Tristana, Volibear, Zoe",2,5.0,446,20,5.177777777777777
"DragonPurple, Elise, Neeko, Pyke, Ryze, Sylas, Zoe",3,5.0,37,76,3.7540935672514624
"Bard, Corki, DragonGold, Lulu, Sona, Soraka, Thresh",2,5.0,9,795,3.863117852253815
"Corki, DragonGold, Lulu, Sona, Thresh, TrainerDragon, Tristana, Yasuo, Zoe",1,5.0,446,20,5.177777777777777
"Corki, DragonGold, Heimerdinger, Jinx, Lulu, Senna, TahmKench, TrainerDragon, Tristana",1,5.0,21,230,5.370765582655826
"Bard, Hecarim, Ornn, Qiyana, Shen, Soraka, Talon, Xayah",1,5.0,53,434,4.10255703113372
"Bard, Hecarim, Ornn, Qiyana, Shen, Talon, Twitch, Xayah, Zoe",1,5.0,481,2,3.5
"Braum, Diana, Hecarim, Lillia, Nunu, Olaf, Shen, Yasuo",1,5.0,11,510,4.404484592464881
"Bard, Hecarim, Heimerdinger, Leona, Lulu, Nunu, Ryze, TrainerDragon, Zoe",1,5.0,942,1,5.0
"Bard, Corki, DragonGold, Heimerdinger, Sona, Thresh, TrainerDragon, Tristana, Zoe",1,5.0,9,795,3.863117852253815
"Bard, Hecarim, Pyke, Shen, Talon, Twitch, Xayah, Yasuo",1,5.0,53,434,4.10255703113372
"Bard, Sett, Shyvana, Swain, Xayah, Yasuo, Yone",1,5.0,943,1,5.0
"Bard, Corki, DragonGreen, Heimerdinger, Lulu, Sona, Sylas, TrainerDragon",1,5.0,9,795,3.863117852253815
"DragonPurple, Elise, Neeko, Pyke, Qiyana, Sylas, Yasuo",1,5.0,22,1225,4.750811401844438
"Bard, Corki, DragonBlue, Hecarim, Lulu, Sona, TrainerDragon, Tristana",1,5.0,9,795,3.863117852253815
"AoShin, Elise, Ornn, Ryze, Swain, Sylas, Zoe",1,5.0,944,1,5.0
"AoShin, Bard, Hecarim, Lillia, Ornn, Sylas, Zoe",1,5.0,6,510,3.4673890669769794
"Bard, Corki, DragonGold, Jinx, Lulu, Ornn, Sona, TrainerDragon, Tristana",1,5.0,9,795,3.863117852253815
"Braum, Diana, Hecarim, Lillia, Nunu, Olaf, Sylas, Zoe",1,5.0,96,28,4.164705882352941
"AoShin, Lulu, Ornn, Soraka, Sylas, Thresh, Yasuo, Zoe",1,5.0,84,54,4.620689655172414
"DragonPurple, Elise, Neeko, Pyke, Swain, Sylas, Yasuo",1,5.0,22,1225,4.750811401844438
"Corki, DragonGold, Lulu, Sona, Sylas, Zoe",1,5.0,945,1,5.0
"Braum, Diana, Hecarim, Lillia, Olaf, Sylas, Zoe",1,5.0,96,28,4.164705882352941
"Bard, Hecarim, Lillia, Ornn, Ryze, Soraka, Sylas, Zoe",1,5.0,946,2,6.0
"Bard, Corki, DragonGold, Jinx, Lulu, Nami, Sona, Thresh, TrainerDragon, Tristana",1,5.0,9,795,3.863117852253815
"Corki, DragonGold, Lulu, Sona, Sylas, TrainerDragon, Tristana, Zoe",1,5.0,446,20,5.177777777777777
"Corki, DragonGold, Lulu, Sona, Sylas, TrainerDragon, Tristana, Yasuo, Zoe",1,5.0,446,20,5.177777777777777
"Corki, Heimerdinger, Jinx, Lulu, Sona, Sylas, TahmKench, TrainerDragon, Tristana",1,5.0,15,51,5.854166666666666
"Bard, Corki, DragonGold, Heimerdinger, Lulu, Sona, TrainerDragon, Tristana",1,5.0,9,795,3.863117852253815
"Bard, Corki, DragonBlue, Lulu, Ornn, TahmKench, TrainerDragon, Tristana",1,5.0,9,795,3.863117852253815
"Bard, Corki, DragonBlue, Jinx, LeeSin, Ornn, TahmKench, Yasuo",1,5.0,89,24,2.605128205128205
"Bard, Corki, DragonGold, Lulu, Ornn, Sylas, TrainerDragon, Tristana",1,5.0,9,795,3.863117852253815
"Diana, Hecarim, Lillia, Olaf, Pyke, Ryze, Sylas, Yasuo",1,5.0,947,2,5.5
"AoShin, Bard, Corki, Jinx, Nami, Ornn, TahmKench, Zoe",1,5.0,948,1,5.0
"Diana, DragonPurple, Olaf, Ornn, Qiyana, Shen, Sylas",2,5.0,11,510,4.404484592464881
"Diana, DragonPurple, Qiyana, Ryze, Sylas, Talon, Zoe",1,5.0,949,1,5.0
"Diana, DragonPurple, Ornn, Qiyana, Shen, Sylas",1,5.0,11,510,4.404484592464881
"AurelionSol, Illaoi, Nami, Sona, Sylas, Vladimir, Zoe",2,5.0,950,2,5.0
"AurelionSol, Illaoi, Nami, Nidalee, Skarner, Sona, Varus, Vladimir",1,5.0,664,74,5.200313479623825
"Elise, Gnar, Nami, Nidalee, Shyvana, Swain, Yasuo",1,5.0,235,58,5.601871101871102
"AurelionSol, Illaoi, Nami, Skarner, Sylas, Varus, Vladimir",2,5.0,664,74,5.200313479623825
"Diana, DragonPurple, Ornn, Pyke, Qiyana, Shen, Sylas",1,5.0,11,510,4.404484592464881
"AurelionSol, Illaoi, Nami, Skarner, Varus, Vladimir, Zoe",1,5.0,245,78,4.228298611111112
"Illaoi, Lulu, Nami, Sylas, Twitch, Varus, Yasuo, Zoe",1,5.0,242,353,4.35011250186688
"AurelionSol, Bard, Illaoi, Nami, Ryze, Sylas, Zoe",1,5.0,246,18,3.8888888888888884
"AoShin, Bard, Heimerdinger, Illaoi, Lulu, Soraka, Sylas, TrainerDragon, Zoe",1,5.0,0,590,3.0724413297820004
"Braum, Corki, DragonGold, Neeko, Ornn, Xayah, Yasuo",1,5.0,951,1,5.0
"Elise, Gnar, Karma, Neeko, Sett, Shyvana, Swain",1,5.0,952,1,5.0
"AoShin, Bard, Heimerdinger, Nami, Ornn, Soraka, Yasuo, Zoe",1,5.0,6,510,3.4673890669769794
"Illaoi, Lulu, Nami, Ryze, Sylas, Varus, Vladimir, Zoe",1,5.0,245,78,4.228298611111112
"Braum, Corki, Jinx, Lulu, Sona, TahmKench, Thresh, TrainerDragon, Tristana",1,5.0,229,233,4.803836273821029
"Elise, Gnar, Neeko, Nidalee, Shyvana, Soraka, Yasuo",1,5.0,235,58,5.601871101871102
"Illaoi, Lulu, Nami, Ryze, Sona, Sylas, Zoe",1,5.0,245,78,4.228298611111112
"Diana, DragonPurple, Elise, Ornn, Qiyana, Sylas, Talon",1,5.0,255,20,4.875
"Illaoi, Lulu, Nami, Ryze, Sona, Sylas, Vladimir, Zoe",1,5.0,245,78,4.228298611111112
"Braum, Corki, Jinx, Lulu, Sona, Taric, Thresh, TrainerDragon, Tristana",1,5.0,229,233,4.803836273821029
"Diana, DragonPurple, Elise, Ryze, Sylas, Thresh, Zoe",1,5.0,953,1,5.0
"Diana, Elise, Hecarim, Lillia, Olaf, Ornn, Shen, Sylas",1,5.0,954,1,5.0
"Diana, DragonPurple, Kayn, Ornn, Pyke, Qiyana, Talon, Yasuo",1,5.0,11,510,4.404484592464881
"Diana, DragonPurple, Kayn, Ornn, Qiyana, Shen, Talon",2,5.0,11,510,4.404484592464881
"AurelionSol, Heimerdinger, Illaoi, Lulu, Nami, Ryze, Sylas, TrainerDragon, Zoe",1,5.0,218,39,5.206597222222222
"AurelionSol, Heimerdinger, Illaoi, Lulu, Nami, Ryze, Sylas, TrainerDragon, Twitch, Vladimir",1,5.0,955,1,5.0
"DragonPurple, Elise, LeeSin, Ornn, Shen, Sylas, Thresh",1,5.0,22,1225,4.750811401844438
"DragonPurple, Elise, Ezreal, Nami, Neeko, Ornn, Zoe",1,5.0,956,1,5.0
"AoShin, Heimerdinger, Lulu, Nami, Ornn, Sona, Sylas, TrainerDragon",16,5.0,222,131,5.347627468317124
"AurelionSol, DragonGold, DragonGreen, Ornn, Yasuo",1,5.0,957,1,5.0
"AoShin, Bard, Heimerdinger, Lulu, Ornn, Ryze, Sona, Sylas, TrainerDragon",1,5.0,0,590,3.0724413297820004
"AurelionSol, DragonGreen, Lulu, Ornn, Ryze, Sylas, Zoe",1,5.0,958,1,5.0
"Diana, Lillia, Olaf, Pyke, Qiyana, Shen, Soraka, Yasuo, Yone",1,5.0,220,2,3.0
"AurelionSol, Bard, Lulu, Nami, Neeko, Soraka, Sylas, Zoe",1,5.0,246,18,3.8888888888888884
"DragonPurple, Elise, Pyke, Sylas, Talon, Yasuo, Zoe",1,5.0,37,76,3.7540935672514624
"AoShin, Bard, LeeSin, Ornn, Sett, Soraka, Yasuo",1,5.0,467,2,3.5
"AurelionSol, Bard, Heimerdinger, Illaoi, Lulu, Nami, TrainerDragon, Vladimir, Zoe",1,5.0,223,33,4.297101449275362
"AoShin, Heimerdinger, Lulu, Nami, Ornn, Ryze, Soraka, Sylas, TrainerDragon",1,5.0,222,131,5.347627468317124
"Diana, DragonPurple, Neeko, Ornn, Pyke, Qiyana, Talon",1,5.0,959,1,5.0
"AoShin, Ezreal, LeeSin, Ornn, Qiyana, Talon, Twitch, Yasuo",1,5.0,960,1,5.0
"Braum, Corki, DragonGold, Lulu, TrainerDragon, Tristana, Yasuo",1,5.0,232,72,5.119444444444444
"Diana, DragonPurple, Hecarim, Ornn, Pyke, Qiyana, Shen, Sylas",1,5.0,11,510,4.404484592464881
"AoShin, Bard, Ezreal, LeeSin, Ornn, Qiyana, Soraka, Yasuo",1,5.0,961,2,6.0
"AoShin, Heimerdinger, Lulu, Nami, Sona, Sylas, TrainerDragon, Zoe",1,5.0,63,897,5.294043124972479
"AoShin, Heimerdinger, Lulu, Nami, Sona, Sylas, TrainerDragon, Vladimir",1,5.0,222,131,5.347627468317124
"AoShin, Heimerdinger, Lulu, Nami, Shen, Soraka, Sylas, TrainerDragon, Yasuo",1,5.0,222,131,5.347627468317124
"AurelionSol, Bard, Heimerdinger, Illaoi, Lulu, Sylas, TrainerDragon, Zoe",1,5.0,223,33,4.297101449275362
"DragonPurple, Elise, Ornn, Pyke, Sylas, Talon, Taric, Thresh",1,5.0,22,1225,4.750811401844438
"Illaoi, Lulu, Nami, Nidalee, Skarner, Sona, Twitch, Varus, Zoe",1,5.0,242,353,4.35011250186688
"Illaoi, LeeSin, Lulu, Nami, Qiyana, Talon, Twitch, Varus",1,5.0,254,71,5.241414835164835
"Illaoi, Nami, Ornn, Skarner, Sylas, Varus, Vladimir",1,5.0,962,3,6.0
"Illaoi, Nami, Qiyana, Sejuani, Sylas, Talon, Twitch, Varus",1,5.0,254,71,5.241414835164835
"Elise, Gnar, Neeko, Pyke, Soraka, Swain, Thresh",1,5.0,235,58,5.601871101871102
"Illaoi, Nami, Neeko, Nidalee, Ryze, Skarner, Varus, Vladimir",1,5.0,913,4,5.25
"Braum, Leona, Ryze, Shen, Taric, Thresh, Yone",1,5.0,237,19,5.055555555555556
"Illaoi, Nami, Neeko, Nidalee, Skarner, Varus, Vladimir, Xayah",1,5.0,913,4,5.25
"AoShin, Heimerdinger, Illaoi, Lulu, Soraka, Sylas, TrainerDragon, Zoe",1,5.0,63,897,5.294043124972479
"Braum, Leona, Nunu, Shen, Taric, Thresh, Yone",1,5.0,237,19,5.055555555555556
"Illaoi, Nami, Twitch, Varus, Zoe",1,5.0,963,1,5.0
"Illaoi, Nami, Ryze, Skarner, Sylas, Talon, Twitch, Varus",1,5.0,242,353,4.35011250186688
"Illaoi, Nami, Ornn, Varus, Xayah",1,5.0,964,1,5.0
"AoShin, Bard, Heimerdinger, Lulu, Nami, Ornn, TrainerDragon, Zoe",1,5.0,0,590,3.0724413297820004
"Illaoi, Nami, Nidalee, Pyke, Skarner, Twitch, Varus, Vladimir, Yasuo",1,5.0,242,353,4.35011250186688
"Illaoi, Nami, Nidalee, Ornn, Skarner, Varus, Vladimir, Yasuo",1,5.0,965,1,5.0
"Elise, Neeko, Pyke, Sylas, Talon, Thresh",1,5.0,966,1,5.0
"Illaoi, Nami, Nidalee, Skarner, Sylas, TahmKench, Varus, Vladimir",1,5.0,877,60,6.326361655773421
"Elise, Hecarim, Neeko, Shyvana, Swain, Twitch, Xayah",1,5.0,967,1,5.0
"Illaoi, Nami, Nidalee, Skarner, Sona, Varus, Vladimir",1,5.0,877,60,6.326361655773421
"Braum, Leona, Olaf, Ornn, Qiyana, Taric, Thresh, Yone",1,5.0,968,1,5.0
"Braum, Leona, Lillia, Nunu, Olaf, Shen, Yone",1,5.0,969,1,5.0
"Braum, Corki, DragonBlue, Jinx, Lulu, Sona, TahmKench, Thresh",1,5.0,970,1,5.0
"Illaoi, Nami, Skarner, Twitch, Varus, Vladimir, Yasuo, Zoe",1,5.0,242,353,4.35011250186688
"Elise, Gnar, Hecarim, Neeko, Sett, Shyvana, Swain, Yasuo",1,5.0,346,7,4.75
"Illaoi, LeeSin, Lulu, Nami, Qiyana, Sylas, Varus, Xayah",1,5.0,971,1,5.0
"Illaoi, Nami, Ornn, Qiyana, Sejuani, Talon, Twitch, Varus",1,5.0,254,71,5.241414835164835
"Braum, DragonBlue, Leona, Lillia, Nunu, Thresh, Yone",1,5.0,341,31,5.353439153439153
"Elise, Gnar, Neeko, Nidalee, Shyvana, Soraka, Swain, Zoe",1,5.0,972,1,5.0
"AoShin, Heimerdinger, Nami, Ornn, Sona, Sylas, Vladimir, Zoe",1,5.0,270,15,4.4
"Braum, Twitch, Yone",1,5.0,973,1,5.0
"Braum, DragonGreen, Gnar, Lulu, Neeko, Sona, Taric",1,5.0,974,1,5.0
"Braum, Corki, Jinx, Lulu, Senna, Taric, Thresh, TrainerDragon, Tristana",2,5.0,229,233,4.803836273821029
"Illaoi, Ornn, Qiyana, Soraka, Talon, Twitch, Varus",1,5.0,975,1,5.0
"Elise, Gnar, Neeko, Nidalee, Shyvana, Swain",2,5.0,235,58,5.601871101871102
"AoShin, Heimerdinger, Nami, Ornn, Sona, Soraka, Sylas, Zoe",1,5.0,270,15,4.4
"AoShin, Bard, Heimerdinger, Nami, Ornn, Sylas, Zoe",1,5.0,6,510,3.4673890669769794
"Braum, DragonBlue, Leona, Nunu, Sejuani, Yasuo, Yone",1,5.0,341,31,5.353439153439153
"Illaoi, Nami, Ornn, Qiyana, Ryze, Twitch, Varus, Vladimir",1,5.0,254,71,5.241414835164835
"Braum, DragonBlue, Leona, Nunu, Soraka, Yasuo, Yone",1,5.0,976,1,5.0
"Illaoi, Lillia, Nami, Ryze, Sylas, Vladimir, Zoe",3,5.0,238,11,5.083333333333333
"Braum, DragonBlue, Leona, Nunu, Olaf, Shen, Yasuo, Yone",2,5.0,198,28,3.9174603174603173
"Illaoi, Lillia, Nami, Nidalee, Skarner, Varus, Vladimir",1,5.0,438,2,3.5
"Illaoi, Leona, Sejuani, Skarner, Talon, Twitch, Varus, Xayah",1,5.0,977,1,5.0
"Braum, DragonBlue, Leona, Shen, Yone",1,5.0,341,31,5.353439153439153
"Illaoi, Nidalee, Skarner, Twitch, Varus",1,5.0,978,1,5.0
"AoShin, Heimerdinger, Illaoi, Lulu, Sylas, TrainerDragon, Zoe",1,5.0,63,897,5.294043124972479
"Illaoi, Nami, Sylas, Talon, Twitch, Varus, Yasuo",1,5.0,979,1,5.0
"AoShin, Bard, Heimerdinger, Ornn, Sylas, TrainerDragon, Tristana, Yasuo, Zoe",1,5.0,0,590,3.0724413297820004
"Braum, Corki, Jinx, Lulu, Nami, Thresh, TrainerDragon, Tristana",1,5.0,229,233,4.803836273821029
"Illaoi, Lillia, Lulu, Nami, Ryze, Sylas, Vladimir, Yasuo",1,5.0,980,2,6.0
"DragonPurple, Elise, Neeko, Pyke, Thresh",1,5.0,22,1225,4.750811401844438
"AurelionSol, Heimerdinger, Lillia, Ornn, Ryze, Sona, Sylas, Yasuo",1,5.0,981,1,5.0
"AurelionSol, Heimerdinger, Lulu, Nami, Ornn, Ryze, Sylas, TrainerDragon",2,5.0,219,30,5.523148148148148
"AoShin, Bard, Braum, Lulu, Ornn, Thresh, TrainerDragon, Tristana",1,5.0,478,2,3.5
"Corki, DragonPurple, Heimerdinger, Lulu, Ornn, Sona, TrainerDragon, Zoe",1,5.0,982,1,5.0
"DragonPurple, Elise, Hecarim, Neeko, Pyke, Sylas, Talon",1,5.0,22,1225,4.750811401844438
"Bard, DragonBlue, Hecarim, Nunu, Sejuani, Twitch, Yasuo",1,5.0,59,19,4.537878787878788
"Bard, DragonBlue, Leona, Lillia, Nunu, Sejuani, Yone",1,5.0,60,173,3.6427693833943837
"AoShin, Bard, DragonGold, DragonGreen, Ornn, Zoe",1,5.0,6,510,3.4673890669769794
"AoShin, Bard, DragonGold, Neeko, Ornn, Shyvana",1,5.0,983,1,5.0
"Corki, DragonPurple, Lulu, Sona, Soraka, Sylas, TrainerDragon, Tristana",1,5.0,67,107,5.578474903474904
"Braum, Jinx, Lulu, Senna, Talon, Thresh, TrainerDragon, Tristana",1,5.0,229,233,4.803836273821029
"Bard, DragonBlue, Leona, Nunu, Sejuani, Yasuo, Yone",2,5.0,60,173,3.6427693833943837
"AoShin, Ornn, Pyke, Ryze, Shen, Sylas",1,5.0,984,1,5.0
"Corki, DragonPurple, Lulu, Sona, Sylas, TrainerDragon, Tristana, Yasuo",3,5.0,67,107,5.578474903474904
"Corki, DragonPurple, Lulu, Sona, Sylas, Talon, TrainerDragon, Tristana",1,5.0,67,107,5.578474903474904
"Bard, DragonBlue, Nunu, Olaf, Shen, Yasuo, Yone",1,5.0,60,173,3.6427693833943837
"Bard, DragonBlue, Nunu, Sejuani, Talon, Twitch, Yone",1,5.0,85,2,3.0
"Braum, Jinx, Lulu, Nami, Senna, Sona, Thresh, TrainerDragon, Tristana",1,5.0,229,233,4.803836273821029
"Bard, DragonBlue, DragonGreen, DragonPurple, Sylas",2,5.0,484,3,3.5
"Corki, DragonPurple, Lulu, Pyke, Shen, Sona, TrainerDragon, Tristana, Yasuo",1,5.0,539,2,4.0
"Braum, Corki, DragonPurple, Jinx, Lulu, Thresh, TrainerDragon, Tristana",1,5.0,985,1,5.0
"AoShin, Heimerdinger, Lulu, Sona, Sylas, TrainerDragon, Yasuo, Zoe",1,5.0,63,897,5.294043124972479
"Diana, Illaoi, Kayn, Olaf, Ornn, Qiyana, Shen, Soraka, Talon",1,5.0,11,510,4.404484592464881
"AoShin, LeeSin, Ornn, Ryze, Yasuo, Zoe",1,5.0,986,1,5.0
"Bard, DragonBlue, Leona, Nunu, Sejuani, Talon, Thresh",1,5.0,987,1,5.0
"AoShin, Heimerdinger, Lulu, Neeko, Ornn, Sona, Sylas, TrainerDragon",1,5.0,222,131,5.347627468317124
"Bard, DragonBlue, Hecarim, Nunu, Twitch, Yasuo, Yone",1,5.0,59,19,4.537878787878788
"Corki, DragonPurple, Heimerdinger, Jinx, Lillia, Lulu, Sona, Sylas, TrainerDragon",1,5.0,67,107,5.578474903474904
"AoShin, Heimerdinger, Lulu, Pyke, Shen, Sylas, TrainerDragon, Vladimir, Yasuo, Zoe",1,5.0,63,897,5.294043124972479
"Bard, Hecarim, Shen, Shyvana, Talon, Twitch, Xayah, Yasuo",1,5.0,53,434,4.10255703113372
"Braum, Diana, Hecarim, Lillia, Nami, Sylas, Taric",1,5.0,988,1,5.0
"Bard, Hecarim, Nunu, Shen, Shyvana, Twitch, Xayah",1,5.0,53,434,4.10255703113372
"Braum, Diana, Hecarim, Kayn, Leona, Neeko, Ornn, Pyke, Qiyana, Talon",1,5.0,989,1,5.0
"DragonPurple, Elise, Neeko, Pyke, Sylas, Thresh, Yasuo",4,5.0,22,1225,4.750811401844438
"Corki, DragonPurple, Jinx, Sona, Sylas, Yasuo, Zoe",1,5.0,990,1,5.0
"Bard, Shen, Shyvana, Swain, Volibear, Xayah, Yasuo",1,5.0,991,1,5.0
"Bard, DragonBlue, Heimerdinger, Lulu, Nunu, Sylas, TrainerDragon, Zoe",1,5.0,9,795,3.863117852253815
"AoShin, Bard, Lillia, Ornn, Ryze, Sylas, Vladimir",1,5.0,55,81,4.365671641791045
"Bard, DragonBlue, Hecarim, Leona, Nunu, Shen, Yasuo, Yone",1,5.0,60,173,3.6427693833943837
"Corki, DragonPurple, Jinx, Lulu, Senna, Sona, TrainerDragon, Tristana",1,5.0,67,107,5.578474903474904
"DragonPurple, Elise, Neeko, Sylas, Thresh, Zoe",2,5.0,37,76,3.7540935672514624
"Bard, DragonBlue, Hecarim, Lillia, Lulu, Nunu, Sejuani",1,5.0,992,1,5.0
"Bard, DragonBlue, Hecarim, Lillia, Nunu, Ornn, Ryze, Zoe",1,5.0,62,16,2.15
"Corki, DragonPurple, Jinx, Lulu, Ornn, Sona, Sylas",1,5.0,993,3,5.333333333333333
"Corki, DragonPurple, Jinx, Lulu, Ornn, Pyke, Sona",1,5.0,993,3,5.333333333333333
"AoShin, Heimerdinger, Lulu, Ornn, Pyke, Sylas, TrainerDragon, Twitch, Zoe",1,5.0,994,1,5.0
"Corki, DragonPurple, Ornn, Shen, Sona, Sylas, Zoe",1,5.0,995,1,5.0
"Bard, DragonBlue, Hecarim, Lillia, Nunu, Sejuani, Twitch, Yasuo",1,5.0,59,19,4.537878787878788
"Bard, DragonBlue, Hecarim, Leona, Lulu, Nunu, Yone",1,5.0,60,173,3.6427693833943837
"Corki, DragonPurple, Heimerdinger, Jinx, Sona, Sylas, TrainerDragon, Tristana",1,5.0,996,1,5.0
"Corki, DragonPurple, Jinx, Lulu, Sona, Sylas, TrainerDragon, Tristana",27,5.0,67,107,5.578474903474904
"AurelionSol, Heimerdinger, Lulu, Nami, Ryze, Sylas, TrainerDragon, Zoe",1,5.0,218,39,5.206597222222222
"AoShin, Heimerdinger, Lulu, Neeko, Ornn, Ryze, Sylas, TrainerDragon",1,5.0,222,131,5.347627468317124
"Diana, Illaoi, Olaf, Ornn, Qiyana, Shen, Talon",3,5.0,11,510,4.404484592464881
"Bard, Illaoi, Nami, Ornn, Ryze, Twitch, Varus",1,5.0,25,237,2.922690935803459
"Bard, Illaoi, Nami, Ornn, Talon, Twitch, Varus",1,5.0,25,237,2.922690935803459
"Bard, Illaoi, Nami, Nunu, Sylas, Twitch, Varus, Vladimir",1,5.0,25,237,2.922690935803459
"Bard, Illaoi, Nami, Twitch, Varus",2,5.0,25,237,2.922690935803459
"Bard, Illaoi, Nami, Nidalee, Ryze, Skarner, Twitch, Varus, Vladimir, Zoe",1,5.0,25,237,2.922690935803459
"Bard, Illaoi, Nami, Nidalee, Ryze, Skarner, Varus, Vladimir",1,5.0,39,227,3.208501741314241
"Bard, Illaoi, Nami, Nidalee, Skarner, Sylas, Varus, Vladimir",3,5.0,39,227,3.208501741314241
"Bard, Illaoi, Nami, Nidalee, Skarner, Talon, Twitch, Varus, Vladimir",1,5.0,25,237,2.922690935803459
"AoShin, Bard, Ornn, Ryze, Sylas, Thresh, Zoe",1,5.0,6,510,3.4673890669769794
"Diana, Olaf, Ornn, Shen, Sylas, Talon, Twitch",1,5.0,227,3,3.6666666666666665
"Bard, Illaoi, Nami, Ornn, Twitch, Varus, Yasuo",1,5.0,25,237,2.922690935803459
"DragonPurple, Elise, Ornn, Qiyana, Sylas, Thresh, Yasuo",1,5.0,22,1225,4.750811401844438
"Nami, Nidalee, Ornn, Ryze, Skarner, Sylas, Vladimir",1,5.0,997,1,5.0
"Diana, Olaf, Ornn, Qiyana, Shen, Sylas, Talon, Xayah",1,5.0,11,510,4.404484592464881
"AurelionSol, Heimerdinger, Lulu, Ornn, Pyke, Soraka, Sylas, TrainerDragon, Zoe",1,5.0,218,39,5.206597222222222
"Diana, Olaf, Ornn, Pyke, Shen, Sylas, Talon, Twitch",1,5.0,227,3,3.6666666666666665
"Diana, Olaf, Ornn, Pyke, Qiyana, Talon, Yasuo",1,5.0,11,510,4.404484592464881
"AurelionSol, Heimerdinger, Lulu, Ornn, Ryze, Sylas, TrainerDragon, Zoe",2,5.0,218,39,5.206597222222222
"DragonPurple, Elise, Ornn, Pyke, Qiyana, Shen, Sylas",1,5.0,22,1225,4.750811401844438
"AoShin, Bard, Ornn, Shen, TahmKench, Talon, Zoe",1,5.0,998,1,5.0
"AurelionSol, Heimerdinger, Lulu, Nami, Ornn, Sona, Sylas, TrainerDragon",1,5.0,219,30,5.523148148148148
"Diana, Olaf, Ornn, Pyke, Qiyana, Shen, Sylas",1,5.0,11,510,4.404484592464881
"Diana, Olaf, Ornn, Qiyana, Shen, Talon, Volibear, Yasuo",1,5.0,11,510,4.404484592464881
"AoShin, Bard, DragonGold, Kayn, Ornn, Pyke, Zoe",1,5.0,76,3,3.3333333333333335
"Bard, Illaoi, Nami, Sylas, Talon, Twitch, Varus",1,5.0,25,237,2.922690935803459
"Bard, Illaoi, Lillia, Nami, Ryze, Sylas, Vladimir, Zoe",2,5.0,39,227,3.208501741314241
"Bard, DragonGreen, Elise, Neeko, Nidalee, Olaf, Swain, Sylas",1,5.0,1,316,3.547021497021497
"AoShin, Bard, DragonGold, Ornn, Ryze, Soraka, Sylas, Zoe",1,5.0,6,510,3.4673890669769794
"Bard, DragonGreen, DragonPurple, Ornn, Shyvana",1,5.0,999,1,5.0
"Diana, Illaoi, Olaf, Ornn, Pyke, Qiyana, Shen",1,5.0,11,510,4.404484592464881
"Bard, DragonGreen, Lulu, Ornn, Soraka, Sylas, Zoe",1,5.0,1000,1,5.0
"Bard, DragonGreen, Heimerdinger, Lulu, Ornn, Soraka, TrainerDragon, Tristana",1,5.0,1001,1,5.0
"Diana, DragonGreen, Gnar, Neeko, Qiyana, Soraka, Talon",1,5.0,1002,1,5.0
"Bard, DragonGreen, Hecarim, Lulu, Neeko, Sejuani, Soraka, Talon",1,5.0,1003,1,5.0
"DragonPurple, Elise, Olaf, Ornn, Ryze, Shen, Sylas",1,5.0,22,1225,4.750811401844438
"Braum, Corki, Heimerdinger, Jinx, Lulu, Thresh, TrainerDragon, Tristana",3,5.0,229,233,4.803836273821029
"Bard, Illaoi, Kayn, Nami, Sylas, Talon, Twitch, Varus",1,5.0,25,237,2.922690935803459
"DragonPurple, Elise, Lillia, Neeko, Sylas, Thresh, Zoe",1,5.0,37,76,3.7540935672514624
"Diana, Hecarim, Kayn, Lillia, Olaf, Qiyana, Shen, Talon",1,5.0,11,510,4.404484592464881
"Diana, Hecarim, Kayn, Ornn, Qiyana, Sejuani, Shen, Talon",1,5.0,1004,1,5.0
"Bard, Illaoi, Lulu, Nami, Ornn, Sylas, Twitch, Varus",1,5.0,25,237,2.922690935803459
"Bard, Illaoi, Lulu, Nami, Ornn, Ryze, Soraka, Sylas",1,5.0,1005,2,6.5
"Bard, Illaoi, Lulu, Nami, Ryze, Soraka, Sylas, Vladimir",1,5.0,39,227,3.208501741314241
"Bard, Illaoi, Lulu, Nami, Nidalee, Skarner, Sylas, Twitch, Varus, Vladimir",1,5.0,25,237,2.922690935803459
"DragonPurple, Elise, Ornn, Soraka, Sylas, Thresh, Yasuo, Zoe",1,5.0,609,2,4.0
"Braum, Corki, Heimerdinger, Jinx, Lulu, Senna, Talon, Thresh, TrainerDragon, Tristana",1,5.0,229,233,4.803836273821029
"Bard, Illaoi, Lulu, Nami, Skarner, Sona, Varus, Vladimir",1,5.0,39,227,3.208501741314241
"AoShin, Bard, Ornn, Sejuani, Soraka, Sylas, Zoe",1,5.0,6,510,3.4673890669769794
"Bard, DragonGreen, Karma, Leona, Soraka, Taric, Yasuo",2,5.0,1006,2,5.0
"Corki, DragonGold, Jinx, Lulu, Sona, Thresh",2,5.0,1007,3,6.0
"Corki, DragonBlue, Jinx, Leona, Ornn, Sona, TahmKench",1,5.0,1008,1,5.0
"AoShin, Ornn, Ryze, Sona, Sylas, Talon, Yasuo, Zoe",1,5.0,1009,1,5.0
"DragonGold, Hecarim, Kayn, Thresh, Volibear, Xayah, Zoe",1,5.0,422,10,6.666666666666667
"Ashe, Elise, Gnar, Neeko, Senna, Sett, Swain",1,5.0,129,83,4.935790273556231
"DragonPurple, Heimerdinger, Lulu, Sona, Soraka, Sylas, TrainerDragon, Zoe",2,5.0,134,38,4.337301587301587
"DragonBlue, DragonGold, DragonPurple, Nunu, Pyke",1,5.0,1010,1,5.0
"Heimerdinger, Lulu, Nami, Ornn, Ryze, Sona, Sylas, TrainerDragon, Vladimir, Zoe",2,5.0,63,897,5.294043124972479
"AoShin, Bard, Lulu, Ornn, Ryze, Sejuani, Sylas, Zoe",1,5.0,6,510,3.4673890669769794
"DragonBlue, DragonGold, DragonPurple, Leona, Nunu",1,5.0,1011,1,5.0
"DragonPurple, Heimerdinger, Lulu, Pyke, Shen, Sylas, Thresh, TrainerDragon, Zoe",1,5.0,134,38,4.337301587301587
"AoShin, Hecarim, Lillia, Ornn, Ryze, Sylas, Yasuo",1,5.0,1012,2,6.0
"DragonGold, Hecarim, Shen, Twitch, Xayah, Yasuo, Zoe",1,5.0,1013,1,5.0
