comp,value_count,average_placement,group,grp_count,grp_placement
"AoShin, Bard, Heimerdinger, Lulu, Ryze, Sylas, TrainerDragon, Yasuo, Zoe",2,1.0,0,590,3.0724413297820004
"Bard, Diana, DragonPurple, Ornn, Pyke, Qiyana, Soraka, Talon, Yasuo",1,1.0,1,316,3.547021497021497
"Corki, DragonGold, Hecarim, Ornn, Pyke, Shyvana, Yasuo",1,1.0,2,1,1.0
"AoShin, DragonGold, DragonPurple, Pyke, Soraka, Zoe",1,1.0,3,1,1.0
"Bard, Braum, DragonBlue, Leona, Nami, Soraka, Yasuo, Yone",1,1.0,4,1,1.0
"Bard, Braum, DragonBlue, Leona, Nami, Shen, Yone",1,1.0,5,1,1.0
"AoShin, Bard, Nunu, Ornn, Pyke, Sylas, Yasuo, Zoe",1,1.0,6,510,3.4673890669769794
"Bard, Braum, Leona, Olaf, Shen, Taric, Thresh, Yasuo, Yone",1,1.0,7,2,1.5
"Bard, Braum, Hecarim, Leona, Nunu, Olaf, Shen, Yasuo, Yone",1,1.0,8,1,1.0
"Bard, Braum, Corki, Jinx, Lulu, Sona, Talon, TrainerDragon, Tristana",1,1.0,9,795,3.863117852253815
"Bard, Braum, Corki, DragonGold, Jinx, Lulu, Sona, TrainerDragon, Tristana, Yasuo",1,1.0,9,795,3.863117852253815
"AoShin, Bard, Neeko, Ornn, Pyke, Ryze, Sylas, Talon, Zoe",1,1.0,6,510,3.4673890669769794
"Bard, Braum, Corki, DragonGold, Lulu, Sona, Soraka, TrainerDragon, Tristana, Volibear",1,1.0,9,795,3.863117852253815
"Bard, Braum, Corki, Heimerdinger, Jinx, Lulu, Sona, Thresh, TrainerDragon, Tristana, Yasuo",1,1.0,9,795,3.863117852253815
"Bard, Braum, Corki, Heimerdinger, Jinx, Lulu, Thresh, TrainerDragon, Tristana",1,1.0,9,795,3.863117852253815
"AoShin, Bard, Neeko, Ornn, Shyvana, Yasuo",1,1.0,10,1,1.0
"Braum, Diana, Olaf, Ornn, Pyke, Shen, Sylas, Thresh",1,1.0,11,510,4.404484592464881
"Bard, Braum, Diana, Neeko, Pyke, Qiyana, Talon, Thresh, Xayah",1,1.0,12,1,1.0
"Bard, Braum, Diana, Hecarim, Lillia, Olaf, Pyke, Sejuani, Yasuo",1,1.0,13,2,1.5
"Bard, Braum, Diana, Hecarim, Lillia, Pyke, Sylas, Thresh",1,1.0,14,1,1.0
"Bard, Braum, Diana, Olaf, Ornn, Pyke, Qiyana, Talon",1,1.0,1,316,3.547021497021497
"Bard, Braum, Diana, Olaf, Ornn, Pyke, Qiyana, Talon, Yasuo",1,1.0,1,316,3.547021497021497
"Bard, Braum, Diana, Olaf, Ornn, Pyke, Qiyana, Talon, Thresh, Yasuo",1,1.0,1,316,3.547021497021497
"Bard, Braum, Diana, Olaf, Ornn, Pyke, Qiyana, Shen, Talon",1,1.0,1,316,3.547021497021497
"Corki, Jinx, Lulu, Neeko, Ornn, Sona, TrainerDragon, Tristana",1,1.0,15,51,5.854166666666666
"Bard, Braum, Diana, Lillia, Olaf, Ornn, Pyke, Qiyana, Talon, Yasuo",1,1.0,1,316,3.547021497021497
"Bard, Braum, Olaf, Shen, Yasuo, Yone",1,1.0,16,1,1.0
"Bard, Braum, DragonGold, Leona, Shen, Thresh, Yone",1,1.0,17,1,1.0
"Bard, Diana, DragonPurple, Ornn, Pyke, Qiyana, Soraka, Talon",1,1.0,1,316,3.547021497021497
"Bard, Braum, Lulu, Olaf, Pyke, Shen, Thresh, Yasuo, Yone",1,1.0,18,3,2.3333333333333335
"Bard, Diana, DragonPurple, Kayn, Pyke, Qiyana, Talon, Yasuo",1,1.0,1,316,3.547021497021497
"Corki, DragonGold, Jinx, Senna, Sona, Soraka, TahmKench, Tristana",1,1.0,19,2,4.5
"AoShin, DragonPurple, Elise, Neeko, Ornn, Pyke, Sylas",1,1.0,20,1,1.0
"Bard, Corki, DragonGold, Lulu, Soraka, Thresh, TrainerDragon, Tristana, Yasuo",1,1.0,9,795,3.863117852253815
"Bard, Corki, DragonGold, Lulu, Senna, Sona, TrainerDragon, Tristana, Yasuo",1,1.0,9,795,3.863117852253815
"Corki, DragonGold, Heimerdinger, Jinx, Sona, Thresh, TrainerDragon, Tristana",1,1.0,21,230,5.370765582655826
"Bard, Corki, DragonGold, Lulu, Sona, Soraka, Thresh, TrainerDragon, Tristana, Yasuo",1,1.0,9,795,3.863117852253815
"DragonPurple, Elise, Neeko, Ornn, Pyke, Qiyana, Soraka, Sylas",1,1.0,22,1225,4.750811401844438
"Corki, DragonGold, Sona, Soraka",1,1.0,23,1,1.0
"Bard, Corki, DragonGold, Lulu, Sona, Thresh, TrainerDragon, Tristana, Zoe",1,1.0,9,795,3.863117852253815
"Bard, Corki, DragonGold, Lulu, Pyke, Sona, Soraka, TrainerDragon, Tristana, Yasuo",1,1.0,9,795,3.863117852253815
"Bard, Corki, DragonGold, Lulu, Pyke, Sona, Soraka, Thresh, TrainerDragon, Tristana",1,1.0,9,795,3.863117852253815
"DragonPurple, Elise, Neeko, Ornn, Pyke, Shen, Sylas, Talon",1,1.0,22,1225,4.750811401844438
"Bard, Corki, DragonGold, Pyke, Sona, Thresh, Yasuo",1,1.0,9,795,3.863117852253815
"Bard, Corki, Heimerdinger, Jinx, Lulu, Ornn, Sona, TahmKench, TrainerDragon, Tristana",1,1.0,9,795,3.863117852253815
"Bard, Corki, Heimerdinger, Jinx, Lulu, Ornn, Sona, Sylas, TrainerDragon, Tristana, Zoe",1,1.0,9,795,3.863117852253815
"Bard, Corki, Heimerdinger, Jinx, Lulu, Ornn, Qiyana, Sona, Sylas, TrainerDragon, Zoe",1,1.0,9,795,3.863117852253815
"AoShin, Bard, Heimerdinger, Lulu, Ornn, Pyke, Sylas, TrainerDragon, Yasuo, Zoe",1,1.0,0,590,3.0724413297820004
"Bard, Corki, Lulu, Neeko, Ornn, Shyvana, Sona, TrainerDragon, Tristana",1,1.0,9,795,3.863117852253815
"Bard, Corki, Lulu, Ornn, Ryze, Sylas, TrainerDragon, Tristana, Yasuo, Zoe",1,1.0,9,795,3.863117852253815
"DragonPurple, Elise, Neeko, Ornn, Pyke, Soraka, Sylas, Thresh",1,1.0,22,1225,4.750811401844438
"Bard, Corki, DragonPurple, Jinx, Lulu, Sona, TahmKench, TrainerDragon, Tristana",1,1.0,9,795,3.863117852253815
"Bard, Corki, DragonPurple, Jinx, Lulu, Ornn, TrainerDragon, Tristana",1,1.0,9,795,3.863117852253815
"Bard, Corki, DragonPurple, Heimerdinger, Illaoi, Ornn, TahmKench, TrainerDragon, Tristana",1,1.0,24,1,1.0
"Bard, Corki, DragonPurple, Lulu, Nami, Sona, Sylas, TrainerDragon, Tristana, Yasuo, Zoe",1,1.0,9,795,3.863117852253815
"Corki, DragonGold, Jinx, Lulu, Nami, Sona, Thresh, TrainerDragon, Tristana",1,1.0,21,230,5.370765582655826
"Bard, Diana, Illaoi, Ornn, Pyke, Qiyana, Talon, Twitch, Varus",1,1.0,25,237,2.922690935803459
"Bard, Diana, Hecarim, Lillia, Nunu, Olaf, Sejuani, Shen, Talon",1,1.0,26,2,1.5
"DragonPurple, Elise, Neeko, Ornn, Qiyana, Talon, Twitch",1,1.0,27,1,1.0
"Corki, DragonGold, Kayn, Pyke, Thresh, Volibear, Zoe",1,1.0,28,1,1.0
"Bard, Corki, DragonGold, Lulu, Nami, Sona, Soraka, TrainerDragon, Tristana",1,1.0,9,795,3.863117852253815
"Bard, Braum, DragonPurple, Elise, Neeko, Sylas, Thresh",1,1.0,1,316,3.547021497021497
"Bard, DragonGold, Hecarim, Shen, Talon, Twitch, Xayah",1,1.0,29,4,3.75
"Bard, Heimerdinger, Illaoi, Lulu, Nami, Ryze, Sylas, Thresh, TrainerDragon, Vladimir",1,1.0,9,795,3.863117852253815
"Bard, Heimerdinger, Illaoi, Lulu, Nami, Soraka, Sylas, TrainerDragon, Zoe",1,1.0,9,795,3.863117852253815
"Corki, DragonBlue, Jinx, Lulu, Ornn, Sona, TahmKench, Yasuo",2,1.0,30,44,4.043115942028986
"Bard, Heimerdinger, Illaoi, Lulu, Nami, Sona, Sylas, TrainerDragon, Twitch, Varus",1,1.0,31,2,2.0
"AoShin, Bard, DragonGreen, DragonPurple, Ornn, Pyke",1,1.0,32,3,2.0
"DragonPurple, Elise, Gnar, Lulu, Neeko, Soraka, Sylas, Thresh",1,1.0,22,1225,4.750811401844438
"AoShin, Bard, DragonGreen, DragonPurple, Ornn, Soraka",1,1.0,32,3,2.0
"Corki, DragonBlue, Jinx, Ornn, Sona, TahmKench, Yasuo, Yone",1,1.0,30,44,4.043115942028986
"Corki, DragonBlue, Jinx, Ornn, Sona, Soraka, TahmKench, Zoe",1,1.0,33,1,1.0
"Bard, Heimerdinger, Lulu, Nami, Ornn, Ryze, Soraka, Sylas, TrainerDragon, Zoe",2,1.0,9,795,3.863117852253815
"AoShin, Bard, DragonGreen, Neeko, Shyvana, Soraka, Yasuo",1,1.0,34,1,1.0
"Bard, Heimerdinger, Lulu, Nami, Ornn, Ryze, Sylas, TrainerDragon, Tristana, Yasuo, Zoe",1,1.0,9,795,3.863117852253815
"Bard, Heimerdinger, Lulu, Nami, Ornn, Soraka, Sylas, TrainerDragon, Yasuo, Zoe",1,1.0,9,795,3.863117852253815
"Corki, DragonBlue, Jinx, Sona, TahmKench, Tristana, Yasuo",1,1.0,35,1,1.0
"AoShin, Bard, Karma, LeeSin, Leona, Soraka, Taric, Yasuo",1,1.0,36,1,1.0
"Bard, Heimerdinger, Lulu, Nami, Ornn, Pyke, Ryze, Sylas, TrainerDragon, Zoe",1,1.0,9,795,3.863117852253815
"Bard, Heimerdinger, Lulu, Nami, Ornn, Sylas, TrainerDragon",1,1.0,9,795,3.863117852253815
"Braum, Diana, Lillia, Olaf, Sejuani, Sylas, Talon",1,1.0,11,510,4.404484592464881
"DragonPurple, Elise, Gnar, Neeko, Sylas, Thresh, Yasuo, Zoe",1,1.0,37,76,3.7540935672514624
"AoShin, Bard, Nami, Ornn, Pyke, Soraka, Sylas, Zoe",3,1.0,6,510,3.4673890669769794
"Corki, DragonBlue, Jinx, Neeko, Sona, Soraka, TahmKench, Yasuo",1,1.0,38,3,2.75
"Bard, DragonPurple, Illaoi, Nami, Ornn, Sylas, Yasuo, Zoe",1,1.0,39,227,3.208501741314241
"AoShin, Bard, Nami, Ornn, Pyke, Soraka, Sylas, Yasuo, Zoe",2,1.0,6,510,3.4673890669769794
"AoShin, Bard, Heimerdinger, Lulu, Pyke, Sylas, TrainerDragon, Yasuo, Zoe",1,1.0,0,590,3.0724413297820004
"Bard, DragonPurple, Nami, Pyke, Ryze, Sylas, Vladimir, Zoe",1,1.0,39,227,3.208501741314241
"AoShin, Bard, Nami, Ornn, Sona, Soraka, Sylas, Zoe",1,1.0,6,510,3.4673890669769794
"Bard, DragonPurple, Nami, Sylas, Yasuo, Zoe",1,1.0,39,227,3.208501741314241
"AoShin, DragonGold, DragonPurple, Ornn, Yasuo, Zoe",1,1.0,40,1,1.0
"Bard, DragonGold, Hecarim, Twitch, Volibear, Xayah, Yasuo, Zoe",1,1.0,41,2,2.5
"AoShin, Bard, Gnar, LeeSin, Neeko, Ornn, Soraka, Sylas, Zoe",1,1.0,6,510,3.4673890669769794
"Corki, DragonBlue, Lulu, Ornn, Sona, TahmKench, TrainerDragon, Tristana, Yasuo",1,1.0,42,21,3.8910256410256414
"Bard, DragonGold, Hecarim, Kayn, Talon, Twitch, Xayah, Zoe",1,1.0,43,1,1.0
"Ezreal, Hecarim, Ornn, Shen, Shyvana, Soraka, Xayah, Yasuo",1,1.0,44,1,1.0
"Bard, DragonGold, Kayn, Soraka, Talon, Volibear, Yasuo, Zoe",1,1.0,45,17,3.21875
"Bard, DragonGold, Kayn, Soraka, Volibear, Xayah, Yasuo, Zoe",1,1.0,45,17,3.21875
"Bard, DragonGold, Kayn, Soraka, Volibear, Xayah, Zoe",1,1.0,45,17,3.21875
"Braum, Diana, Olaf, Ornn, Pyke, Qiyana, Shen, Sylas",1,1.0,11,510,4.404484592464881
"DragonPurple, Elise, Neeko, Soraka, Sylas, Taric, Thresh, Twitch",1,1.0,46,6,3.8333333333333335
"Bard, DragonGold, Kayn, Ornn, Pyke, Qiyana, Sylas, Yasuo, Zoe",1,1.0,47,1,1.0
"Bard, DragonGold, Kayn, Pyke, Talon, Thresh, Volibear, Zoe",1,1.0,45,17,3.21875
"AoShin, Bard, Neeko, Ornn, Ryze, Soraka, Sylas, Zoe",1,1.0,6,510,3.4673890669769794
"AoShin, Bard, Neeko, Shyvana, Soraka, Yasuo, Zoe",1,1.0,6,510,3.4673890669769794
"Bard, DragonGold, Heimerdinger, Illaoi, Lulu, Sylas, Thresh, TrainerDragon, Volibear, Yasuo, Zoe",1,1.0,48,1,1.0
"Corki, Hecarim, Lulu, Neeko, Ornn, Pyke, Xayah, Yasuo",1,1.0,49,3,1.6666666666666667
"Bard, DragonGold, Lulu, Pyke, Talon, Yasuo, Zoe",1,1.0,45,17,3.21875
"DragonPurple, Elise, Neeko, Soraka, Sylas, Taric, Twitch",1,1.0,46,6,3.8333333333333335
"Bard, DragonGold, Pyke, Ryze, Talon, Thresh, Twitch",1,1.0,50,1,1.0
"Ezreal, Hecarim, Ornn, Pyke, Sejuani, Shen, Soraka, Talon, Twitch, Xayah",1,1.0,51,21,4.705555555555556
"AoShin, Bard, Gnar, Lulu, Neeko, Ornn, Sona, Soraka",1,1.0,52,2,2.0
"Bard, Ornn, Qiyana, Ryze, Sejuani, Talon, Twitch, Xayah, Yasuo",1,1.0,53,434,4.10255703113372
"Bard, Ornn, Pyke, Ryze, Soraka, Sylas, Talon, Yasuo, Zoe",1,1.0,39,227,3.208501741314241
"Corki, Hecarim, Jinx, Lulu, Senna, Shen, Sona, TahmKench, TrainerDragon, Tristana",1,1.0,54,1,1.0
"AoShin, Bard, Gnar, Lulu, Neeko, Ornn, Soraka, Yasuo",1,1.0,55,81,4.365671641791045
"Bard, LeeSin, Ornn, Sett, Shen, Shyvana, Swain, Yasuo",1,1.0,56,2,3.5
"Bard, Ezreal, Illaoi, Ornn, Pyke, Soraka, Talon, Twitch, Varus",1,1.0,25,237,2.922690935803459
"Bard, Ezreal, Illaoi, Lulu, Ornn, Shen, Soraka, Talon, Varus",1,1.0,57,1,1.0
"Bard, Ezreal, Hecarim, Ornn, Sejuani, Shen, Talon, Xayah, Yasuo",1,1.0,53,434,4.10255703113372
"AoShin, Bard, Gnar, LeeSin, Neeko, Ornn, Qiyana, Soraka, Yasuo",1,1.0,55,81,4.365671641791045
"Corki, DragonBlue, LeeSin, Ornn, Sona, TahmKench, Yasuo",2,1.0,30,44,4.043115942028986
"AoShin, Bard, Nami, Ornn, Shen, Sylas, Yasuo, Zoe",1,1.0,6,510,3.4673890669769794
"Bard, Corki, DragonGold, Heimerdinger, Lulu, Nami, Sona, TrainerDragon, Tristana",1,1.0,9,795,3.863117852253815
"Bard, Corki, DragonGold, Jinx, Lulu, Thresh, TrainerDragon, Tristana",1,1.0,9,795,3.863117852253815
"Corki, DragonPurple, Heimerdinger, Lulu, Sona, Sylas, TrainerDragon, Tristana, Zoe",1,1.0,58,52,3.690625
"Bard, DragonBlue, Hecarim, Nunu, Ryze, Sejuani, Talon, Twitch",2,1.0,59,19,4.537878787878788
"Bard, DragonBlue, Hecarim, Nunu, Ryze, Sejuani, Yasuo, Yone",1,1.0,60,173,3.6427693833943837
"AoShin, Bard, Braum, Ezreal, Leona, Lulu, Twitch, Zoe",1,1.0,61,1,1.0
"Bard, DragonBlue, Hecarim, Nunu, Pyke, Sejuani, Talon, Yasuo",2,1.0,60,173,3.6427693833943837
"Bard, DragonBlue, Hecarim, Nunu, Pyke, Yasuo, Yone, Zoe",1,1.0,62,16,2.15
"Bard, DragonBlue, Hecarim, Nunu, Thresh, Yasuo, Yone",1,1.0,60,173,3.6427693833943837
"Corki, DragonPurple, Heimerdinger, Lulu, Nami, Sona, Sylas, TrainerDragon, Zoe",2,1.0,58,52,3.690625
"Bard, DragonBlue, Hecarim, Leona, Nunu, Sejuani, Soraka, Yasuo",1,1.0,60,173,3.6427693833943837
"AoShin, Heimerdinger, Lulu, Ornn, Pyke, Soraka, Sylas, TrainerDragon, Zoe",1,1.0,63,897,5.294043124972479
"Bard, DragonBlue, Hecarim, Leona, Nunu, Sejuani, Yasuo, Yone",2,1.0,60,173,3.6427693833943837
"AoShin, Bard, Braum, Hecarim, Nunu, Ornn, Shen, Thresh, Yone",1,1.0,64,1,1.0
"Bard, DragonBlue, Hecarim, Leona, Nunu, Yasuo, Yone, Zoe",1,1.0,62,16,2.15
"AoShin, Heimerdinger, Lulu, Ornn, Pyke, Sona, Soraka, Sylas, TrainerDragon, Zoe",1,1.0,63,897,5.294043124972479
"Bard, DragonBlue, Hecarim, Leona, Nunu, Pyke, Yasuo, Yone",1,1.0,60,173,3.6427693833943837
"Bard, DragonBlue, Hecarim, Lillia, Nunu, Yone",1,1.0,60,173,3.6427693833943837
"Bard, DragonBlue, Hecarim, Lillia, Lulu, Nunu, Yasuo, Yone",2,1.0,60,173,3.6427693833943837
"Bard, DragonBlue, Hecarim, Lulu, Neeko, Nunu",1,1.0,65,1,1.0
"Bard, DragonBlue, Olaf, Shen, Soraka, Yasuo, Yone",1,1.0,60,173,3.6427693833943837
"AoShin, Bard, Lillia, Ornn, Soraka, Sylas, Zoe",1,1.0,6,510,3.4673890669769794
"Bard, DragonBlue, DragonGold, DragonGreen, Leona",1,1.0,66,1,1.0
"Corki, DragonPurple, Jinx, Lulu, Sona, Soraka, TahmKench, TrainerDragon, Tristana",1,1.0,67,107,5.578474903474904
"Bard, DragonBlue, DragonGold, Hecarim, Nunu, Soraka, Yasuo",1,1.0,68,1,1.0
"Bard, DragonBlue, DragonGold, Hecarim, Pyke, Thresh, Yasuo",1,1.0,69,1,1.0
"AoShin, Bard, Lillia, Ornn, Soraka, Sylas, Yasuo, Zoe",1,1.0,6,510,3.4673890669769794
"Bard, DragonBlue, DragonGold, DragonPurple, Pyke, Zoe",1,1.0,70,1,1.0
"AoShin, Bard, Lillia, Nami, Neeko, Ornn, Sylas, Zoe",1,1.0,6,510,3.4673890669769794
"Bard, DragonBlue, Hecarim, Nunu, Talon, Yasuo, Yone, Zoe",1,1.0,62,16,2.15
"AoShin, Bard, Heimerdinger, Lulu, Ornn, Shen, TrainerDragon, Yasuo, Zoe",1,1.0,0,590,3.0724413297820004
"AoShin, Bard, DragonGold, DragonGreen, Ornn, Yasuo",1,1.0,71,8,2.875
"Bard, DragonBlue, Leona, Nunu, Soraka, Sylas, Yasuo, Yone",1,1.0,72,1,1.0
"Bard, Illaoi, Lulu, Nami, Ornn, Soraka, Varus, Yasuo, Zoe",1,1.0,39,227,3.208501741314241
"Bard, Illaoi, Lulu, Nami, Ornn, Soraka, Twitch, Varus, Yasuo",2,1.0,25,237,2.922690935803459
"Bard, Illaoi, Lulu, Nami, Ornn, Pyke, Twitch, Varus, Yasuo",1,1.0,25,237,2.922690935803459
"Bard, Illaoi, Lulu, Nami, Ornn, Sylas, Twitch, Varus, Zoe",1,1.0,25,237,2.922690935803459
"Bard, Illaoi, Lulu, Nami, Pyke, Sylas, Varus, Xayah, Yasuo, Zoe",1,1.0,73,1,1.0
"Bard, Illaoi, Lulu, Nami, Sylas, Twitch, Varus",1,1.0,25,237,2.922690935803459
"Bard, DragonGreen, Gnar, Neeko, Soraka",1,1.0,1,316,3.547021497021497
"AoShin, Bard, DragonGold, Lulu, Ornn, Soraka, Yasuo",1,1.0,71,8,2.875
"Bard, DragonGreen, Gnar, LeeSin, Lillia, Lulu, Neeko, Soraka",1,1.0,74,1,1.0
"Bard, DragonGreen, Gnar, Lulu, Neeko, Ryze, Soraka, Zoe",1,1.0,39,227,3.208501741314241
"AoShin, Bard, Heimerdinger, Lulu, Ornn, Ryze, Sylas, Talon, TrainerDragon, Zoe",1,1.0,0,590,3.0724413297820004
"AoShin, Bard, DragonGold, Ornn, Pyke, Yasuo, Zoe",1,1.0,6,510,3.4673890669769794
"AoShin, Bard, DragonGold, Ornn, Pyke, Soraka, Thresh, Yasuo",1,1.0,71,8,2.875
"Bard, DragonGreen, Hecarim, Lulu, Nami, Shen, Xayah, Yasuo",1,1.0,75,1,1.0
"AoShin, Bard, DragonGold, Ornn, Shyvana, Zoe",1,1.0,76,3,3.3333333333333335
"Bard, DragonGreen, Ezreal, Illaoi, Lulu, Ornn, Soraka, Varus",1,1.0,77,1,1.0
"Bard, DragonGreen, Heimerdinger, Lulu, Nami, Soraka, TrainerDragon, Yasuo, Zoe",1,1.0,78,1,1.0
"Diana, Nami, Ornn, Pyke, Qiyana, Ryze, Sylas, Talon",1,1.0,79,1,1.0
"Bard, DragonGreen, Lulu, Nami, Pyke, Talon, Twitch, Yasuo",1,1.0,80,1,1.0
"Bard, DragonGreen, DragonPurple, Elise, Neeko, Shyvana",1,1.0,81,2,2.5
"Bard, DragonGreen, Elise, Gnar, Neeko, Nidalee, Pyke",1,1.0,1,316,3.547021497021497
"Diana, Illaoi, Olaf, Ornn, Qiyana, Shen, Sylas, Talon",1,1.0,11,510,4.404484592464881
"Bard, Gnar, Neeko, Ornn, Pyke, Soraka, Sylas, Yasuo, Zoe",1,1.0,82,1,1.0
"Corki, DragonPurple, Lulu, Ornn, Pyke, Sona, TahmKench, TrainerDragon, Tristana",1,1.0,83,1,1.0
"AoShin, Ornn, Pyke, Soraka, Sylas, Yasuo, Zoe",1,1.0,84,54,4.620689655172414
"Bard, DragonBlue, Leona, Nunu, Talon, Twitch, Yasuo, Yone",1,1.0,85,2,3.0
"Bard, DragonBlue, Leona, Nunu, Sejuani, Soraka, Thresh, Yone, Zoe",1,1.0,86,5,3.25
"Bard, DragonBlue, Leona, Nunu, Yasuo, Yone",1,1.0,60,173,3.6427693833943837
"AoShin, Bard, Hecarim, Nunu, Ornn, Yasuo, Yone",1,1.0,55,81,4.365671641791045
"Bard, DragonBlue, Lulu, Nami, Yasuo, Yone",1,1.0,87,1,1.0
"Bard, DragonBlue, Lulu, Pyke, Sona, Sylas, TrainerDragon, Tristana, Zoe",1,1.0,9,795,3.863117852253815
"AoShin, Bard, Hecarim, LeeSin, Ornn, Pyke, Sylas, Yasuo",1,1.0,88,2,4.0
"Bard, Corki, DragonBlue, Illaoi, Jinx, Sona, TahmKench, Yasuo",1,1.0,89,24,2.605128205128205
"Bard, Corki, DragonBlue, Illaoi, Jinx, Ornn, Sylas, TahmKench",1,1.0,90,1,1.0
"Bard, Corki, DragonBlue, Nunu, Sylas, TahmKench, Yasuo, Zoe",1,1.0,91,1,1.0
"Bard, Corki, DragonBlue, Hecarim, Nunu, Sejuani, Sona, Yasuo",1,1.0,92,2,1.0
"Bard, Corki, DragonBlue, Hecarim, Jinx, Nunu, Sona, Yasuo",1,1.0,92,2,1.0
"Bard, Corki, DragonBlue, Hecarim, Lulu, Sona, TrainerDragon, Tristana, Yasuo",1,1.0,9,795,3.863117852253815
"Bard, Corki, DragonBlue, Jinx, LeeSin, Ornn, Sona, TahmKench",2,1.0,89,24,2.605128205128205
"Bard, Corki, DragonBlue, Jinx, Lulu, Nunu, Sona, Yasuo",1,1.0,93,1,1.0
"Bard, Corki, DragonBlue, Jinx, Lulu, TahmKench, TrainerDragon, Tristana, Yasuo",1,1.0,9,795,3.863117852253815
"Bard, Corki, DragonBlue, Jinx, Lulu, Sona, TrainerDragon, Tristana, Yasuo",1,1.0,9,795,3.863117852253815
"Bard, Corki, DragonBlue, Jinx, Lulu, Sona, Yasuo, Zoe",1,1.0,39,227,3.208501741314241
"Bard, Corki, DragonBlue, Lulu, Sona, TahmKench, Yasuo, Zoe",1,1.0,39,227,3.208501741314241
"Bard, Corki, DragonBlue, Lulu, Ornn, Shen, Sona, TahmKench",1,1.0,89,24,2.605128205128205
"Bard, Corki, Jinx, Lulu, Shen, Sona, TrainerDragon, Tristana, Yasuo, Zoe",1,1.0,94,1,1.0
"AoShin, Bard, Heimerdinger, Lulu, Ornn, Pyke, Soraka, Sylas, TrainerDragon, Zoe",2,1.0,0,590,3.0724413297820004
"Bard, Corki, Jinx, Lulu, Ornn, Sona, TahmKench, TrainerDragon, Tristana, Yasuo",2,1.0,9,795,3.863117852253815
"AoShin, DragonPurple, Ornn, Pyke, Soraka, Yasuo, Zoe",1,1.0,95,1,1.0
"AoShin, Bard, Heimerdinger, Lulu, Ornn, Pyke, Sona, Sylas, TrainerDragon",1,1.0,0,590,3.0724413297820004
"AoShin, Bard, Hecarim, Lillia, Ornn, Sylas, Yasuo, Zoe",1,1.0,6,510,3.4673890669769794
"Braum, Diana, Hecarim, Lillia, Olaf, Sylas, Talon, Thresh, Zoe",1,1.0,96,28,4.164705882352941
"DragonPurple, Elise, Neeko, Ornn, Pyke, Sylas, Talon, Yasuo",1,1.0,22,1225,4.750811401844438
"Bard, Corki, DragonGold, Jinx, Ornn, Sona, TahmKench",1,1.0,97,1,1.0
"AoShin, DragonPurple, Heimerdinger, Lulu, Ornn, Soraka, Sylas, TrainerDragon, Zoe",1,1.0,63,897,5.294043124972479
"AoShin, Bard, Hecarim, Nunu, Ornn, Pyke, Soraka, Yasuo",1,1.0,98,2,1.5
"Bard, Corki, DragonGold, Jinx, Lulu, Sona, Soraka, TrainerDragon, Tristana, Zoe",1,1.0,9,795,3.863117852253815
"DragonPurple, Elise, Neeko, Ornn, Pyke, Qiyana, Sylas, Yasuo",1,1.0,22,1225,4.750811401844438
"Bard, Corki, DragonGreen, Jinx, Lulu, Nami, Sona, TrainerDragon, Tristana",1,1.0,9,795,3.863117852253815
"AoShin, Bard, Diana, LeeSin, Ornn, Pyke, Qiyana, Talon",1,1.0,99,1,1.0
"Bard, Corki, DragonGreen, Gnar, Neeko, Pyke, Soraka, Yasuo",1,1.0,1,316,3.547021497021497
"Bard, Hecarim, Pyke, Ryze, Sejuani, Talon, Twitch, Yasuo, Zoe",1,1.0,100,1,1.0
"AoShin, Bard, Heimerdinger, Lulu, Ornn, Shen, Sylas, TrainerDragon, Zoe",1,1.0,0,590,3.0724413297820004
"Bard, Hecarim, Sejuani, Shen, Shyvana, Twitch, Xayah, Zoe",1,1.0,101,1,1.0
"Bard, Hecarim, Sejuani, Shyvana, Swain, Talon, Twitch, Xayah",1,1.0,53,434,4.10255703113372
"Bard, Hecarim, Sejuani, Shyvana, Swain, Twitch, Xayah, Yasuo",1,1.0,53,434,4.10255703113372
"AoShin, Bard, Heimerdinger, Lulu, Ornn, Sona, Soraka, Sylas, TrainerDragon",1,1.0,0,590,3.0724413297820004
"Braum, Diana, Hecarim, Lillia, Nami, Olaf, Sylas, Thresh, Yasuo",1,1.0,11,510,4.404484592464881
"Corki, Heimerdinger, Lulu, Pyke, Sona, Sylas, TahmKench, TrainerDragon, Tristana, Zoe",1,1.0,102,31,5.213333333333333
"Corki, Heimerdinger, Lulu, Ornn, Pyke, Sona, Sylas, TrainerDragon, Yasuo, Zoe",1,1.0,102,31,5.213333333333333
"AoShin, Bard, Corki, Jinx, Ornn, Shen, Sona, TahmKench",1,1.0,103,1,1.0
"Corki, Heimerdinger, Lulu, Ornn, Soraka, Sylas, TrainerDragon, Yasuo, Zoe",1,1.0,102,31,5.213333333333333
"Bard, Hecarim, Lillia, Nunu, Ryze, Sejuani, Talon, Twitch, Zoe",1,1.0,104,3,2.5
"Bard, Hecarim, Lillia, Nunu, Ornn, Sejuani, Shen, Twitch, Xayah, Yasuo",1,1.0,53,434,4.10255703113372
"Corki, Heimerdinger, Lulu, Sona, Soraka, Sylas, TahmKench, TrainerDragon, Tristana, Zoe",1,1.0,102,31,5.213333333333333
"AoShin, Lulu, Nami, Ornn, Soraka, Sylas, Vladimir, Yasuo",1,1.0,105,6,4.333333333333333
"Corki, Heimerdinger, Lulu, Nami, Ornn, Sona, Sylas, TrainerDragon, Tristana, Yasuo",1,1.0,106,1,1.0
"AoShin, Bard, Corki, Hecarim, Jinx, Nunu, Ornn, Sejuani",1,1.0,107,1,1.0
"Bard, Hecarim, Ornn, Ryze, Sejuani, Shen, Talon, Twitch, Xayah",1,1.0,53,434,4.10255703113372
"AoShin, Bard, Kayn, Ornn, Pyke, Ryze, Sylas, Zoe",1,1.0,108,1,1.0
"Bard, Hecarim, Ornn, Shyvana, Swain, Twitch, Xayah, Yasuo",1,1.0,53,434,4.10255703113372
"AoShin, Bard, Hecarim, Lulu, Ornn, Sejuani, Shen, Soraka, Yasuo",1,1.0,109,2,2.0
"DragonPurple, Elise, Neeko, Pyke, Soraka, Sylas, Taric, Zoe",2,1.0,37,76,3.7540935672514624
"Braum, Diana, Hecarim, Lillia, Olaf, Sejuani, Talon, Yasuo",1,1.0,11,510,4.404484592464881
"AoShin, Ornn, Ryze, Sylas, Thresh, Twitch, Zoe",1,1.0,110,1,1.0
"Bard, Hecarim, LeeSin, Ornn, Shen, Shyvana, Talon, Twitch, Xayah",1,1.0,53,434,4.10255703113372
"Bard, Hecarim, Lulu, Nami, Ornn, Shen, Talon, Xayah, Yasuo",1,1.0,53,434,4.10255703113372
"Bard, Hecarim, Lulu, Nami, Ornn, Qiyana, Shen, Talon, Xayah, Yasuo",1,1.0,53,434,4.10255703113372
"Bard, Hecarim, Lulu, Ornn, Shen, Soraka, Talon, Twitch, Xayah",1,1.0,53,434,4.10255703113372
"Bard, Hecarim, Pyke, Shen, Sylas, Talon, Twitch, Xayah, Yasuo",1,1.0,53,434,4.10255703113372
"Bard, DragonPurple, Neeko, Pyke, Sylas, Thresh, Zoe",1,1.0,39,227,3.208501741314241
"Bard, DragonPurple, Hecarim, Shen, Talon, Twitch, Xayah, Yasuo",1,1.0,53,434,4.10255703113372
"Bard, DragonPurple, Hecarim, Ornn, Pyke, Talon, Twitch, Yasuo",1,1.0,111,1,1.0
"Anivia, Bard, DragonGreen, Gnar, Lulu, Neeko, Soraka, Yasuo, Zoe",1,1.0,112,18,3.625
"Anivia, Bard, DragonGreen, Gnar, Lulu, Neeko, Yasuo, Zoe",1,1.0,112,18,3.625
"Anivia, Bard, DragonGreen, Elise, Lulu, Neeko, Pyke, Soraka",1,1.0,113,264,4.447631535131535
"Anivia, Bard, Hecarim, LeeSin, Lillia, Nunu, Ornn, Volibear, Yasuo",1,1.0,114,2,1.5
"DragonGold, Kayn, Pyke, Soraka, Thresh, Xayah, Yasuo, Zoe",1,1.0,115,107,4.65968253968254
"Heimerdinger, Lulu, Nami, Pyke, Ryze, Soraka, Sylas, TrainerDragon, Yasuo, Zoe",1,1.0,63,897,5.294043124972479
"DragonGold, Kayn, Pyke, Soraka, Thresh, Volibear, Yasuo, Zoe",1,1.0,115,107,4.65968253968254
"DragonPurple, Heimerdinger, Ornn, Pyke, Qiyana, Sylas, Talon, Zoe",1,1.0,116,2,4.0
"Anivia, Bard, DragonPurple, Elise, Gnar, Lulu, Neeko, Soraka, Swain",1,1.0,113,264,4.447631535131535
"AoShin, Bard, Lulu, Ornn, Shen, Sona, Yasuo",1,1.0,55,81,4.365671641791045
"Anivia, Ashe, Bard, DragonGreen, Gnar, Karma, Neeko, Yasuo",1,1.0,113,264,4.447631535131535
"Anivia, Ashe, Bard, DragonGreen, Gnar, Neeko, Soraka, Taric",1,1.0,113,264,4.447631535131535
"Anivia, Ashe, Bard, DragonGreen, Gnar, Neeko, Sona, Soraka",1,1.0,113,264,4.447631535131535
"Aatrox, DragonGold, Hecarim, Kayn, Ornn, Twitch, Volibear, Xayah",1,1.0,117,1,1.0
"AoShin, Gnar, Heimerdinger, Lulu, Neeko, Soraka, Sylas, TrainerDragon, Zoe",1,1.0,118,1,1.0
"Anivia, Ashe, Bard, Hecarim, LeeSin, Nunu, Ornn, Sejuani, Volibear",1,1.0,119,1,1.0
"DragonBlue, Hecarim, Lillia, Nunu, Sejuani, Talon, Yasuo, Yone",1,1.0,120,309,4.651911585419412
"DragonGold, Ornn, Pyke, Shen, Talon, Thresh, Yasuo, Zoe",1,1.0,121,1,1.0
"Anivia, Ashe, Karma, LeeSin, Ornn, Shen, Swain, Volibear, Yasuo",1,1.0,122,29,4.860526315789474
"DragonBlue, Hecarim, Leona, Lillia, Nunu, Yasuo",1,1.0,120,309,4.651911585419412
"Aatrox, DragonGold, Hecarim, Swain, Volibear, Xayah, Yasuo, Zoe",1,1.0,115,107,4.65968253968254
"Aatrox, Braum, DragonGold, Kayn, Soraka, Volibear, Xayah, Zoe",1,1.0,115,107,4.65968253968254
"Anivia, Ashe, DragonGreen, Gnar, Neeko, Sona, Soraka, Yasuo",1,1.0,113,264,4.447631535131535
"Aatrox, Braum, DragonGold, Kayn, Soraka, Swain, Talon, Xayah",1,1.0,123,1,1.0
"AoShin, Bard, Lulu, Ornn, Sona, Sylas, TrainerDragon, Tristana, Yasuo, Zoe",1,1.0,0,590,3.0724413297820004
"Aatrox, Braum, Diana, Olaf, Shen, Talon, Yasuo, Yone",1,1.0,124,59,4.585648148148148
"Anivia, Ashe, DragonGreen, Ezreal, Gnar, Neeko, Ornn, Soraka",1,1.0,113,264,4.447631535131535
"AoShin, DragonBlue, DragonGold, Hecarim, Nunu, Thresh",1,1.0,125,1,1.0
"DragonBlue, Hecarim, Leona, Nunu, Ornn, Sejuani, Yasuo, Zoe",1,1.0,126,1,1.0
"DragonBlue, Hecarim, Lulu, Nunu, Ornn, Sona, TahmKench, TrainerDragon, Tristana",1,1.0,127,1,1.0
"DragonGold, Kayn, Ornn, Shen, Soraka, Volibear, Xayah, Zoe",1,1.0,115,107,4.65968253968254
"DragonBlue, DragonGold, DragonPurple, Hecarim, Soraka, Thresh",1,1.0,128,1,1.0
"Ashe, DragonPurple, Elise, Gnar, Neeko, Pyke, Sylas, Yasuo",1,1.0,129,83,4.935790273556231
"AoShin, Hecarim, Lillia, Ornn, Ryze, Soraka, Sylas, Zoe",1,1.0,130,1,1.0
"Aatrox, DragonGold, Kayn, Shen, Volibear, Xayah, Yasuo, Zoe",1,1.0,115,107,4.65968253968254
"Ashe, Elise, Karma, Neeko, Sett, Shyvana, Swain, Yasuo",1,1.0,131,1,1.0
"DragonBlue, DragonGold, DragonPurple, Ryze, Sylas, Yasuo, Zoe",1,1.0,132,6,2.6666666666666665
"DragonGold, Hecarim, Kayn, Pyke, Talon, Twitch, Xayah, Yasuo",1,1.0,133,1,1.0
"Aatrox, DragonGold, Kayn, Nunu, Volibear, Yasuo, Zoe",1,1.0,115,107,4.65968253968254
"Aatrox, DragonGold, Kayn, Soraka, Thresh, Volibear, Yasuo, Zoe",1,1.0,115,107,4.65968253968254
